和名,学名,分布,生息場所,体長,深さ
ツバサハゼ,"Rhyacichthys aspro (Valenciennes, 1837)",屋久島、奄美大島、沖縄島、石垣島、西表島；西部太平洋,河川の渓流域、淵頭付近の岩盤,25cm,0.5m
ドンコ,"Odontobutis obscura (Temminck et Schlegel, 1845)",日本固有：新潟県・愛知県以西の本州、四国、九州；韓国巨済島,河川中流域から渓流域下部の淵、礫底・砂底,20cm,0.6m
イシドンコ,"Odontobutis hikimius Iwata et Sakai, 2002",日本固有：島根県西部と山口県東部の日本海斜面,河川の中流域から渓流域下部、淵の岩の下,10cm,0.5m
ヤエヤマノコギリハゼ,"Butis butis (Bleeker, 1853)",高知県、奄美大島、石垣島、西表島；インド・西太平洋,河川河口域のマングローブ林や感潮域最上流付近、ヒルギ類の根・倒木の根・水没したアダンの葉などの裏側,10cm,0.5m
ジャノメハゼ,"Bostrychus sinensis Lacepède, 1801",奄美大島、沖縄島、石垣島、西表島；インド・太平洋,河川の河口域のマングローブ林やその内陸部の汽水性湿地。昼間は死サンゴ塊や倒木の下、泥底の穴に単独で潜み、夜間活動する,20cm,0.3m
ホシマダラハゼ,"Eleotris fusca (Valenciennes, 1837)",種子島、奄美大島、沖縄島、久米島、宮古島、石垣島、西表島、与那国島；インド・太平洋,主に河川の汽水域や汽水性湿地。淡水域にも入る。倒木や水生植物が多い淀み、マングローブ林内の淀みに多い,45cm,2m
カワアナゴ,"Eleotris oxycephala Temminck et Schlegel, 1845",千葉県・鳥取県～屋久島、瀬戸内海沿岸；東シナ海,河川の汽水域直上の淡水域。主に礫底や砂底のテトラポッド、岩、倒木の陰に単独で見られる,30cm,1m
オカメハゼ,"Eleotris melanosoma Bleeker, 1852",静岡県～西表島；インド・太平洋,河川の河口から感潮域最上流、マングローブ林,15cm,
チチブモドキ,"Eleotris acanthopoma Bleeker, 1853",小笠原諸島、伊豆諸島、千葉県・五島列島～与那国島；インド・西太平洋,岩、礫、死サンゴ塊、倒木、水生植物の陰,15cm,0.5m
テンジクカワアナゴ,"Eleotris fusca (Forster, 1801)",小笠原諸島、静岡県、宮崎県～与那国島；インド・太平洋,河川の感潮域最上流、中流域、渓流域、細流・水田・湿地などの淡水域,20cm,0.5m
タナゴモドキ,"Hypseleotris cyprinoides (Valenciennes, 1837)",和歌山県、高知県、宮崎県、奄美大島、沖縄島、宮古島、石垣島、西表島；インド・太平洋,水田や湿地の溜池や溝、細流の緩流部、河川本流脇の池やワンド、河川中流域の淵、河川の堰堤下。流れが緩やかで岸付近に水生植物や倒木が多いところに群がりで中層を浮遊,8cm,0.5m
タメトモハゼ,Ophieleotris sp. A,種子島、屋久島、琉球列島；インド・西太平洋,河川本流脇の池やワンド、河川中流域の淵、渓流域下部の河岸、細流の緩流部。群がりで浮遊。河川渓流域にも見られる,35cm,0.5m
タメトモハゼ,Ophieleotris aporos,西表島,細流の緩流部,14cm,0.5m
エリトゲハゼ,Bostrychus sinensis,西表島；西部太平洋,河川の渓流域、岩の陰,6cm,0.2m
モンヤナギハゼ,Xenisthmus polyzonatus,慶良間諸島、奄美大島、石垣島、沖縄諸島；インド・太平洋,サンゴ礁域の礁池、死サンゴ片や砂底、死サンゴ塊下,2.5cm,7m
トカゲハゼ,Scartelaos histophorus,沖縄島中城湾；南・東南アジアを中心としたインド・西太平洋,内湾湾奥の軟泥干潟、底の穴、干潟上,8cm,
ムツゴロウ,"Boleophthalmus pectinirostris (Linnaeus, 1758)",有明海、八代海；渤海、黄海、東・南シナ海、台湾,河口に連なる広大な軟泥干潟。底に穴を掘り、干出時には干潟上で活動し、それ以外は生息孔中にすむ,20cm,
トビハゼ,"Periophthalmus modestus Cantor, 1842",東京湾〜種子島、沖縄島、瀬戸内海、有明海；渤海、黄海、東・南シナ海、台湾,内湾の湾奥や河川の河口域の泥干潟。冬は底の穴ですごし、他の季節は干出時に干潟上で活動し、岸辺に這い上がり休息する,10cm,
ミナミトビハゼ,"Periophthalmus argentilineatus Valenciennes, 1837",種子島、屋久島、琉球列島；インド・太平洋,河川の河口付近の海岸から感潮域最上流。とくに河口域の泥干潟や汽水性湿地に多く、干出時に泥面で活動し、それ以外は岸辺に這い上がり休息する,12cm,
ヨロイボウズハゼ,"Sicyopterus zahavati Sakai et Nakamura, 1979",日本固有: 種子島、屋久島、奄美大島、沖縄島、石垣島、西表島,河川の渓流域、淵頭付近の岩盤や転石上,6.5cm,0.2m
アカボウズハゼ,"Sicyopus zosterophorum (Bleeker, 1857)",種子島、屋久島、奄美大島、沖縄島、石垣島、西表島; 西部太平洋,河川の渓流域の淵、中層を遊泳,6cm,0.3m
カエルハゼ,"Sicyopterus japonicus Sakai et Nakamura, 1979",屋久島、石垣島、西表島、与那国島；マリアナ諸島,河口近くに渓流域がある河川の渓流域。やや薄暗いところを好み、流れの緩やかな淵に単独で見られる,6cm,0.3m
ルリボウズハゼ,"Sicyopterus lagocephalus (Pallas, 1770)",小笠原諸島父島、種子島、屋久島、奄美大島、沖縄島、久米島、石垣島、西表島、与那国島；インド・西太平洋,河川の渓流域。流れの速いところを好み、淵尻や瀬頭の岩盤や転石上に群がりで見られる。小・中の滝であれば遡上する,13cm,0.5m
ボウズハゼ,"Sicyopterus japonicus (Tanaka, 1909)",小笠原諸島、福島県・兵庫県日本海側～西表島；韓国、台湾,河川の渓流域。流れの速いところを好み、淵尻や瀬頭の岩盤や転石上に群がりで見られる。小・中の滝であれば遡上し、その上流にも見られる。,20cm,0.2〜0.5m
ナンヨウボウズハゼ,"Sicyopterus macrostetholepis Wilson et Chen, 1998",小笠原諸島、静岡県、高知県、宮崎県、鹿児島県、種子島、屋久島、琉球列島；台湾、グァム、パラオ,河川の中流域や渓流域。流れの緩やかなところを好み、淵や平瀬の転石上に見られ、中層を泳いで移動する。,5cm,0.2〜0.3m
コンテリボウズハゼ,Stiphodon ornatus,種子島、屋久島、奄美大島、沖縄島、石垣島、西表島；台湾、マレーシア、フィリピン,河川の渓流域、流れの緩やかな淵や平瀬の転石上,6cm,0.3m
カキイロヒメボウズハゼ,"Stiphodon atropurpureus Watson et Kottelat, 1995",屋久島；フィリピン,河川の渓流域。流れの緩やかな淵の転石上,2.5cm,0.3m
シラスキバハゼ,"Pariotogobius amplexicollis Iwata, Hosoya et Larson, 2001",沖縄島、西表島；タイ、オーストラリア北東海岸,内湾湾奥の軟泥底や泥底の穴,2.1cm,10m
ミミズハゼ,"Luciogobius guttatus Gill, 1859",北海道の太平洋側・日本海側～屋久島、瀬戸内海沿岸、隠岐、壱岐、対馬、五島列島；朝鮮半島、渤海、黄海、東シナ海、台湾、沿海州,河川の汽水域から下流域、淡水の影響のある海岸の潮間帯。礫下や間に潜む。,8cm,0.5m
オオミミズハゼ,"Luciogobius grandis Arai, 1970",青森県～高知県・長崎県、佐渡島、対馬；朝鮮半島,外海に面した岩礁性海岸や転石海岸の潮間帯。転石間に見られる。,11cm,0.5m
ヒモハゼ,"Eutaeniichthys gilli Jordan et Snyder, 1901",青森県の太平洋・日本海側～九州、瀬戸内海沿岸、対馬、五島列島；朝鮮半島、渤海、黄海,河口や河口域の干潟、前浜干潟。砂底や砂泥底に掘られたアナジャコやカニ類の生息孔で見られる。,6cm,0.7m
キマダラハゼ,"Astrabe lactisella Akihito et Meguro, 1988",日本固有: 伊豆大島、相模湾、伊豆半島、鹿児島馬毛島、種子島,岩礁性海岸の潮間帯下部、粗めの砂礫上の転石間や下,5cm,4m
シロクラハゼ,"Astrabe lactisella Jordan et Snyder, 1901",日本固有: 宮城県～三重県,岩礁性海岸の潮間帯下部、砂底に転石が積み重なったところの転石間や下,5cm,3m
シモフリセジロハゼ,"Ctenogobius griseus Snyder, 1911",日本固有: 伊豆諸島、長崎県、種子島、屋久島,岩礁性海岸の潮間帯下部、粗めの砂礫上の転石間や下,5cm,3m
オキナワハゼ,"Callogobius hasseltii (Bleeker, 1851)",伊豆半島、徳島県、高知県柏島、鹿児島県、琉球列島; インド・太平洋,サンゴ礁域の礁池・礁湖・礁原・礁斜面、砂底の死サンゴ片や死サンゴ塊の下,4-7cm,12m
ナメラハゼ,Callogobius okinawae,琉球列島;中・西部太平洋,内湾の湾奥、サンゴ礁域の礁池・礁原。ビーチロックのタイドプールや岸寄りの砂底の死サンゴ片・死サンゴ塊の下。生息水深1.5m以浅,8cm,0.5m
ズングリハゼ,Callogobius flavobrunneus,奄美大島、沖縄諸島、八重山諸島;西インド洋,サンゴ礁域の礁池・礁湖・礁原・礁斜面。砂底の死サンゴ片や死サンゴ塊の下。生息水深3〜10m,5cm,4m
タネハゼ,"Callogobius tanegasimae (Snyder, 1908)",静岡県、三重県、和歌山県、高知県、宮崎県、鹿児島県～与那国島、五島列島；台湾、フィリピン,河川の河口付近の海岸から感潮域最上流。泥底や砂泥底の死サンゴ塊の隙間や下、マングローブの気根の隙間。生息水深1.5m以浅,12cm,1m
シュンカンハゼ,"Callogobius shunkanensis Koumans, 1953",伊豆諸島、相模湾、伊豆半島、和歌山県、愛媛県宇和海、高知県、鹿児島県、琉球列島；インド・太平洋,サンゴ礁域の礁池、岩礁域。砂底にある転石の間や下、岩と砂底の境にある隙間に単独で生息。生息水深3-15m,10cm,9m
フタスジハゼ,"Callogobius sclateri (Steindachner, 1879)",小笠原諸島、高知県柏島、琉球列島；インド・太平洋,サンゴ礁域の礁池、礁湖、礁原、礁斜面。砂底の死サンゴ片や死サンゴ塊の下に単独で生息。生息水深3-10m,5cm,6m
クロイトハゼ,"Valenciennea helsdingenii (Bleeker, 1858)",伊豆大島、神奈川県、静岡県、紀伊半島、徳島県、愛媛県、高知県、沖縄諸島、西表島；インド・太平洋,内湾、サンゴ礁域の礁斜面。成魚はサンゴ礫混じりの砂底。生息水深3-35m,25cm,20m
サザナミハゼ,"Valenciennea longipinnis (Lay et Bennett, 1839)",伊豆半島、琉球列島；インド・西太平洋,河川の河口、内湾の湾奥、サンゴ礁域の礁池・礁原。死サンゴ片混じりの砂泥底や砂底。生息水深0.3-10m,25cm,3m
ミズタマハゼ,"Valenciennea sexguttata (Valenciennes, 1837)",慶良間諸島、八重山諸島；インド・太平洋,内湾の湾奥、サンゴ礁域の礁原。まれに河川の河口。死サンゴ片混じりの砂泥底や砂底。生息水深1-8m,25cm,4m
オトメハゼ,Valenciennea puellaris,小笠原諸島、相模湾、伊豆半島、紀伊半島、高知県、愛媛県、琉球列島；インド・太平洋,河川の河口、内湾、サンゴ礁域の礁池・礁湖・礁原。死サンゴ片混じりの砂泥底や砂底。水深1-35m,20cm,15m
アカネハゼ,Valenciennea bella,沖縄諸島、石垣島、西表島；フィリピン,内湾の湾口から中程、サンゴ礁域の礁斜面。やや深所の砂混じりのガレ場や砂礫底。水深20-40m,12cm,30m
ヒメクロイトハゼ,"Valenciennea parva Hoese et Larson, 1994",高知県、奄美大島、慶良間諸島、八重山諸島；インド・太平洋,内湾の中程から湾奥、サンゴ礁域の礁原・礁斜面の砂泥底や砂底。生息水深2-25m,7cm,6m
アカハチハゼ,"Valenciennea strigata (Broussonet, 1782)",小笠原諸島、八丈島、相模湾、伊豆半島、和歌山県、高知県、種子島、屋久島、琉球列島；インド・太平洋,内湾の湾口、サンゴ礁域の礁外縁・礁斜面の死サンゴ片混じりの砂底やガレ場。生息水深3-20m,20cm,10m
アカハチハゼ,Zalembius rosaceus,伊豆大島、相模湾、静岡県、紀伊半島、高知県、奄美大島、沖縄諸島、西表島；インド・西太平洋,内湾の湾内に生息。砂泥底や砂底に見られる。生息水深は6-20m。,18cm,12m
アオイトハゼ,"Valenciennea caledonicus Hoese et Larson, 1994",琉球列島；西部太平洋,内湾の中程から湾奥、サンゴ礁域の礁斜面に生息する。死サンゴ片混じりの砂泥底、砂泥混じりのガレ場に見られる。生息水深は25-55m。,16cm,32m
イレズミハゼ,"Priolepis semidoliata (Valenciennes, 1837)",小笠原諸島、八丈島、紀伊半島、種子島、屋久島、琉球列島；インド・太平洋,河川の河口周辺、内湾の湾奥、サンゴ礁域の礁池・礁原。砂底や藻場の死サンゴ塊下、タイドプールの穴に単独かペアで見られる。生息水深2m以浅,3cm,15m
フトスジイレズミハゼ,"Priolepis palliditaenia Winterbottom et Burridge, 1993",小笠原諸島、伊豆諸島、相模湾、駿河湾、紀伊半島、徳之島、奄美大島、沖縄島；台湾,イレズミハゼとほぼ同様な環境に生息する。生息水深3〜13m,3cm,6m
ミサキスジハゼ,"Priolepis bourbonensis (Snyder, 1909)",青森県の太平洋・日本海側〜九州、瀬戸内海；朝鮮半島、台湾,岩礁域の岩の割れ目や穴などに単独で見られる。生息水深10〜23m,4cm,9m
ベンケイハゼ,"Priolepis cincta (Regan, 1908)",小笠原諸島、伊豆諸島、千葉県、相模湾、静岡県〜西表島、瀬戸内海；インド・太平洋,内湾の中程から湾奥、サンゴ礁域の礁原・礁斜面。サンゴの根の亀裂や岩穴の天井面に単独かペアで見られる。生息水深3〜30m,5cm,20m
コクテンベンタイハゼ,Priolepis sp. A,小笠原諸島、千葉県、伊豆諸島、相模湾、伊豆半島、紀伊半島、愛媛県宇和海、高知県柏島、鹿児島県、沖縄諸島、伊江島,岩礁域の岩穴や亀裂内、単独で生息。水深20-40m,6cm,27m
アミメベンケイハゼ,"Priolepis naraharae (Smith, 1949)",伊豆諸島八丈島、高知県柏島、琉球列島；インド・太平洋,内湾、サンゴ礁域の礁原。砂底の死サンゴ片や死サンゴ塊の裏面、単独かペアで生息。水深5m,4cm,8m
シマインゼ,Eviota sp. A,屋久島、トカラ列島、奄美大島、喜界島、徳之島、久米島、宮古島、石垣島、西表島,サンゴ礁域の礁池、礁外縁、岩礁性海岸。岩礁や洞窟にある窪みに主に単独で生息。生息水深3-10m。,2.5cm,10m
イチモンジハゼ,"Trimma grammistes (Tomiyama, 1936)",伊豆諸島、千葉県～鹿児島県、山形県、佐渡島、石川県、隠岐諸島、済州島、台湾,岩礁域の岩表面、単独で生息。生息水深は20m以深,3.5cm,25m
オオメハゼ,"Trimma macrophthalma (Tomiyama, 1936)",八丈島、伊豆半島、相模湾、紀伊半島、高知県柏島、口之永良部島、沖縄諸島、西表島、インド・太平洋,内湾・サンゴ礁域のドロップオフ、サンゴの根の窪みの天井面・崖壁の亀裂内に単独で生息。生息水深は3～20m,2.5cm,6m
ニンギョウベニハゼ,"Trimma sheppardi Winterbottom, 1984",奄美大島、沖縄諸島伊江島、石垣島、西表島；インド洋,内湾、サンゴ礁域のドロップオフ。サンゴの根の窪みの天井面、崖壁の亀裂内に単独で生息。生息水深10-55m,2.5cm,30m
アオギハゼ,"Trimma caudomaculatum Yoshino et Araga, 1975",八丈島、紀伊半島、高知県、琉球列島；台湾,内湾、サンゴ礁域の礁斜面、ドロップオフ。サンゴの根の下、崖壁の洞窟入り口や亀裂下で群がりホバリング。生息水深6-55m,4cm,10m
チゴベニハゼ,"Trimma naudei Smith, 1957",紀伊半島、琉球列島；インド・太平洋,内湾の湾口から湾奥、サンゴ礁域の礁斜面、ドロップオフ。サンゴの根の壁面や下、崖壁の亀裂内に単独で生息。生息水深3-20m,3.5cm,6m
ベニハゼ,"Trimma caesiura Jordan et Seale, 1906",八丈島、紀伊半島、琉球列島、中・西部太平洋,内湾の湾口から中程、サンゴ礁域の礁斜面、ドロップオフ。サンゴの根の壁面や下、崖壁の亀裂内に単独で見られる。生息水深3-20m,3.5cm,8m
ウロコベニハゼ,"Trimma emeryi (Goren, 1978)",小笠原諸島、奄美大島、沖縄諸島、西表島、インド・西太平洋,内湾の湾口から湾奥、サンゴ礁域の礁斜面。主にガレ場の死サンゴ片の裏に単独または複数で見られる。崖壁の亀裂内でも見られる。生息水深10-35m,2.5cm,15m
オヨギベニハゼ,"Trimma nasa'yamai Lobel, 1979",八丈島、伊豆半島、紀伊半島、沖縄諸島、宮古島、西表島、インド・太平洋,内湾の湾口から中程、サンゴ礁域の礁斜面、ドロップオフ。サンゴの根の下、崖壁の洞窟入り口や亀裂下で群がりホバリングを行う。生息水深6-55m,2.5cm,30m
オキナワベニハゼ,"Trimma okinawae (Aoyagi, 1949)",小笠原諸島、八丈島、相模湾～鹿児島県、琉球列島；インド・太平洋,内湾の湾口から湾奥、サンゴ礁域の礁斜面、ドロップオフ。サンゴの根の壁面、崖壁の亀裂内に単独で見られる。生息水深3-55m,3.5cm,10m
カスリモヨウベニハゼ,"Trimma grammistes Winterbottom, 1984",奄美諸島、西表島；インド・西太平洋,内湾の中程から湾奥、サンゴ礁域の礁斜面。内湾のユビエダハマサンゴの周辺に多く、群がりで遊泳する。生息水深5-35m,2.5cm,10m
シボリイソハゼ,Eviota sp. A,奄美大島、西表島,内湾の湾奥、サンゴの根の窪みの天井面、ガレ場の死サンゴ片や死サンゴ塊の隙間や裏面に単独で生息。生息水深5-20m,3cm,5m
トラノコイソハゼ,"Eviota lachdebris Karnena et Lachner, 1981",八丈島、沖縄諸島、石垣島、西表島；中・西部太平洋,内湾の湾口、岩礁性海岸、サンゴ礁域の礁外縁。波当たりや潮通しの良い場所。生息水深3-8m,2.5cm,6m
アカイソハゼ,Eviota sp. B,小笠原諸島、伊豆大島、相模湾～鹿児島県、沖縄諸島,外洋に面した岩礁域。岩の隙間や転石の下。生息水深5-15m,4cm,14m
イソハゼ,"Eviota abax (Jordan et Snyder, 1901)",小笠原諸島、伊豆諸島、青森県の太平洋側・日本海側～琉球列島、瀬戸内海；朝鮮半島,岩礁性海岸の潮間帯のタイドプール。岩の隙間や転石の下。生息水深15m以浅,4cm,1m
ホシヒレイソハゼ,"Eviota queenslandica Whitley, 1932",相模湾、琉球列島；インド・西太平洋,内湾。ガレ場、死サンゴ片や死サンゴ塊混じりの砂礫底。生息水深3-6m,3cm,6m
コメツブイソハゼ,Eviota sp. C,奄美大島、八重山諸島,内湾のガレ場の死サンゴ片や死サンゴ塊の隙間、生息水深3-6m,2cm,4m
コビトイソハゼ,"Eviota bikiniensis Jordan et Seale, 1906",小笠原諸島、加計呂間島、沖縄諸島、八重山諸島；インド・太平洋,内湾・サンゴ礁域の礁池の死サンゴ塊の隙間、生息水深約6m,3cm,2m
マメイソハゼ,"Eviota herrei Jordan et Seale, 1906",慶良間諸島、八重山諸島；中・西部太平洋,内湾・サンゴ礁域の礁池や礁湖の死サンゴ塊の隙間、生息水深約14m,2.5cm,14m
ミツボシイソハゼ,"Eviota prasites Jewett et Lachner, 1983",沖縄諸島、八重山諸島；中・西部太平洋,内湾の湾口から中程・サンゴ礁域の礁斜面のガレ場、生息水深3-10m,2.5cm,8m
ミナミイソハゼ,"Eviota japonica Jewett et Lachner, 1983",日本固有: 紀伊半島、高知県、種子島、琉球列島,河川の河口域、内湾の湾奥、サンゴ礁域の礁原。死サンゴ片混じりの砂底やガレ場。生息水深1-3m,2.5cm,2m
ナンヨウミドリハゼ,"Eviota prasina (Klunzinger, 1871)",小笠原諸島、八丈島、伊豆半島、和歌山県、徳島県、高知県、種子島、琉球列島; インド・太平洋,内湾、サンゴ礁域の礁池。タイドプール、ガレ場の死サンゴ片や死サンゴ塊の隙間。生息水深6m以浅,3.5cm,0.3m
クロホシイソハゼ,"Eviota smaragdus Jordan et Seale, 1906",小笠原諸島、相模湾、琉球列島; 中・西部太平洋,岩礁性海岸。潮間帯上部のタイドプール。生息水深0.2-0.5m,3cm,0.3m
アカホシイソハゼ,"Eviota melasma Lachner et Karnena, 1980",伊豆半島、高知県、琉球列島；インド・太平洋,内湾の湾口から湾奥、サンゴ礁域の礁外縁、礁斜面。サンゴの根の上に単独で見られる。,2.5cm,3-15m
シロイソハゼ,"Eviota albolineata Jewett et Lachner, 1983",小笠原諸島、伊豆諸島、相模湾、伊豆半島、紀伊半島、高知県、鹿児島県、琉球列島；インド・太平洋,内湾の湾口から中程、サンゴ礁域の礁外縁、礁斜面。サンゴの根の上に単独で見られる。,3cm,3-15m
クロスジイソハゼ,"Eviota sociola Jordan et Seale, 1906",小笠原諸島、伊豆半島、紀伊半島、日永良部島、奄美大島、沖縄諸島、宮古島、石垣島、西表島；インド・太平洋,内湾の湾口から中程、サンゴ礁域の礁斜面。葉状や被覆状のコモンサンゴ類の上に単独で見られる。,3cm,5-30m
ニセクロスジイソハゼ,"Eviota ocellifer Jewett et Lachner, 1983",奄美大島、沖縄諸島、西表島、中・西部太平洋,内湾の湾口から中程、サンゴ礁域の礁斜面、ガレ場。生息水深5-20m,2.5cm,6m
ハナグロイソハゼ,Eviota sp. D,小笠原諸島、高知県、奄美大島、沖縄諸島、石垣島、西表島,内湾の湾口から湾奥、サンゴ礁域の礁原・礁斜面、サンゴの根周辺、ガレ場、死サンゴ片や死サンゴ塊混じりの砂礫底。生息水深1-15m,2.5cm,5m
アオイソハゼ,"Eviota prasites Jordan et Seale, 1906",小笠原諸島、紀伊半島、徳島県、愛媛県宇和海、高知県柏島、琉球列島、中・西部太平洋,内湾の湾口から湾奥、サンゴ礁域の礁斜面、サンゴの根周辺やガレ場。生息水深5-20m,3cm,8m
スミツキイソハゼ,"Eviota infraspinata (Smith, 1957)",沖縄諸島、八重山諸島；インド・太平洋,内湾の中程から湾奥、サンゴ礁域の礁池・礁湖・礁斜面。死んで苔などがついたサンゴの上やガレ場に単独で生息。水深3-15m,2.5cm,6m
オビイソハゼ,"Eviota latifasciata Jewett et Lachner, 1983",小笠原諸島、八丈島、伊豆半島、沖縄諸島、久米島、西表島；インド・太平洋,内湾の湾口、サンゴ礁域の礁外縁・礁斜面。波当たりや潮通しの良いところに単独で生息。水深3-10m,2cm,5m
キンホシイソハゼ,"Eviota storthynx (Rosen, 1959)",小笠原諸島、徳島県、愛媛県宇和海、高知県柏島、鹿児島県、琉球列島；インド・太平洋,内湾の湾奥。岩礁・転石上・サンゴの根上・死サンゴ塊混じりのガレ場に単独で生息。水深3-20m,3cm,20m
シロオビイソハゼ,Eviota pellucida,屋久島、久米島、西表島；中・西部太平洋,内湾のサンゴの根の窪み。単独で見られ、底生だがホバリングもする。生息水深6-30m,2.5cm,30m
オヨギイソハゼ,Eviota kasora,奄美大島、慶良間諸島、宮古島、八重山諸島；インド・西太平洋,内湾の湾口から湾奥、サンゴ礁域の礁池・礁湖・礁斜面。ガレ場や枝状・テーブル状サンゴ周囲に群れで遊泳。生息水深3-30m,3cm,8m
ソメワケイソハゼ,Eviota nigriventris,琉球列島；インド・太平洋,内湾の湾口から湾奥、サンゴ礁域の礁池・礁湖・礁斜面。ガレ場や枝状・テーブル状サンゴ周囲に小群れまたは単独で遊泳。生息水深3-30m,2.5cm,10m
フタボシイソハゼ,"Eviota lachdeberei Giltay, 1933",奄美大島、慶良間諸島、八重山諸島；インド・太平洋,内湾の中程から湾奥、密集した枝状サンゴの中や周囲、生息水深3-20m,2.5cm,6m
アカネグルマハゼ,"Paragobiodon lacunicolus (Bleeker, 1852)",琉球列島;インド・太平洋,内湾の湾口から湾奥、サンゴ礁域の礁池・礁湖・礁斜面。トゲサンゴ属の枝間にペアまたは数尾で見られる。生息水深3-20m,2.5cm,4-8m
クログルマハゼ,"Paragobiodon melanosoma (Bleeker, 1852)",琉球列島;インド・太平洋,サンゴ礁域の礁池・礁湖・礁斜面。トゲサンゴ属の枝間に単独かペアで見られる。生息水深15-30m,2.5cm,14m
パンダダルマハゼ,"Paragobiodon lacunicolus (Kendall et Goldsborough, 1911)",小笠原諸島、紀伊半島、高知県、琉球列島；インド・太平洋,内湾の湾口から中程、サンゴ礁域の礁外縁・礁斜面、ハナヤサイサンゴ属の枝間にペアで見られる。生息水深1-10m,2.5cm,4m
