和名,学名,分布,生息場所,体長,深さ
クロクモハゼ,"Bathygobius niger (Smith, 1960)",八丈島、日之永良部島、沖縄島；インド洋,サンゴ礁域の岩礁性海岸、石灰岩海蝕崖下のタイドプール転石下に生息。幼魚は水深2mのクロウエの棘間でも確認,5cm,1m
カワクモハゼ,Bathygobius sp. A,西表島、バリ島,河川の河口域。岩の隙間やカキ殻の間に単独で見られる,4.5cm,1m
スジクモハゼ,"Bathygobius cocosensis (Bleeker, 1854)",小笠原諸島、八丈島、千葉県～与那国島、インド・太平洋,河川の河口周辺、岩礁性海岸、サンゴ礁域の礁原内縁。死サンゴ片や砂泥底、タイドプールに単独で見られる。生息水深は2m以浅,6cm,0.5m
クロヤハズハゼ,"Bathygobius padangensis (Bleeker, 1851)",小笠原諸島、伊豆諸島、千葉県、相模湾、伊豆半島、三重県、高知県、鹿児島県、屋久島、種子島、琉球列島、インド・西太平洋,河川の河口周辺、岩礁性海岸、サンゴ礁域の礁原内縁。死サンゴ片や砂泥底、タイドプールに単独で見られる。生息水深は2m以浅,10cm,0.5m
クロホシヤリヽズハゼ,Bathygobius cotticeps,相模湾、静岡県、淡路島、高知県、宮崎県、鹿児島県、種子島、屋久島、奄美大島、沖縄島；西部太平洋,内湾の砂泥底や砂底にある岩の周辺や窪み、生息水深4-6m,6cm,6m
ホタテツブハゼ,Flabelligobius sp. A,伊豆大島、和歌山県、高知県、奄美大島、沖縄諸島；西部太平洋,内湾の湾口・サンゴ礁域の礁斜面、礫混じりの砂底、コトブキテッポウエビと共生、生息水深30-40m,4cm,38m
ヒメオニハゼ,"Tomiyamichthys latruncularius Iwata, Ohnishi et Hirata, 2000",伊豆半島、高知県柏島、奄美大島、沖縄諸島、西表島；インドネシア,内湾の湾口から中程、サンゴ礁域の礁斜面。礫混じりの砂底でコトブキテッポウエビと単独かペアで共生。生息水深20-35m,5cm,30m
オニハゼ,Tomiyamichthys oni,日本固有: 小笠原諸島、伊豆大島、千葉県～鹿児島県、奄美大島、沖縄諸島、久米島、西表島,内湾の湾口から中程、サンゴ礁域の礁斜面、礫混じりの砂底や砂泥底、テッポウエビ類と共生,11cm,10-35m
オドリハゼ,"Lotilia graciliosa Klausewitz, 1960",紀伊半島、奄美大島、沖縄諸島、石垣島、西表島；インド・太平洋,内湾の湾口から湾奥、サンゴ礁域の礁池・礁湖・礁斜面、ドロップオフ下の砂底・砂泥底。ダンスゴビーシュリンプと共生。生息水深1-50m。,4cm,15m
ネジリンボウ,"Stonogobiops xanthorhinica Hoese et Randall, 1982",,,6.5cm,9m
ヒレナガネジリンボウ,"Stonogobiops nematodes Hoese et Randall, 1982",伊豆諸島、相模湾、伊豆半島、和歌山県田辺湾、愛媛県宇和海、高知県柏島、奄美大島、沖縄諸島、八重山諸島；インド・西太平洋,内湾の湾口から中程、サンゴ礁域の礁斜面。礫混じりの砂底でコトブキテッポウエビと共生。生息水深30-55m,5cm,32m
キツネメネジリンボウ,"Stonogobiops sp. punctulatus Iwata et Hirata, 1994",日本固有：伊豆半島大瀬崎、高知県柏島,内湾から外洋に面した開けた細かいきれいな砂底。コトブキテッポウエビと共生。生息水深20-50m,4cm,28m
ヤシャハゼ,"Stonogobiops yasha Yoshino et Shimada, 2001",小笠原諸島、伊豆諸島、伊豆半島、紀伊半島、高知県柏島、奄美大島、沖縄諸島、八重山諸島；西部太平洋,内湾の湾口から中程、サンゴ礁域の礁斜面。礫混じりの砂底でコトブキテッポウエビと単独かペアで共生。巣穴の上でホバリング。生息水深15-55m,6cm,26m
ホシゾラハゼ,Cryptocentrus sp. A,奄美大島、西表島；西部太平洋,内湾の湾奥。軟泥底から砂泥底でテッポウエビ類と単独かペアで共生。生息水深2-15m,6.5cm,6m
タカノハハゼ,Cryptocentrus insignitus,広島県、種子島、琉球列島; インド・西太平洋,河川の河口周辺やマングローブ林、内湾の湾奥。礫混じりの砂泥底でテッポウエビ類と単独で共生。生息水深3m以浅,6cm,15m
イトヒキハゼ,Cryptocentrus filifer,千葉県、新潟県～鹿児島県、瀬戸内海; インド・西太平洋,内湾の軟泥底から砂泥底でニセオニテッポウエビなどと単独で共生。生息水深6-25m,13cm,7m
ヒノマルハゼ,Cryptocentrus strigilliceps,奄美大島、沖縄諸島、西表島; インド・太平洋,内湾の中程から湾奥。礫混じりの砂泥底でテッポウエビ類と単独で共生。生息水深2-15m,6cm,3m
クロホシハゼ,Cryptocentrus sp.,和歌山県、高知県柏島、屋久島、琉球列島；西部太平洋,内湾の湾口から中程、サンゴ礁域の礁原・礁斜面。ドロップオフの亀裂下の砂溜まり、礫や死サンゴ片混じりの砂底でクマドリテッポウエビと共生,10cm,6-20m
シロオビハゼ,Cryptocentrus albidorsus,八丈島、和歌山県、宮崎県、種子島、琉球列島；台湾,内湾、サンゴ礁域の礁原。砂底、礫や死サンゴ片混じりの砂底、タイドプールでテッポウエビ属の1種と共生,10cm,10m以浅（とくに2m以浅）
オイランハゼ,Cryptocentrus singapurensis,,,12cm,15m
ブチハゼ,Cryptocentrus inexplicatus,石垣島、西表島;西部太平洋,内湾の湾奥。砂泥底や礫混じりの砂泥底で、テッポウエビ類と単独で共生。生息水深3m以浅,6.5cm,3m
ギンガハゼ,Cryptocentrus cinctus,奄美大島、八重山諸島;インド・太平洋,内湾の中程から湾奥。礫混じりの砂底や砂泥底で、テッポウエビ類と単独かペアで共生。生息水深1-6m,6.5cm,3m
フタホシタカノハハゼ,Cryptocentrus sp. B,奄美大島、沖縄諸島、西表島；インド・西太平洋,内湾の中程から湾奥、礫混じりの砂泥底、テッポウエビ類と単独で共生、水深10-50m,8cm,20m
シリゼ,"Cryptocentrus shigei Kuroda, 1956",日本固有：千葉県、相模湾、伊豆半島、静岡県、紀伊半島、高知県,内湾の湾口から中程、砂泥底でテッポウエビ類と共生、水深15-40m,12cm,16m
ヤマブキハゼ,"Amblyeleotris steinitzi (Fowler, 1938)",紀伊半島、高知県柏島、琉球列島；インド・太平洋,内湾の湾口から中程、サンゴ礁域のドロップオフ下。砂底、礫や死サンゴ片混じり砂底でテッポウエビ類と単独で共生する。生息水深10-30m。,10cm,16m
ニチリンダテハゼ,"Amblyeleotris randalli Hoese et Steene, 1978",奄美大島、沖縄諸島伊江島、石垣島、西表島；西部太平洋,内湾の湾口から中程、サンゴ礁域の礁斜面やドロップオフ下。礁斜面の根の下や崖下の礫混じりの砂溜まりでテッポウエビ類と共生。生息水深15-50m,6.5cm,18m
マスイダテハゼ,"Amblyeleotris masui Aonuma et Yoshino, 1996",奄美大島、沖縄島、西表島；インドネシア,内湾の湾口から中程、サンゴ礁域の礁斜面。砂泥底や礫混じりの砂泥底でテッポウエビ類と共生。生息水深35-55m,10cm,50m
ダングラダテハゼ,"Amblyeleotris periophthalma (Bleeker, 1853)",小笠原諸島、伊豆諸島伊豆大島、和歌山県田辺湾、高知県、奄美大島、沖縄諸島、西表島；インド・太平洋,内湾の湾口から中程、サンゴ礁域の礁斜面。礫混じりの砂底でテッポウエビ類と共生。生息水深3-35m,11cm,32m
ヤノダテハゼ,"Amblyeleotris yanoi Aonuma et Yoshino, 1996",伊豆諸島、和歌山県田辺湾、高知県柏島、沖縄諸島、西表島；西部太平洋,内湾の湾口から中程、サンゴ礁域の礁斜面。礫混じりの砂底でコトブキテッポウエビと単独で共生。生息水深25-35m,10cm,25-35m
ズグロダテハゼ,"Amblyeleotris melanocephala Aonuma, Iwata et Yoshino, 2000",高知県、沖縄諸島；フィリピン、インドネシア,内湾の湾口、サンゴ礁域の礁斜面。砂泥底・崖下に続く砂底の緩斜面でテッポウエビ類と共生。生息水深25-45m,12cm,25-45m
クビアカハゼ,"Amblyeleotris fasciata (Polunin et Lubbock, 1979)",小笠原諸島、伊豆諸島、相模湾、紀伊半島、高知県、屋久島、琉球列島；インド・太平洋,内湾の湾口、サンゴ礁域の礁斜面やドロップオフ下。礫や死サンゴ片混じりの砂底でテッポウエビ類と単独かペアで共生。生息水深3-30m,6.5cm,3-30m
ハチマキダテハゼ,"Amblyeleotris periophthalma Polunin et Lubbock, 1979",相模湾、伊豆半島、静岡県、紀伊半島、高知県、琉球列島；インド・西太平洋,内湾、サンゴ礁域の礁斜面。砂泥底、礫混じりの砂底や砂泥底でテッポウエビ類と単独で共生。生息水深10-35m,8cm,30m
ヒメダテハゼ,"Amblyeleotris steinitzi (Klausewitz, 1974)",八丈島、琉球列島；インド・太平洋,内湾の湾口から湾奥、サンゴ礁域の礁池・礁湖・礁原・礁斜面。砂底や砂泥底、礫混じりの砂底や砂泥底でテッポウエビ類と単独で共生。生息水深2-35m,6.5cm,25m
ダテハゼ,"Amblyeleotris japonica Takagi, 1957",伊豆諸島、千葉県・対馬～鹿児島県；インド・西太平洋,内湾。砂泥底、礫混じりの砂底や砂泥底で主にニシキテッポウエビと単独で共生。生息水深3-15m,13cm,8m
ニュウドウダテハゼ,"Amblyeleotris fontanesii (Bleeker, 1852)",紀伊半島、奄美大島、沖縄島、西表島；インド・西太平洋,内湾の湾奥の泥底や軟泥底、ジャイアントゴビーシュリンプと単独で共生、生息水深15-35m（まれに2m以浅）,20cm,18m
ミナミダテハゼ,"Amblyeleotris ogasawarensis Yanagisawa, 1978",小笠原諸島、伊豆諸島、伊豆半島、和歌山県田辺湾、高知県柏島、奄美大島、沖縄諸島、西表島；西部太平洋,内湾の湾口から中程、サンゴ礁域の礁斜面、礫混じりの砂底でテッポウエビ類と単独で共生、生息水深20-35m,11cm,32m
ハタタテシノビハゼ,"Otonoperca jactura Lubbock et Polunin, 1977",琉球列島；中・西部太平洋,内湾の湾口から中程、サンゴ礁域の礁斜面、ドロップオフ下。砂底、礫や死サンゴ片混じりの砂底でテッポウエビ類と共生。生息水深10-35m,6.5cm,10-35m
シノビハゼ,"Ctenogobiops crocineus Lubbock et Polunin, 1977",琉球列島;インド・西太平洋,内湾の中程から湾奥、サンゴ礁域の礁池・礁湖・礁原。砂底、礫混じりの砂底や砂泥底でテッポウエビ類と共生。生息水深1-15m,6.5cm,5m
オビシノビハゼ,"Ctenogobiops aurocingulus (Herre, 1935)",奄美大島、沖縄島;インド・太平洋,サンゴ礁域の礁池。ガレ場、泥底、砂底でテッポウエビ類と共生。生息水深2-7m,6.5cm,2m
ヒメシノビハゼ,"Ctenogobiops feroculus Lubbock et Polunin, 1977",琉球列島;インド・西太平洋,内湾の中程から湾奥、サンゴ礁域の礁池・礁湖・礁原。砂底、礫混じりの砂底や砂泥底でテッポウエビ類と共生。生息水深1-15m,6cm,6m
ホホスジシノビハゼ,"Ctenogobiops aurocingulus Fourmanoir, 1955",琉球列島;インド・西太平洋,内湾の中程から湾奥。砂底、礫や死サンゴ片混じりの砂底や砂泥底でテッポウエビ類と単独かペアで共生する。生息水深3-15m。,5cm,5m
ハゴロモハゼ,Luciogobius waitei,奄美大島、沖縄島、石垣島、西表島；西部太平洋,河川の河口域、軟泥底・泥底・砂泥底でテッポウエビ類と共生、巣穴上でホバリング、水深2m以浅,7cm,2m
クロオビハゼ,Vanderhorstia nigrofasciata,沖縄諸島、石垣島、西表島；西部太平洋,内湾の湾奥、軟泥底・泥底・砂泥底でテッポウエビ類と共生、巣穴上でホバリング、水深3-25m,9cm,6m
クロオビハゼ,,,,7cm,3m
クリゼ,Latrunculia sp.A,小笠原諸島、千葉県、相模湾、伊豆半島、和歌山県、徳島県、愛媛県宇和海、高知県柏島、種子島、奄美大島、沖縄諸島、西表島、石垣島；インドネシア,内湾中程から湾奥の軟泥底・泥底・砂泥底、テッポウエビ類と共生、生息水深1-50m,7cm,16m
ヤジリハゼ,"Vanderhorstia ornatissima Yanagisawa, 1978",伊豆半島、和歌山県、愛媛県宇和海、高知県柏島、奄美大島、沖縄島、西表島；インドネシア,河川の河口域、内湾の中程から湾奥。砂底や砂泥底でテッポウエビ類と単独かペアで共生。生息水深2-35m,7cm,2m
ヒレナガハゼ,"Vanderhorstia auropunctata Frantz, 1910",日本固有：千葉県、神奈川県、静岡県、高知県、長崎県,内湾の湾口から中程。泥底や砂泥底でテッポウエビ類と共生。生息水深25-40m（80mの記録もある）,8cm,19m
シマオリハゼ,"Vanderhorstia ornatissima (Fourmanoir, 1957)",伊豆半島、紀伊半島、奄美大島、沖縄諸島、石垣島、西表島；インド・太平洋,内湾の中程から湾奥。まれにサンゴ礁域の礁湖にもすむ。泥底・砂泥底・砂底でテッポウエビ類と単独かペアで共生。生息水深2-25m,7.5cm,12m
シマオリハゼ,,,,9cm,4m
キラキラハゼ,"Flabelligobius autocephalus (Tomiyama, 1955)",日本固有: 伊豆大島、相模湾、伊豆半島,内湾の湾口。礫混じりの砂泥帯でテッポウエビ類と共生。生息水深約30-50m,8cm,53m
ヤツシハゼ,Vanderhorstia sp. B,小笠原諸島、八丈島、伊豆半島、紀伊半島、愛媛県宇和海、高知県柏島、種子島、琉球列島; インドネシア,河川の河口域、内湾の湾奥。泥底や砂泥底でテッポウエビ類と単独かペアで共生。生息水深1-20m,6cm,20m
ャノスソビキハゼ,Shibukawa et Suaki 2004,沖縄島、西表島；インドネシア,内湾の礫混じり砂泥底、テッポウエビ類と共生、水深30-55m,6cm,45m
カスリハゼ,"Amblyeleotris japonica Valenciennes, 1837",八丈島、千葉県、相模湾、駿河湾、三重県、和歌山県、徳島県、愛媛県、高知県、長崎県、鹿児島県、奄美大島、沖縄島、久米島、西表島；西部太平洋,内湾の湾奥、軟泥底・泥底・砂泥底でテッポウエビ類と共生、巣穴上でホバリング、生息水深2-20m,6.5cm,6m
ハラマキハゼ,"Psilogobius prolatus Watson et Loehner, 1985",紀伊半島、奄美大島、沖縄諸島、石垣島、西表島；インド・西太平洋,内湾の湾奥、砂泥底でテッポウエビ類と共生、生息水深1-20m,4cm,2m
キンセンハゼ,"Amblygobius hectori (Smith, 1957)",八丈島、琉球列島；インド・太平洋,内湾の中程から湾奥、サンゴの根の周辺やガレ場、生息水深2-10m,5cm,6m
ホホベニサラサハゼ,Amblygobius sp.A,小笠原諸島、八丈島、口之永良部島、奄美大島、沖縄諸島、石垣島、西表島；インドネシア,内湾の中程から湾奥・河川河口域、砂泥底や礫混じりの砂泥底に穴を掘り単独かペアで生息、生息水深2-15m,6cm,5m
ジュウモンジサラサハゼ,"Amblygobius semicinctus (Bleeker, 1855)",西表島；インド・西太平洋,内湾の中程から湾奥、サンゴ礁域の礁斜面。砂泥底や礫混じりの砂泥底に穴を掘り、単独かペアで生息。生息水深2-15m,6.5cm,5m
サラサハゼ,"Amblygobius phalaena (Valenciennes, 1837)",小笠原諸島、八丈島、伊豆半島、和歌山県、高知県柏島、屋久島、琉球列島；インド・太平洋,内湾の中程から湾奥、サンゴ礁域の礁池や礁原。幼魚は河口域にも出現。死サンゴ片や砂泥底に穴を掘り、単独かペアで生息。生息水深1-30m,10cm,5m
ワカケサラサハゼ,Amblyeleotris sp.,沖縄島、石垣島、西表島;西部太平洋,マングローブ林の泥底や軟泥底、穴を掘り単独かペアで生息、底から数cm離れて遊泳、生息水深3m以浅,5cm,15m
スフィンクスサラサハゼ,"Amblyeleotris sphinx (Valenciennes, 1837)",西表島;インド・太平洋,内湾の中程から湾奥、砂泥底に穴を掘り単独かペアで生息、底から数cm離れて遊泳、生息水深10〜20m,4.5cm,16m
ホシハゼ,"Asterropteryx semipunctata Rüppell, 1830",小笠原諸島、八丈島、千葉県・福岡県～琉球列島、対馬；インド・太平洋,河川の河口域、内湾、サンゴ礁域の礁池・礁湖・礁原・礁斜面。死サンゴ片混じりの砂泥底やガレ場に単独で生息。生息水深1-10m,5cm,2m
ヤノウキホシハゼ,Asterropteryx sp.,奄美大島、西表島；フィリピン,内湾の中程から湾奥、サンゴ礁域の礁斜面。礫や死サンゴ混じりの泥底や砂泥底上の中層を群がりでホバリングする。生息水深15-55m、とくに25m以深に多い。,3cm,25m
ヒメホシハゼ,"Asterropteryx semipunctata (Bleeker, 1874)",奄美大島、沖縄諸島、石垣島、西表島；インド・太平洋,内湾の中程から湾奥、サンゴ礁域の礁斜面。死サンゴ片混じりの砂泥底やガレ場に単独で見られる。生息水深3-25m。,4cm,20m
マグラホシハゼ,"Istigobius decoratus (Herre, 1927)",奄美大島、沖縄諸島、八重山諸島；インド・太平洋,内湾の中程から湾奥、サンゴ礁域の礁池・礁湖・礁斜面。ガレ場、ユビエダハマサンゴの下、死サンゴ片混じりの砂底や砂泥底に単独で生息。水深6-30m。,4cm,7m
フタホシホシハゼ,"Istigobius rigilius Ahnelt & Munday, 1995",石垣島、西表島；インド・太平洋,内湾の中程から湾奥、サンゴ礁域の礁斜面。死サンゴ片混じりの泥底や砂泥底、ユビエダハマサンゴや板状サンゴの下に単独で生息。水深6-25m。,3.5cm,8m
ニセシラヌイハゼ,Silhouettea sp.A,奄美大島、慶良間諸島、石垣島、西表島,河川の河口、細砂底に単独で生息,3cm,0.3m
ミナミシラヌイハゼ,"Lotilia graciliosa Smith, 1959",西表島；西インド洋,サンゴ礁域の礁池、岸よりの細砂底、生息水深4m以浅（とくに1m以浅）,3cm,4m
ヒメハゼ,"Favonigobius gymnauchen (Bleeker, 1860)",北海道の太平洋・日本海側〜西表島、瀬戸内海；朝鮮半島、渤海、黄海、東・南シナ海、台湾、西部太平洋,内湾や河川の河口域、砂底や砂泥底、生息水深1〜10m,9cm,2m
ミナミヒメハゼ,Favonigobius reichei,屋久島、種子島、琉球列島；インド・西太平洋,河川の河口域。砂底から泥底。生息水深は2m以浅,6cm,1m
ノボリハゼ,"Oligolepis acutipennis (Valenciennes, 1837)",千葉県、静岡県、和歌山県、高知県、宮崎県、鹿児島県、五島列島、種子島、琉球列島；インド・西太平洋,河川の感潮域下部、汽水性湿原、細流の淡水域、泥底の穴に単独で見られる,12cm,15m
クチサケハゼ,"Oligolepis stomias (Smith, 1941)",小笠原諸島、高知県、鹿児島県、琉球列島；西部太平洋,河川の感潮域最上流、泥底に穴を掘り単独で見られる,5.5cm,15m
タスキヒナハゼ,"Redigobius balteatus (Herre, 1935)",西表島；インド・西太平洋,河川の河口域、マングローブ林の砂泥底にある沈木のまわり、水深2m以浅,3.5cm,0.5m
ヒナハゼ,"Redigobius bikolanus (Herre, 1927)",神奈川県～西表島、兵庫県の日本海側、隠岐、対馬、五島列島；インド・太平洋,河川の感潮域直上の淡水域、細流の淡水域、水田地帯、水が淀み枯れ葉が堆積した場所や草の下,4cm,0.3m
イズミハゼ,Mugilogobius sp. A,五島列島、鹿児島県上甑島、種子島、琉球列島,河川の河口域、岸寄りの泥底の穴の中、石やカキ殻の間や下,5cm,0.1m
ナミハゼ,Mugilogobius abei,宮城県・富山湾～種子島、瀬戸内海、隠岐、対馬、朝鮮半島、渤海、黄海、東シナ海、台湾,河川の河口域、汽水性湿原、細流。マングローブ林や汽水性湿原の泥底の枯れ葉や枝の多い濁った水溜まり,4cm,
アベハゼ,Mugilogobius abei,宮城県・富山湾～種子島、瀬戸内海、隠岐、対馬、朝鮮半島、渤海、黄海、東シナ海、台湾,河川の河口域。岸寄りの泥底の穴の中、石やカキ殻の間や下,3.5cm,1m
ホホグロハゼ,Mugilogobius cavifrons,沖縄島、石垣島、西表島、与那国島、台湾、フィリピン,河川の河口域のマングローブ林や汽水性湿原。泥底の枯れ葉や枝の多い濁った水溜まり,4cm,0.2m
フタスジノボリハゼ,Amoya chandramara,沖縄島、久米島、石垣島、西表島、西部太平洋,河川の河口域のマングローブ林。軟泥底の穴の入り口付近,7cm,0.5m
カスミハゼ,"Acentrogobius caninus (Bleeker, 1852)",沖縄島、宮古島、石垣島、西表島、与那国島；インド・西太平洋,河川の河口域のマングローブ林、ヒルギ類の根元の泥底や軟泥底,13cm,0.3m
ニセツムギハゼ,"Acentrogobius audax Smith, 1959",宮古島、石垣島、西表島；インド・西太平洋,河川の河口や河口域の開けた水域、泥底や砂泥底,5cm,1m
ホホグロスジハゼ,"Acentrogobius janthinopterus (Herre, 1927)",奄美大島、西表島；西部太平洋,河川の河口域、泥底や砂泥底、生息水深1〜2m,4.5cm,1m
セイタカスジハゼ,"Myersina macrostoma (Herre, 1927)",沖縄島、石垣島、西表島；西部太平洋,内湾、河川の河口や河口域、泥底や砂泥底の穴の入り口付近、テッポウエビ類と共生することもある,5cm,2m以浅
スズメハゼ,"Myersina yangonensis (Steindachner, 1893)",宮古島、石垣島、西表島；西部太平洋,河川の河口域から感潮域最上流、マングローブ林、軟泥底の穴の入り口付近,5cm,1m
クロコハゼ,Drombus sp. A,静岡県、和歌山県、高知県、宮崎県、鹿児島県、五島列島、種子島、屋久島、琉球列島；台湾,河川の河口付近、泥底や砂泥底の転石・枯葉・枝の下,5cm,2m
サンカクハゼ,"Fusigobius inframaculatus (Günther, 1877)",小笠原諸島、高知県、屋久島、琉球列島；インド・太平洋,内湾中程から湾奥、サンゴ礁域の礁池・礁湖、サンゴの根周辺の砂底や砂泥底,6cm,6m
ツマグロサンカクハゼ,"Fusigobius signipinnis (Randall, 2001)",高知県、奄美大島、沖縄諸島、西表島；インド・太平洋,内湾の湾口から中程、サンゴ礁域の礁斜面、ドロップオフ下の砂だまり、サンゴの根の周辺の礫や死サンゴ片混じりの砂底、砂泥底。生息水深10-40m,5.5cm,15m
ヒレフリサンカクハゼ,"Fusigobius brunneus Hoese et Obika, 1988",奄美大島、沖縄諸島、石垣島、西表島；西部太平洋,内湾の湾口から湾奥、サンゴ礁域の礁原、礁斜面ドロップオフの砂だまり、サンゴの根の周辺の礫や死サンゴ片混じりの砂底、砂泥底。生息水深2-30m,5.5cm,10m
セホシサンカクハゼ,"Fusigobius hoesei Reader, 1985",小笠原諸島、伊豆諸島、相模湾、伊豆半島、徳島県、愛媛県宇和海、高知県、奄美大島、沖縄諸島、石垣島、西表島；インド・太平洋,内湾の湾口から中程、サンゴ礁域の礁外縁やドロップオフ下。崖下の砂だまり、礫や死サンゴ片混じりの砂底に単独で生息,5.5cm,10-20m
セスジサンカクハゼ,"Fusigobius signipinnis Randall, 2001",小笠原諸島、紀伊半島、徳島県、高知県、奄美大島、沖縄諸島、西表島；中・西部太平洋,内湾の湾口から中程、サンゴ礁域の礁池、礁湖、礁斜面。礫や死サンゴ片混じりの砂底に単独で生息,5.5cm,5-20m
ハタタテサンカクハゼ,"Fusigobius inframaculatus Randall, 1994",八丈島、紀伊半島、高知県柏島、屋久島、奄美大島、沖縄諸島、久米島、石垣島、西表島；台湾、インド・西太平洋,内湾の湾口から中程、サンゴ礁域の礁外縁やドロップオフ。亀裂や崖下の砂だまり、礫混じりの砂底や砂泥底に単独で生息,6cm,6-30m
ゴイシサンカクハゼ,Fusigobius signipinnis,高知県柏島、奄美大島、慶良間諸島、石垣島、西表島；インド・西太平洋,内湾の湾口から中程、サンゴの根の周辺の砂泥底や砂底に単独で見られる。生息水深は10-50m,7cm,12m
カタボシサンカクハゼ,Fusigobius neophytus,八丈島、奄美大島、沖縄諸島伊江島、西表島；インド・太平洋,内湾の湾口から中程、サンゴ礁域の礁斜面、ドロップオフ。サンゴの根のくぼみの砂だまり、亀裂の礫混じりの砂だまり、崖下の薄暗い礫混じりの砂だまりに単独で見られる。生息水深は5-15m,4.5cm,8m
ミツボシゴマハゼ,"Paragobiodon lacunicolus Akihito et Meguro, 1975",琉球列島；フィリピン,内湾から河川の感潮域最上流部、淡水性湿地。マングローブ林内で群がりで浮遊する。,1.7cm,0.2m
