和名,学名,分布,生息場所,体長,深さ
ゴマハゼ,Paragobiodon sp. A,日本固有：三重県～屋久島、対馬、五島列島,内湾や河川の河口。船溜りの隅、橋桁やテトラポッドのまわり、湿性植物の根元などで群がりで浮遊する。,2cm,1.2m
イサゴハゼ,"Gobiopsis arenaria (Snyder, 1908)",小笠原諸島、伊豆半島、徳島県、愛媛県宇和海、高知県柏島、種子島、五島列島、琉球列島;台湾、香港,内湾、サンゴ礁域の礁斜面。死サンゴ片混じりの砂泥底で塊下に単独で見られる。生息水深6-10m,3.5cm,10m
ウチワハゼ,"Mangarinus waterousi Herre, 1943",奄美大島、沖縄島、久米島、石垣島、西表島;西部太平洋,河川河口域のマングローブ林。泥底にやや深く潜る,8cm,0.4m
ギンポハゼ,"Parkraemeria onata Whitley, 1951",石垣島、西表島；オーストラリア東岸,内湾湾奥や河川の河口、砂泥底に穴を掘り単独で生息、水深2m以浅,4cm,1m
モエギハゼ,Trimma sp. A,石垣島、西表島,内湾、サンゴ礁域の礁斜面。礫や死サンゴ片混じりの砂泥底で単独にホバリング,3.5cm,45-55m
ホムラハゼ,"Discordipinna griessingeri Hoese et Fourmanoir, 1978",和歌山県、高知県柏島、奄美大島、沖縄諸島、八重山諸島；インド・太平洋,内湾の湾口から湾奥、サンゴ礁域の礁斜面。サンゴの根の下の隙間、死サンゴ片や死サンゴ塊混じりの砂泥底の塊下に単独で生息,3cm,5-30m
ホムラハゼ,Discordipinna sp.1,高知県、沖縄島、久米島,サンゴ礁域のドロップオフ下の砂底、転石下に単独で生息,2.5cm,35m
ゴクラクハゼ,"Rhinogobius giurinus (Rutter, 1897)",茨城県・秋田県以南の本州、四国、九州～西表島、隠岐、壱岐、対馬、五島列島；朝鮮半島、黄海、東・南シナ海、台湾,河川の汽水域から下流域、流れの緩やかな砂礫底,9cm,0.3m
シマヨシノボリ,Rhinogobius sp. CB,青森県以南の本州、四国、九州～西表島、隠岐、壱岐、対馬、五島列島；朝鮮半島、台湾,河川の中流域の平瀬、小河川・大河川に生息,7.5cm,0.3m
オオヨシノボリ,Rhinogobius sp. LD,日本固有：宮城県・青森県以南の本州、四国、九州,河川の中流域から渓流域、早瀬から淵頭にかけての急流部,12cm,0.5m
ヒラヨシノボリ,Rhinogobius sp. DL,日本固有: 種子島、屋久島、奄美大島、沖縄島、石垣島、西表島,河川の渓流域。早瀬や淵頭の急流部に単独で見られる。大河川に多い。,9cm,0.5m
クロヨシノボリ,Rhinogobius sp. DA,日本固有: 千葉県・新潟県以南の本州、四国、九州～西表島、隠岐、対馬、五島列島,河川の中流域から渓流域。淵の緩流部に単独で見られる。極小河川に分布する。,9cm,0.3m
クロヨシノボリ,Rhinogobius sp. CO,北海道、本州、四国、九州、済州島,河川の中流域から渓流域、早瀬から淵頭にかけての急流部、主に小さな河川,12cm,0.3m
オガサワラヨシノボリ,Rhinogobius sp. BI,日本固有：小笠原諸島父島、母島、兄島,河川の中流域から渓流域、淵の緩流部、極小河川,6cm,0.5m
アヤヨシノボリ,Rhinogobius sp. MO,日本固有：奄美大島、加計呂麻島、徳之島、沖縄島、久米島,河川の汽水域から下流域、淵などの流れの緩やかな砂礫底,6cm,0.5m
トウヨシノボリ,Rhinogobius sp. OR,北海道、本州、四国、九州、朝鮮半島,河川中流域の瀬（流れの速い場所）や池・河川のワンド（泥底）,4-7cm,0.3m
カワヨシノボリ,"Rhinogobius flumineus (Mizuno, 1960)",日本固有：静岡県・富山県以西の本州、九州北部、壱岐、長崎県福江島,河川中流域から渓流域の淵から平瀬にかけての緩やかな流れ,4-8cm,0.3m
アオバラヨシノボリ,,日本固有：沖縄島北部,河川中流域から渓流域の淵の緩流部,,0.3m
ビワヨシノボリ,Rhinogobius sp. BW,日本固有：滋賀県琵琶湖,琵琶湖の中層に群がり浮遊し、繁殖期に湖岸浅所の砂底の浮き石下で繁殖する,4cm,2m
キバラヨシノボリ,Rhinogobius sp. YB,日本固有：奄美大島、加計呂麻島、徳之島、沖永良部島、沖縄島、久米島、石垣島、西表島,河川の渓流域、滝の上流に多く、淵などの流れの緩やかなところに単独で見られる,7cm,0.5m
アカオビシマハゼ,Tridentiger trigonocephalus,北海道の太平洋・日本海側～鹿児島県、瀬戸内海、隠岐、対馬、朝鮮半島、河北、山東、福建、香港、台湾,主に内湾に生息。泥底の石やカキ殻の下や間に単独で見られる,6cm,1.5m
シモフリシマハゼ,Tridentiger fasciolatus,北海道の太平洋・日本海側～九州、瀬戸内海、沿海州、朝鮮半島、福建、香港、台湾,主に河川の河口域に生息。泥底の石やカキ殻の下や間に単独で見られる,6cm,3m
チチブ,Tridentiger obscurus,青森県以南の本州、四国、九州、隠岐、壱岐、対馬、五島列島、沿海州、朝鮮半島,主に内湾や河川の河口域に生息。砂泥底や転石の周辺に単独で見られる。淡水域に出現することもある,9cm,10m
ヌマチチブ,"Tridentiger brevispinis Katsuyanla, Arai et Nakamura, 1972",北海道、本州、四国、九州、壱岐、対馬；サハリン、朝鮮半島、中国,河川の下流域から中流域、汽水域、淵などの流れの緩やかなところの礫底,15cm,1m
ナガノゴリ,"Tridentiger kuroiwae Jordan et Tanaka, 1927",日本固有：種子島、屋久島、琉球列島,河川の感潮域最上流、中流域、渓流域などの淡水域、淵などの流れの緩やかなところの礫底,10cm,0.3m
スナハゼ,"Kraemeria cunicularia Rofen, 1958",琉球列島;西部太平洋,サンゴ礁域の砂浜、波打ち際のサンゴ砂の表面に浅く潜る,4.5cm,0.3m以浅
ニシキオオメワラスボ,"Gunnellichthys curiosus Dawson, 1968",相模湾、伊豆半島、紀伊半島、高知県、沖縄諸島、西表島；インド・太平洋,内湾の湾口から中程、サンゴ礁域の礁斜面。礫や死サンゴ片混じりの砂底や砂泥底、ガレ場の上の中層を単独かペアで遊泳。生息水深3-35m,10cm,5m
クロエリオオメワラスボ,"Gunnellichthys monostigma Smith, 1958",伊豆半島、沖縄諸島、西表島；インド・太平洋,内湾の湾口から中程、サンゴ礁域の礁斜面。砂底や砂泥底上の中層を単独で遊泳。生息水深10-30m,4cm,12m
ダイダイオオメワラスボ,"Gunnellichthys viridescens Dawson, 1968",千葉県、静岡県、和歌山県、高知県、琉球列島；インド・太平洋,内湾の湾内、サンゴ礁域の礁外縁。砂底や礫混じりの砂底上の中層を単独で遊泳。生息水深10-35m,6cm,25m
オオメワラスボ,"Gymnamblyopus rosenbergii Bleeker, 1858",沖縄諸島、石垣島、西表島；中・西部太平洋,河川の河口、内湾の湾奥、サンゴ礁域の礁原の岸寄り。礫や死サンゴ片混じりの砂底や砂泥底、ガレ場上の中層を単独で遊泳。生息水深0.5-3m,6cm,2m
タンザクハゼ,"Oxymetopon compressus Chan, 1966",沖縄島；西部太平洋,内湾の湾口。シルト状の軟泥底上の中層を単独から群がりで遊泳。危険を感じると泥穴に逃げ込む。生息水深17m以深,15cm,19m
ハタタテハゼ,"Nemateleotris magnifica Fowler, 1938",小笠原諸島、八丈島、相模湾、伊豆半島、和歌山県、愛媛県宇和海、高知県柏島、屋久島、琉球列島；インド・太平洋,内湾の湾口から中程、サンゴ礁域の礁外縁・礁斜面・ドロップオフ。礫混じりの砂底やガレ場上の中層を単独かペアでホバリング。生息水深3-30m,7cm,18m
アケボノハゼ,"Nemateleotris decora Randall et Allen, 1973",八丈島、高知県柏島、奄美大島、沖縄諸島、西表島；インド・太平洋,内湾の湾口から中程、サンゴ礁域の礁斜面。礫や死サンゴ片混じりの砂底・砂泥底上の中層を単独かペアでホバリング。生息水深35-55m,7cm,40m
シコンハタタテハゼ,"Nemateleotris decora Randall et Allen, 1973",小笠原諸島、高知県、奄美大島、慶良間諸島；中・西部太平洋,岩礁域やサンゴ礁域に隣接する転石混じりの砂底上の中層をホバリング。生息水深は40m以深。,6cm,25m
コマチハゼ,"Parioglossus taeniatus Regan, 1912",西表島；パラオ諸島、ソロモン諸島,河川の河口域。満潮時、砂泥底のガレ場の中層を群がりで遊泳する。,,
マイコハゼ,"Parioglossus lineatus Rennis et Hoese, 1985",西表島；インド・太平洋,河川の河口域のマングローブ林。ヒルギの根元の中層付近で群がりの中に混泳する。,4cm,0.5m
ミヤラビハゼ,"Parioglossus raoi (Herre, 1939)",奄美大島、沖縄諸島、石垣島、西表島；インド・太平洋,岩礁性海岸、内湾の湾奥、河川の河口や河口域。とくに河口域のマングローブ林に多く、満潮時にヒルギの根元の中層を群がりで遊泳する。,4.5cm,0.3m
ヨスジハゼ,Partigobius yamanokami,沖縄島、石垣島、西表島；インド・西太平洋,淡水の流入のある岩礁性海岸。満潮時、石灰岩の海食棚の中層を群がりで遊泳する,4.5cm,0.3m
サツキハゼ,Paratrypauchen microcephalus,千葉県・石川県～八重山諸島、隠岐、対馬、五島列島；済州島,港、岩礁性海岸、内湾の湾奥、河川の河口域。ヒルギの根元や橋脚・岩に付いたカキのまわりの中層を群がりで遊泳する,4.5cm,0.5m
ベニツケサツキハゼ,Ptereleotris heteroptera,神奈川県、和歌山県、徳島県、高知県、西表島；インド・西太平洋,内湾の湾奥、河川の河口。ヒルギの根元や橋脚・岩に付いたカキのまわりの中層を群がりで遊泳する,4.5cm,0.5m
コビトハゼ,"Parioglossus sinarus McCulloch, 1921",奄美大島、西表島；中・西部太平洋,河川の河口域のマングローブ林、ヒルギの根元の中層付近,4cm,0.5m
ボルネオハゼ,"Parioglossus palustris (Herre, 1945)",西表島；西部太平洋,河川の河口域のマングローブ林、ヒルギの根元の中層付近,4cm,0.5m
ヒメサツキハゼ,"Parioglossus sinaloae Suzuki et Senou, 1994",西表島；西部太平洋,河川の河口域のマングローブ林、ヒルギの根元の中層付近,3cm,0.5m
ヒメユリハゼ,"Ptereleotris heteroptera Randall et Hoese, 1985",伊豆半島、高知県、沖縄諸島、西表島；インド・太平洋,サンゴ礁の礁外縁や礁斜面。まれに内湾の湾奥。潮通し良い礫混じりの砂底や岩盤状のサンゴの上の中層を単独やペア、小さな群がりでホバリングや遊泳。生息水深8-25m,15cm,20m
クロユリハゼ,"Ptereleotris evides (Jordan et Hubbs, 1925)",小笠原諸島、伊豆諸島、千葉県～西表島；インド・太平洋,内湾の湾口から中程、サンゴ礁域の礁外縁、礁斜面、ドロップオフの棚。ガレ場やサンゴの上の中層を単独かペアでホバリングや遊泳。生息水深3-15m,10cm,6m
スジクロユリハゼ,"Ptereleotris grammica Randall et Lubbock, 1982",小笠原諸島、伊豆半島、高知県柏島、沖縄諸島、久米島、西表島；インド・西太平洋,内湾の湾口から中程、サンゴ礁域の礁斜面。礫や死サンゴ片混じりの砂底や砂泥底の中層でホバリングや遊泳。生息水深45-55m,11cm,46m
ゼブラハゼ,"Ptereleotris zebra (Fowler, 1938)",小笠原諸島、八丈島、伊豆半島、高知県、沖縄諸島、石垣島、西表島；インド・太平洋,サンゴ礁の礁外縁や礁斜面。潮通しの良い岩盤状のサンゴの上の中層を単独やペアでホバリングや遊泳。生息水深5-25m,12cm,52m
イトマンクロユリハゼ,"Ptereleotris hanae (Bleeker, 1856)",相模湾、伊豆半島、紀伊半島、高知県柏島、奄美大島、沖縄諸島、宮古諸島、八重山諸島；インド・太平洋,内湾の中程から湾奥。礫や死サンゴ片混じりの砂底や砂泥底上の中層を単独や小さな群がりでホバリングや遊泳。生息水深3-10m,9cm,6m
オグロクロユリハゼ,Ptereleotris heteroptera,小笠原諸島、八丈島、相模湾、伊豆半島、紀伊半島、高知県柏島、琉球列島；インド・太平洋,内湾の湾口から中程、サンゴ礁域の礁斜面。礫や死サンゴ片混じりの砂底や砂泥底上の中層を単独やペアでホバリングや遊泳。生息水深3-35m,9cm,12m
クロユリハゼ,Ptereleotris evides,伊豆大島、千葉県・富山県～奄美大島；朝鮮半島、済州島,岩礁域の周囲。砂泥底や砂底上の中層を単独で遊泳。驚くとダテハゼなど共生ハゼの巣穴に逃げ込む。生息水深3-10m,14cm,8m
