id,name,scientific_name,distribution,habitat,size,depth_range,description
13047,ケブカアワツブモドキ,Paractaea rufopunctata,伊豆半島以南、東アジア、ミクロネシア、南太平洋,サンゴ礁域、岩礁,甲幅約2〜4cm,3-15m,サンゴ礁域の岩や死サンゴの下に隠れているオウギガニの仲間。甲羅は赤褐色で、多数の顆粒で覆われている。ケブカアワツブガニに似るが、本種の方がやや大型になる。夜行性のため、日中に見つけるのは難しい。ナイトダイビングで岩の周りを探すと、餌を探して活動している姿に出会えるかもしれない。
12477,ケブカイボガザミ,Portunus tarsipes,駿河湾以南、フィリピン、オーストラリア、アンダマン海,サンゴ礁域、岩礁の隙間,甲幅約8cm,10-100m,砂泥底に生息するガザミ（ワタリガニ）の仲間。甲羅の左右に鋭いトゲがあり、脚には毛が密生している。特に第5脚（遊泳脚）の毛が顕著。夜行性で、昼間は砂の中に潜っている。ナイトダイビングで砂地を探索すると見つけやすい。ライトを当てると、赤い目が光って見える。危険を感じると素早く泳いで逃げる。
3175,ケブカカニダマシ,Petrolisthes pilosus,長崎県以南、台湾、東南アジア、インド洋、紅海,岩礁、サンゴ礁,甲幅約2cm,1-3m,ヤドカリに近いカニダマシの仲間で、カニのように見えるが腹部が下に折りたたまれている。浅い岩礁の転石の下などに生息。全身が長い毛で覆われているのが特徴。平たい体で、狭い隙間にもぐりこむのが得意。大きなハサミを使ってデトリタスなどを集めて食べる。石をひっくり返すと素早く逃げる姿が見られる。
6310,ケブカガニ,Pilumnus vespertilio,相模湾以南、ハワイ、南太平洋、インド洋、紅海、南アフリカ,岩礁の岩穴、転石帯,甲幅約2〜3cm,1-3m,岩礁や転石帯に生息するカニの仲間。甲羅や脚が長い毛で密に覆われているのが名前の由来。夜行性で、昼間は石の下や岩の隙間に隠れている。この毛がカモフラージュの役目を果たし、岩肌にいると見つけにくい。ナイトダイビングでは、岩の上を歩き回っている姿を観察できる。ハサミの力は見た目より強い。
7263,ケブカキンチャクガニ,Polydectus cupulifer,琉球列島、伊豆諸島、ハワイ、南太平洋、インド洋、紅海,サンゴ礁域、岩礁域,甲幅約1.5〜2cm,2-30m,キンチャクガニに似た小型のカニ。両方のハサミにイソギンチャクを持つ点は同じだが、本種はより毛深い体を持つ。また、持つイソギンチャクの種類も異なることが多い。サンゴ礁の瓦礫の下や岩の隙間に隠れており、見つけるのは難しい。夜行性が強く、ナイトダイビングで探す方が発見の可能性が高い。
17837,ケブカゼブラガニ,Eumedonus serenei,紀伊半島、小笠原諸島、東シナ海、オーストラリア東岸,岩礁の岩穴、転石帯,甲幅約2cm,2-60m,ウニ類、特にガンガゼやラッパウニの棘の間に共生する珍しいカニ。ウニの棘をかき分けて生活しており、外敵から身を守っている。体にはゼブラ模様があり、これが名前の由来。ウニの体表でじっとしているため、見つけるにはウニの棘の間を根気よく探す必要がある。ウニを傷つけないよう、また棘に刺されないよう観察には注意が必要。
3134,ケブカヒメヨコバサミ,Paguristes ortudnili,北海道～九州、韓国、黄海,砂泥底、藻場域,甲長約2.5cm,1-210m,岩礁や砂礫底に生息するヤドカリの仲間。脚やハサミに毛が密生している。左のハサミが右よりも大きい「ヒメヨコバサミ」のグループに属す。浅い場所から深い場所まで広い範囲に生息する。岩の隙間や海藻の根元などで見られる。他の多くのヤドカリと同様、様々な貝殻を宿として利用する。
3065,ケンガザミ,Portunus spinicarpus,伊豆半島、紀伊半島、インド洋西部,サンゴ礁域、岩礁の隙間,甲幅約6cm,5-20m,砂泥底に生息するガザミ（ワタリガニ）の仲間。ハサミの腕節（腕の途中）に長いトゲがあるのが最大の特徴で、名前の由来にもなっている。夜行性で、昼間は砂に潜って目だけを出していることが多い。ナイトダイビングで砂地をライトで照らすと、歩き回る姿や砂から顔を出す様子を観察できる。泳ぎも得意。
6211,コイチョウガニ,Cancer amphioetus,北海道～九州、韓国、中国北部、カリフォルニア～メキシコ,砂泥底、藻場域,甲幅約5〜8cm,2-70m,イチョウガニの仲間で、甲羅が銀杏の葉に似た形をしている。砂礫底や岩礁域に生息する。甲羅の縁には鋭いトゲが並ぶ。体色は赤褐色や紫褐色で、個体変異がある。動きは比較的素早い。ダイバーが近づくと、岩陰や砂の中に隠れようとする。食用にされることもある。
16389,コウガイメナガガザミ,Podophthalmus vigil,駿河湾～琉球列島,砂泥底、岩礁,甲幅約10〜15cm,10-50m,非常に長い眼柄（がんぺい）を持つ、特異な姿のガザミ（ワタリガニ）の仲間。この長い眼を潜水艦の潜望鏡に見立てて名前が付けられた。眼柄は甲羅の縁にある溝に収納できる。主に内湾の砂泥底に生息し、夜行性。昼間は砂に潜っている。ナイトダイビングでは、この奇妙な姿のカニが歩き回る様子を観察できる。
7557,コガネオニヤドカリ,Aniculus maximus,紀伊半島以南、ハワイ、フランス領ポリネシア、セイシェル諸島,サンゴ礁域、岩礁の岩穴,甲長約20cm,10m~,サンゴ礁に生息するヤドカリの中でも最大級の種。体は金色を帯びたオレンジ色で、非常に美しい。太く頑丈な脚とハサミを持つ。ホラガイなどの大きな貝殻に入ることが多い。成体は大型で迫力があるが、ダイバーが近づくと素早く貝殻に引っ込んでしまう。岩棚の下などを探すと見つかることがある。
7733,コガラシエビ,Leandrites cyrtorhynchus,琉球列島、東南アジア、ニューカレドニア,サンゴ礁域、岩礁,体長約2.3cm,5m~,内湾の河口近くなど、汽水域に生息する小型のエビ。額の角（額角）が下に強く曲がっているのが大きな特徴。体はほぼ透明で、内臓などが透けて見える。アマモなどの海草の茂みや、転石の下などで見られる。環境の変化に敏感な種でもある。特徴的な額角の形に注目すれば、他の透明なエビと区別できる。
7773,コシマガリモエビ,Heptacarpus geniculatus,北海道～九州、中国,浅場の藻場域,体長約3.5cm,1m~,岩礁やアマモ場などに生息するモエビの仲間。腰が曲がったような姿勢をとることが多い。体色変異に富み、赤、緑、褐色など周囲の環境に合わせた保護色となる。海藻の上や岩肌でじっとしていると見つけにくいが、注意深く探すと比較的普通に見られる。夜行性で、夜の方が活発に動き回る。
3036,コノハガニ,Huenia heraldica,房総半島以南、ハワイ、南太平洋、オーストラリア、インド洋、紅海,サンゴ礁域,甲幅約2cm,3-140m,海藻に擬態するクモガニの仲間。緑藻のサボテングサ類などに巧みに擬態し、見つけるのは非常に困難。体色も生息環境に合わせて緑色から褐色まで変化する。ほとんど動かずにじっとしているため、葉の形や質感と見比べながら根気よく探す必要がある。雌雄で甲羅の形が異なり、メスはより幅が広く葉に似た形状をしている。
3171,コブカニダマシ,Pachycheles stevensii,北海道～九州、韓国、ロシア,岩礁、潮だまり,甲長約1.5cm,1-7m,ヤドカリに近いカニダマシの仲間。浅い岩礁の転石の下に生息する。甲羅の表面にコブ状の隆起があるのが特徴。ハサミは大きく平たい。危険を感じると、体を平らにして岩の隙間に隠れる。石をひっくり返すと、慌てて逃げる姿が見られる。観察後はカニを傷つけないよう、石を静かに元に戻すことが大切。
3022,コブカラッパ,Calappa capellonis,相模湾以南、伊豆諸島、ハワイ、南太平洋、インド洋、紅海、アフリカ西岸、南北アメリカ（フロリダ～ブラジル）,砂泥底,甲幅約8〜12cm,5-100m,砂泥底に生息するカラッパの仲間。箱のようなずんぐりした体と、蓋のように顔を覆うことができる大きなハサミが特徴。このハサミを器用に使って巻貝を割って食べる。夜行性で、昼間は砂に潜って目だけを出していることが多い。ナイトダイビングでは、歩き回ったり食事をしたりする姿を観察できる可能性がある。
17838,コブシガニモドキ,Pseudophilyra heterograna,相模湾～九州、東南アジア、オーストラリア、インド洋、紅海,砂泥底,甲長約1cm,5-30m,砂地や砂泥底に生息する小型のカニの仲間。コブシガニのグループに属し、丸みを帯びた甲羅が特徴。体色は地味な褐色で、砂地の背景に溶け込む。昼間は砂に浅く潜っていることが多い。非常に小さいため、砂地をゆっくりと進みながら、動くものを探すようにしないと見つけるのは難しい。夜間の方が見つけやすい。
6304,コブセミエビ,Scyllarides haani,相模湾以南、台湾、インドネシア、オーストラリア、ハワイ、モーリシャス、紅海,岩礁域,体長約25cm,10-30m,大型のセミエビの仲間で、平たい体と団扇のような形の第2触角が特徴。岩礁の亀裂やサンゴ礁の岩棚の下に隠れている。夜行性で、夜になると獲物を探して活発に歩き回る。食用として珍重されるため、乱獲により個体数が減少している場所もある。昼間に見つけるには、岩の奥深くをライトで照らして探す必要がある。
17839,コホシカニダマシ,Neopetrolithes maculatus,紀伊半島以南、東南アジア、ミクロネシア、南太平洋、インド洋,サンゴ礁域,甲長約2cm,5-15m,イソギンチャクと共生するカニダマシの仲間。特にセンジュイソギンチャクなど大型のイソギンチャクの触手の間に隠れて生活する。体は白地に紫色の斑点が散らばり、イソギンチャクの体色によく似合う。イソギンチャクの刺胞毒に対する耐性を持つ。イソギンチャクを観察する際は、触手の間に隠れる本種を探してみると良い。
17840,コマチイバラモエビ,Lebbeus comanthis,房総半島、伊豆半島,浅場から深場の岩礁域,体長約2cm,6-40m,ウミシダに共生するモエビの仲間。ウミシダの腕の間に隠れて生活し、体色も宿主のウミシダに合わせて変化する。赤、黄、黒など様々な色彩パターンがある。ウミシダの腕の付け根や口の周りを注意深く探すと見つけることができる。驚かせるとすぐに隠れてしまうので、静かにアプローチするのが観察のコツ。
3049,コマチガニ,Haroovia japonica,房総半島～九州、南シナ海,岩礁の岩穴、転石帯,甲幅約1.5cm,5-30m,ウミシダ類に共生する小型のカニの仲間。ウミシダの腕の付け根あたりにしがみついて生活している。体色は宿主のウミシダに似せており、赤、黒、黄色など変異に富む。非常に小さく、巧妙に隠れているため見つけるのは難しい。ウミシダを傷つけないように注意しながら、腕の間をライトで照らして根気よく探す必要がある。
3162,コマチコシオリエビ,Allogalathea elegans,相模湾以南、東南アジア、オーストラリア、フィジー、インド洋、紅海,サンゴ礁域、岩礁,甲長約1〜2cm,2-120m,ヤドカリに近いコシオリエビの仲間で、ウミシダに共生する。体色が非常に多様で、宿主のウミシダの色に合わせて赤、黄、黒、白など様々な模様を持つ。ウミシダの腕の付け根に隠れている。ダイバーに人気が高いが、見つけるにはウミシダを丹念に探す必要がある。複数の個体が同じウミシダにいることもある。
7041,コマチテッポウエビ,Synalpheus demani,相模湾以南、東南アジア、ロアヨーテ諸島、紅海,サンゴ礁域、転石帯,体長約2cm,5-50m,ウミシダ類に共生するテッポウエビの仲間。ウミシダの腕の付け根や体表に隠れて生活している。体色も宿主のウミシダに合わせて変化し、擬態している。テッポウエビ特有の大きなハサミを持ち、パチンという音を出すことができる。ウミシダに共生する他のエビやカニと同様、見つけるには根気強い探索が必要。
8157,コメツキガニ,Scopimera globosa,北海道南部以南、韓国、台湾、中国北部,砂泥底、干潟,体長約1.5cm,高潮線-低潮線,砂浜の潮間帯に生息するカニの仲間。干潮時に砂浜に出てきて、砂の中の有機物を砂団子を作りながら食べる。その行動が非常にユニークで、干潟に無数の砂団子が転がる光景が見られる。ダイビングで見る生物ではないが、ビーチエントリーの際などに砂浜を観察すると、集団で活動する様子を見ることができる。
17841,コモンテッポウエビ,Alphaeus sp.2,駿河湾、紀伊半島,サンゴ礁域、転石帯,体長約3cm,4-15m,ダテハゼなどのハゼ類と共生するテッポウエビの仲間。視力の弱いエビが巣穴を掘って住処を提供し、代わりに視力の良いハゼが見張りを務める。エビは巣穴の入り口で常に触角をハゼの体に触れさせ、危険を察知すると一緒に巣穴へ隠れる。砂地の海底を注意深く観察し、ハゼの近くにいるエビの姿を探すと良い。
3129,コモンヤドカリ,Dardanus megistos,房総半島以南、東南アジア、オーストラリア、フランス領ポリネシア、インド洋、紅海,サンゴ礁域、岩礁域,甲長約8cm,1-180m,大型のヤドカリの仲間で、赤い体に青や白の斑点が散りばめられた派手な姿が特徴です。岩礁やサンゴ礁の砂礫底に生息し、雑食性で何でも食べます。イソギンチャクを貝殻につけて、敵からの防御に利用する共生行動が見られます。夜行性傾向が強く、ナイトダイビングでは活発に歩き回る姿を観察しやすいでしょう。
17842,コヤマメガニダマシ,Sakaina yobolai,北海道,砂泥底,甲幅約1cm,2~20m,カニに似た姿をしたヤドカリの仲間で、ハマサンゴなど塊状のイシサンゴ類に共生します。体色は生息するサンゴに酷似しており、見つけるのが非常に難しい擬態の名人です。サンゴの表面や隙間にじっと潜んでいるため、ポリプが開いていない場所などを注意深く探すと、小さな体が見つかることがあります。
17630,コロールアネモネシュリンプ,Periclimenes koroensis,フィリピン、パラオ、オーストラリア北部,サンゴ礁域、イソギンチャク共生,体長約2.5cm,10m~,透明な体を持つカクレエビの仲間で、主にハタゴイソギンチャクやセンジュイソギンチャクと共生します。体がほぼ透明で、背中に白い線、腹部に白い斑点があるのが特徴です。体が透けているため、イソギンチャクの触手に紛れると見つけにくいですが、触手の間をゆっくりと観察すると、動く姿を見つけることができます。
3039,コワタクズガニ,Micippa philyra,東京湾以南、ハワイ、南太平洋、インド洋、アフリカ東岸、紅海,岩礁の岩穴、転石帯,甲幅約4cm,2-50m,体に海綿やホヤなどを付着させて擬態するクモガニの仲間です。装飾した姿は、周囲の岩やサンゴと見分けがつきません。岩礁やサンゴ礁に生息し、じっと動かずにいることが多いです。観察の際は、不自然に動くカイメンや、脚やハサミの形を頼りに探すと見つけられます。夜間に活動することが多いです。
3028,コンペイトウコブシガニ,Heteronucia venusta,相模湾以南、南太平洋,砂泥底,甲幅約1〜1.5cm,3-65m,金平糖のような鋭い突起が甲羅を覆う、特徴的な姿のコブシガニの仲間です。体色は赤、オレンジ、白など個体差があります。夜行性で、昼間は砂の中に潜って目だけを出していることが多いです。ナイトダイビングで砂地を探索すると、歩き回っている姿に出会える確率が高まります。そのユニークな形状が目印です。
2950,コールマンズシュリンプ,Periclimenes colemani,駿河湾以南、フィリピン、インドネシア、オーストラリア北部,深場の岩礁域、転石帯,体長約2cm,15~70m,猛毒を持つイイジマフクロウニにのみ共生する、珍しいカクレエビの仲間です。通常は雌雄のペアで生活し、ウニの棘を器用にかき分けて、表面にスペースを作って暮らしています。白と黒の縞模様はウニの棘に紛れるための完璧な保護色です。ウニを刺激しないよう、棘のない部分をそっと観察するのが見つけるコツです。
3084,ゴイシガニ,Palapedia integra,東京湾～九州、フィリピン、南太平洋、アンダマン海、インド洋東部,藻場域、砂泥底,甲幅2〜4cm,2-15m,ガザミなどに近いカニの仲間で、甲羅に黒い碁石を並べたような左右対称の斑紋があるのが名前の由来です。サンゴ礁の礁池や岩礁の浅い場所に生息しています。動きは俊敏で、危険を感じるとすぐに岩の隙間やサンゴの下に隠れてしまいます。驚かせないように、ゆっくりと近づいて観察するのがポイントです。
7566,ゴウシュウベニツケガニ,Thalamita coeruleipes,琉球列島、ハワイ、南太平洋、オーストラリア、インド洋,サンゴ礁域,甲幅約4cm,1-10m,脚が鮮やかな青色をしているのが特徴的な、ワタリガニの仲間です。サンゴ礁や岩礁の浅い場所に生息しています。特に夜間に活動することが多く、岩の隙間やサンゴの下から出てきて餌を探します。昼間は物陰に隠れているため見つけにくいですが、ナイトダイビングでは美しい青い脚がライトに映え、見つけやすいでしょう。
3008,ゴシキエビ,Panulirus versicolor,相模湾以南、東南アジア、オーストラリア北部、フランス領ポリネシア、インド洋,サンゴ礁域,全長約55cm,3-20m,大型で美しいイセエビの仲間で、その名の通り、緑、青、紫、黄、白など五色の鮮やかな体色が特徴です。サンゴ礁や岩礁の亀裂や穴の奥に潜んでいます。昼間は巣穴から長い触角だけを出していることが多いです。夜になると巣穴から出て活発に活動するため、ナイトダイビングでは全身を観察できるチャンスがあります。
2920,サガミツノメエビ,Phyllognathia simplex,伊豆半島以南、パプアニューギニア、オーストラリア北部,深場の岩礁、サンゴ礁域,体長約0.8cm,30m~,ウミシダ類に共生する、極めて小さなエビの仲間です。体型は細長く、ウミシダの羽枝にそっくりな形と色で擬態しています。宿主であるウミシダの色に合わせて体色も変化に富みます。ウミシダの腕の付け根や羽枝の間を、根気よく探さないと見つけることは困難です。見つけたときは、その完璧な擬態に驚かされるでしょう。
6949,サキシマオカヤドカリ,Coenobita perlatus,八重山諸島以南、東南アジア、ミクロネシア、フランス領ポリネシア、インド,海岸線、陸上,甲長約2cm,陸生,陸上で生活するヤドカリの仲間で、体全体が鮮やかな赤色で、眼柄が白いのが特徴です。海岸近くの林などに生息し、夜行性です。産卵期にはメスが海岸に下りてきて、波打ち際で放卵します。ダイビング中に見ることはありませんが、ビーチエントリーやボート乗り場の周辺で夜間に見かけることがあるかもしれません。
7807,サザナミショウグンエビ,Enoplometopus toigmani,琉球列島、モルジブ、パプアニューギニア,深場の岩礁域,全長約14cm,25m~,赤い体に白い斑点が散在する、美しい大型のエビの仲間です。岩礁の亀裂や洞窟の奥深くに単独で潜んでいます。非常に用心深く、ダイバーの気配を察するとすぐに隠れてしまいます。観察するには、ライトで刺激しすぎず、穴の奥を根気強く探す必要があります。長い第一胸脚が特徴的です。
7420,サナダミズヒキガニ,Latreilia valida,東京湾～九州（太平洋側）、秋田県～九州（日本海側）、東南アジア、インド洋、アフリカ東岸,砂泥底,甲長約1cm,30-300m,非常に細長い脚を持つ、クモのような姿をしたカニの仲間です。砂泥底に生息し、その長い脚で器用に歩きます。体は小さく、目立ちませんが、脚を広げるとかなりの大きさになります。他の生物が付着していることもあり、周囲の環境に溶け込んでいます。砂地をゆっくり移動する姿を見つけるのが観察のポイントです。
3071,サメハダオウギガニ,Atergatopsis germaini,房総半島以南（太平洋側）、富山湾以南（日本海側）、東シナ海、インド洋、紅海、アフリカ東岸,岩礁域、深場,甲幅5〜8cm,1-300m,鮫肌の名が示す通り、甲羅の表面がザラザラした顆粒で覆われているオウギガニの仲間です。サンゴ礁や岩礁の転石の下や隙間に隠れています。夜行性で、昼間は物陰に潜んでいることが多いです。岩をめくったり、隙間をライトで照らしたりすると見つかる可能性がありますが、一部のオウギガニは毒を持つため素手で触らないようにしましょう。
14309,サメハダヒメガザミ,Portunus granularis,相模湾以南、南太平洋、オーストラリア、インド洋、紅海,砂泥底,甲幅約4cm,1-120m,ワタリガニの仲間で、甲羅の表面が細かい顆粒で覆われ、鮫肌のようにザラザラしているのが特徴です。砂地や砂泥底に生息し、昼間は砂に潜っていることが多いです。一番後ろの脚（遊泳脚）がヒレ状になっており、砂を掘ったり泳いだりするのに使います。ナイトダイビングで砂地を移動しているところを観察しやすいです。
6113,サメハダヘイケガニ,Paradorippe granulata,北海道南部以南、韓国、台湾、中国北部,砂泥底、岩礁域,甲長約4cm,3~150m,ヘイケガニの仲間で、甲羅の表面が顆粒で覆われザラザラしています。後ろの2対の脚が背中側にあり、これでカイメンや二枚貝の殻などを背負って擬態する習性があります。砂泥底に生息し、昼間は砂に浅く潜っていることもあります。何かを背負って歩く姿が観察のポイントで、背負っているものと一体化して見つけにくいです。
6273,サメハダヤドカリ,Dardanus lagopodes,紀伊半島以南、東南アジア、オーストラリア、ハワイ、ツアモツ、セイシェル諸島,サンゴ礁域、岩礁の岩穴,甲長約4cm,5-60m,大型のヤドカリの仲間で、名前の通り甲や脚がザラザラした顆粒や短い毛で覆われています。サンゴ礁や岩礁の砂礫底に生息します。左のハサミが右よりも大きいのが特徴です。夜行性が強く、昼間は岩陰などに隠れていますが、ナイトダイビングでは活発に餌を探して歩き回る姿をよく見かけます。
2918,サラサエビ,Rhynchocinetes uritai,房総半島～下関、韓国,岩礁域,体長約4cm,3-30m,腰を折ったような独特の体型をしたエビの仲間です。岩礁やサンゴ礁の岩陰、亀裂などに群れで生息しています。危険を感じると、体を折り曲げた状態から一気に伸ばし、後ろ向きに素早く跳ねて逃げます。ライトを当てると目が赤く光るのが特徴で、岩陰を照らすとたくさんの赤い光点として見つかります。
