id,name,scientific_name,distribution,habitat,size,depth_range,description
4750,ツマグロ,Carcharhinus melanopterus,南日本の太平洋岸、琉球列島；インド・太平洋、地中海（溝入）,サンゴ礁付近の浅場、稀に沖合い,全長約2m,15m,メジロザメの仲間で、全てのヒレの先端が黒いのが最大の特徴です。サンゴ礁の非常に浅い場所を好み、水深1mほどの場所を泳ぎ回っていることもあります。小型の魚や甲殻類、タコなどを捕食します。比較的小型でおとなしいサメですが、刺激すると攻撃してくる可能性もあるため、静かに観察することが大切です。
4871,ツマグロサンカクハゼ,Fusigobius melacron,高知県、奄美大島、沖縄諸島、西表島；インド・太平洋,サンゴ礁域、内湾の水深10～40mのガレ場や崖下の砂だまり、サンゴの周辺,全長4.5cmほど,15m,ハゼの仲間で、半透明の体に黒い斑点が散らばる美しい姿をしています。サンゴ礁の砂地やガレ場に生息し、腹ビレで体を支えるようにして海底にいます。特に尾ビレの付け根にある黒い斑点が目立ちます。普段はあまり動きませんが、危険を感じると素早く短い距離を移動しては止まる、という行動を繰り返します。
2722,ツマグロハタンポ,Pempheris japonica,南日本の太平洋岸、琉球列島、小笠原諸島；フィリピン,岩礁域の浅所、岩穴や崖の下,全長約8cm,10m,ハタンポの仲間で、夜行性の魚です。日中は岩礁の洞窟やオーバーハングの下に密集して大きな群れを作っています。暗がりで銀色の体がきらめく様子は圧巻です。夜になると群れは解散し、それぞれ活発に泳ぎ出して動物プランクトンなどを捕食します。背ビレと尾ビレの先端が黒いのが特徴です。
3783,ツマグロマツカサ,Myripristis adusta,南日本の太平洋岸、琉球列島；インド・太平洋,岩礁域、サンゴ礁域,全長約15cm,10m,イットウダイの仲間で、夜行性の魚です。日中はサンゴ礁の洞窟や岩の隙間に潜んでいますが、大きな赤い目と、背ビレ・尾ビレの後端が黒いのが特徴です。夜になると隠れ家から出てきて、甲殻類などを捕食します。マツカサウオの仲間と似ていますが、本種はアゴの下に発光器を持っていません。
16847,ツマジロ,Carcharhinus albimarginatus,琉球列島；インド・汎太平洋,外洋の島周り、サンゴ礁内や浅所,全長2.7mに達する,20m,メジロザメの仲間で、大型のサメです。第一背ビレ、胸ビレ、尾ビレの下端が白く縁取られているのが名前の由来であり、見分けるポイントです。サンゴ礁の外縁やドロップオフなど、外洋に面した流れの速い場所を好みます。好奇心が強く、ダイバーに近づいてくることもありますが、大型で潜在的に危険なため、常に距離を保ち、刺激しないように注意が必要です。
3845,ツマジロオコゼ,Ablabys taenianotus,南日本の太平洋、伊豆諸島、琉球列島；東部インド洋～西部大西洋の熱帯域,サンゴ礁、岩礁、海藻のそば,全長約8cm,10m,ハオコゼの仲間で、背ビレが帆のように大きいのが特徴です。死んだ葉や海藻に擬態しており、海底でゆらゆらと揺れるように泳ぎます。背ビレには毒があるので注意が必要です。体色は褐色、黄色、黒など個体変異に富んでいます。砂泥底やガレ場にいることが多く、そのユニークな動きから「リーフフィッシュ」とも呼ばれます。
133,ツマジロモンガラ,Sufflamen chrysopterum,南日本の太平洋岸、伊豆・小笠原諸島、琉球列島；インド・太平洋,サンゴ礁域、礁池や礁斜面,全長約20cm,15m,モンガラカワハギの仲間で、尾ビレの付け根が黄色いのが特徴です。サンゴ礁や岩礁域に生息し、強い縄張り意識を持っています。ウニや甲殻類など硬い殻を持つ生き物を、頑丈な歯でかみ砕いて食べます。繁殖期には巣を守るために非常に攻撃的になり、ダイバーにも突進してくることがあるため、注意が必要です。
5022,ツマリギンポ,Stanulus talboti,琉球列島、小笠原諸島；中・西部太平洋の熱帯域,サンゴ礁域、波の荒い礁縁の3m以浅,全長約8cm,7m,ギンポの仲間で、ずんぐりとした体型をしています。波当たりの強いサンゴ礁の浅瀬や、潮間帯のタイドプールに生息しています。岩のくぼみや穴を巣にしており、そこから顔を出している姿がよく見られます。目の上にある短い皮弁が特徴です。非常に浅い場所にいるため、シュノーケリングでも観察することができます。
99,ツマリテングハギ,Naso brevirostris,青森県、富山湾、南日本の太平洋岸、伊豆・小笠原諸島、琉球列島；インド・太平洋,サンゴ礁域、礁外縁の潮通しのよい所,全長約35cm,12m,テングハギの仲間で、成魚は額に短い角状の突起を持つのが特徴です。体色は灰色から青みがかった色まで変化します。主に藻類を食べ、サンゴ礁の外縁やドロップオフの中層で大きな群れを作って泳いでいることが多いです。ダイバーが近づくと群れ全体でさっと向きを変えます。角が長いテングハギとの違いに注目すると見分けやすいでしょう。
498,ツムブリ,Elagatis bipinnulata,南日本、琉球列島；全世界の温・熱帯域,沖合いから沿岸の表層,全長約1m,15m,アジの仲間で、流線型の体に鮮やかな黄色の縦縞が2本入る美しい魚です。外洋に面したサンゴ礁やドロップオフの周辺を高速で泳ぎ回る回遊魚で、主に動物プランクトンや小魚を捕食します。ダイバーの前をあっという間に通り過ぎることが多いですが、そのスピード感と美しい体色は一見の価値があります。単独または数匹の群れで行動します。
291,ツユベラ,Coris gaimard,南日本の太平洋岸、琉球列島、小笠原諸島；東部インド洋～中・西部太平洋の熱帯域,サンゴ礁域のガレ場、水深10m程の礁斜面や水路など潮通しのよい所,全長約25cm,7m,ベラの仲間で、成長に伴い体色が劇的に変化することで知られます。幼魚は鮮やかなオレンジ色の体に白い斑点がありますが、成魚は濃紺の地に無数の青い小斑点が散りばめられた姿になります。サンゴ礁や岩礁域の砂地が混じる場所を好み、底生生物を捕食します。危険を感じると素早く砂の中に潜って隠れるため、驚かせないように観察しましょう。
15346,ツルグエ,Liopropoma latifasciatum,南日本の太平洋岸、伊豆大島、琉球列島、朝鮮半島南部、台湾、パラオ,岩礁域、崖の穴、物陰,全長約13cm,30m,ハタの仲間で、鮮やかな赤色の体に太い黄色の縦縞が入る美しい魚です。岩礁の亀裂や洞窟の奥など、暗がりを好み、単独でひっそりと生活しています。警戒心が強く、ダイバーが近づくとすぐに岩陰に隠れてしまうため、観察するにはライトで照らしすぎず、ゆっくりと接近するのがコツです。深場のオーバーハング下などで見られます。
12265,テッポウイシモチ,Ostorhinchus kiensis,相模湾以南～東シナ海；朝鮮半島、中国、台湾,内湾の砂泥底、物陰やハナギンチャク類の周囲,全長約7cm,25m,テンジクダイの仲間で、半透明の体に銀色の腹部、尾びれの付け根に明瞭な黒い斑点があるのが特徴です。岩礁やサンゴ礁の岩陰、サンゴの枝の間などに大きな群れを作って隠れています。口の中で卵を育てる「口内保育」の習性があり、繁殖期のオスは口を大きく膨らませている様子が観察できることもあります。昼間は物陰に潜んでいます。
7016,テリエビス,Sargocentron ittodai,南日本の太平洋岸、 伊豆・小笠原諸島、 琉球列島； インド・太平洋,岩礁域、 サンゴ礁域,全長約18cm,12m,イットウダイの仲間で、赤い体に白い縦縞が入り、大きな目が特徴的な夜行性の魚です。昼間はサンゴの隙間や岩陰、洞窟の天井付近で逆さまになってじっと潜んでいます。群れでいることが多く、ライトを当てると赤い体がよく目立ちます。夜になると活発に泳ぎ出し、甲殻類などを捕食します。昼間のダイビングでは隠れ家を探すのが観察のポイントです。
531,テングカワハギ,Oxymonacanthus longirostris,和歌山、琉球列島；紅海を除くインド・太平洋,サンゴ礁域、礁池内など浅所,全長約6cm,8m,カワハギの仲間で、長く伸びた口と、鮮やかなオレンジ色の体に黒い縁取りのある白い斑点が特徴です。ミドリイシなど、枝状のサンゴを住処兼食料としており、サンゴのポリプを食べます。常にペアで行動し、サンゴの枝の間をホバリングするように泳ぎます。サンゴに擬態しているため、注意深く探さないと見過ごしてしまうことがあります。
2599,テングダイ,Evistias acutirostris,南日本の太平洋岸、小笠原諸島；西部太平洋の熱帯域、ハワイ諸島,岩礁域,全長約30cm,20m,特徴的な長い背びれを持つ魚で、白黒の縞模様が目立ちます。和名の通り、天狗のように突き出た口で、岩の表面や砂地の中にいる甲殻類やゴカイなどを探し出して食べます。比較的深い岩礁域や砂礫底を好み、数匹の群れで底近くをゆっくりと泳いでいる姿が見られます。そのユニークな姿からダイバーに人気がありますが、個体数は多くありません。
31,テングチョウチョウウオ,Chaetodon selene,南日本の太平洋岸、琉球列島；西部太平洋の熱帯域,岩礁域、サンゴ礁域,全長約14cm,23m,チョウチョウウオの仲間で、黄色い体に三日月型の黒い斑紋が複数入るのが特徴です。比較的深いサンゴ礁の斜面やドロップオフで見られ、単独またはペアで行動します。他のチョウチョウウオと比べてやや深い場所を好む傾向があります。海底近くを泳ぎながら、岩やサンゴの表面についた小動物などを探して食べています。
14057,テングノオトシゴ,Pegasus laternarius,相模湾、駿河湾、高知県；インド・西太平洋,沿岸浅所の砂泥底,全長約8cm,15m,ウミテングの仲間で、翼のような大きな胸びれと、長く伸びた吻（ふん）が特徴です。タツノオトシゴとは近縁ではありません。泥や砂の海底に生息し、大きな胸びれを広げて海底を滑るように移動します。普段は海底の色に擬態しているため見つけるのが難しいですが、動き出すと特徴的な姿がよくわかります。驚くと短い距離を泳ぎます。
100,テングハギ,Naso unicornis,北海道、山陰地方、南日本の太平洋岸、伊豆・小笠原諸島、琉球列島；朝鮮半島、インド・太平洋,サンゴ礁域、礁外縁の潮通しのよい所,全長約45cm,12m,ニザダイの仲間で、成魚は目の間に一本の角状突起が長く伸びるのが最大の特徴です。この角はオスの方がより長くなります。サンゴ礁や岩礁域で単独または群れで生活し、主に藻類を食べます。尾びれの付け根には鋭い骨質板があり、不用意に触ると危険です。ダイバーには比較的慣れており、ゆっくりと泳ぐ姿を観察できます。
95,テングハギモドキ,Naso hexacanthus,南日本の太平洋岸、伊豆・小笠原諸島、琉球列島；インド・太平洋,サンゴ礁域、水深15m程の礁外縁の崖など、潮通しのよい所,全長約45cm,23m,テングハギに似たニザダイの仲間ですが、額に角状の突起がないのが大きな違いです。体は青みがかった灰色で、サンゴ礁の外縁やドロップオフの中層で非常に大きな群れを作ります。プランクトンを主食とし、口を大きく開けて捕食する様子が見られます。ダイバーが近づいてもあまり逃げず、群れに包まれるような体験ができることもあります。
4445,テングヘビギンポ,Helcogramma rhinoceros,琉球列島；東部インド洋～西部太平洋の熱帯域,サンゴ礁域の水深5～11m、大きな転石の表面,全長約4cm,8m,ヘビギンポの仲間で、オスの目の上に伸びる長い皮弁が名前の由来です。岩や死んだサンゴの表面に生息し、ちょこまかと素早く動き回ります。非常に小さく、保護色のため見つけるのは難しいですが、一度見つけるとその場で縄張りを守るように留まることが多いです。繁殖期のオスは婚姻色で体が黒っぽくなり、より見つけやすくなります。
3828,テンジクイサキ,Kyphosus cinerascens,南日本、琉球列島、小笠原諸島；インド・太平洋,岩礁域の浅所,全長約25cm,18m,イスズミの仲間で、銀灰色の体に不明瞭な縦縞が入ります。サンゴ礁や岩礁域の中層で大きな群れを作って漂うように泳いでいます。主に藻類を食べますが、雑食性です。他のイスズミの仲間と混じって群れを形成することもあります。ダイバーが近づいてもあまり警戒せず、群れの中を通り抜けることができる穏やかな魚です。
4981,テンジクスズメダイ,Abudefduf bengalensis,南日本の太平洋岸、琉球列島、小笠原諸島、東部インド洋～西部太平洋の温・熱帯域,岩礁域やサンゴ礁域の6m以浅,全長約12cm,3m,スズメダイの仲間で、オヤビッチャによく似ていますが、背中が黄色くならず、体側の黒い横縞がより明瞭です。非常に浅いサンゴ礁やタイドプール、港の中などでも見られる身近な魚です。群れで行動し、岩やサンゴの表面についた藻類を食べます。ダイバーがエントリーしてすぐの浅瀬でよく出迎えてくれる魚の一つです。
314,テンス,Iniistius dea,南日本；東部インド洋～西部太平洋の熱帯域,沿岸浅所の砂底や砂泥底,全長約2.5cm,12m,ベラの仲間で、平たい体と非常に長い背びれの第1、第2棘が特徴です。幼魚のうちはこの背びれをなびかせて泳ぎ、枯葉に擬態していると考えられています。サンゴ礁の砂地を好み、危険を感じると瞬時に砂の中に潜って姿を消します。その隠れる速さは見事です。成長すると背びれは短くなり、体色も変化します。
318,テンスモドキ,Xyrichtys sciistius,南日本の太平洋岸、琉球列島、小笠原諸島,サンゴ礁域のガレ場,全長約3cm,24m,テンスによく似たベラの仲間で、体は側扁し、頭部が角張っています。テンスと同様に、危険を感じると目にも留まらぬ速さで砂の中に潜ります。サンゴ礁域のきれいな砂底に生息し、小さな甲殻類などを捕食します。普段は砂の上をホバリングするように泳いでいますが、ダイバーの気配を察するとすぐに隠れてしまうため、観察には忍耐が必要です。
5755,テンツキチョウチョウウオ,Chaetodon oligacanthus,小笠原諸島；東部インド洋～西部太平洋の熱帯域,砂泥底、内湾性で砂泥底,全長約10cm,18m,チョウチョウウオの仲間で、白い体にV字型の黒い帯が複数入るのが特徴です。枝状のミドリイシサンゴの周辺に生息し、そのポリプを主食としています。サンゴに依存して生活しているため、生きたサンゴが豊富な場所でしか見られません。通常はペアか小さなグループで、サンゴの枝の間を縫うように泳いでいます。
348,デバスズメダイ,Chromis viridis,琉球列島；インド・太平洋,サンゴ礁域の礁池、枝状サンゴ付近,全長約6cm,12m,スズメダイの仲間で、光の当たり方によって緑や青に見える美しい体色が特徴です。枝状サンゴの上で非常に大きな群れを作り、その周りを乱舞するように泳ぎます。危険が迫ると一斉にサンゴの枝の間に隠れます。ダイビングでは最もよく見かける魚の一つで、サンゴ礁の華やかな景観を象徴する存在です。プランクトンを食べます。
358,デルタスズメダイ,Chromis delta,南日本の太平洋岸、 琉球列島； インド・西太平洋,サンゴ礁外側斜面の水深10～80mに生息、20m以深に多い,全長約8cm,30m,スズメダイの仲間で、体は黒っぽく、尾びれの中央から上下にかけて白い三角形の模様が入るのが名前の由来です。サンゴ礁の斜面やドロップオフなど、やや深い場所で見られます。単独か小さな群れで、岩やサンゴから少し離れた中層を泳いでいることが多いです。他のスズメダイに比べて、特徴的な尾びれの模様で見分けやすいです。
325,トウアカクマノミ,Amphiprion polymnus,沖縄島以南；西部太平洋の熱帯域,内湾に生息するイボハタゴイソギンチャクと共生,全長約14cm,13m,クマノミの仲間で、黒い体に額から鼻先にかけて白い帯が入るのが特徴です。他のクマノミ類と異なり、砂地に生える特定のイソギンチャク（センジュイソギンチャクなど）と共生します。イソギンチャクの近くをペアで泳いでいますが、警戒心が強く、近づくとすぐにイソギンチャクの中に隠れてしまいます。観察は距離を保って行いましょう。
5503,トウカイスズメダイ,Chromis mirationis,南日本の太平洋岸、台湾、オーストラリア北岸〜西岸、西部太平洋南部,岩礁域の水深40〜90m,全長約5cm,45m,スズメダイの仲間で、伊豆半島などの温帯域で見られる日本固有種です。青みがかった体色で、幼魚は特に鮮やかな青色をしています。水深40m以深の岩礁域に生息するため、通常のダイビングではなかなか出会えません。深場を好むため、観察するには相応の計画とスキルが必要です。岩の窪みなどに小さな群れでいることが多いです。
2631,トウシマコケギンポ,Neoclinus toshimaensis,千葉県から和歌山県までの南日本の太平洋岸,岩礁域の5m以浅、岩穴や貝が岩に開けた穴,全長約5cm,10m,コケギンポの仲間で、岩の穴やフジツボの殻など、ごく小さな隙間から顔を出している姿が観察されます。頭部にふさふさした皮弁があり、愛嬌のある顔つきをしています。縄張り意識が強く、他の個体が近づくと口を大きく開けて威嚇します。ダイバーが指などを近づけても威嚇してくることがあり、その姿が人気です。
4625,トカゲエソ,Saurida elongata,青森県以南の南日本、沖縄島；朝鮮半島、中国、台湾,浅海～やや深みの砂泥底,全長約30cm,22m,エソの仲間で、ワニのような鋭い歯が並んだ大きな口と、ヘビのように細長い体が特徴です。砂泥底に生息し、体を半分砂に埋めて獲物を待ち伏せします。目の前に来た小魚などを一瞬で捕食するハンターです。ダイバーが近づいてもあまり動じませんが、カモフラージュしているため見つけにくいことがあります。夜行性で、夜間に活発になります。
12416,トカゲゴチ,Inegocia japonica,南日本；東部インド洋〜西部太平洋の熱帯域,大陸棚の浅所,全長約25cm,15m,コチの仲間で、平たい体と上を向いた大きな目が特徴です。砂泥底に巧みに擬態して隠れており、獲物である小魚や甲殻類を待ち伏せします。目の上にある皮弁が他のコチと見分けるポイントになります。ダイバーが真上を通りかかっても気づかないほど擬態が上手ですが、驚くと砂煙を上げて素早く逃げます。
276,トカラベラ,Halichoeres hortulanus,南日本の太平洋岸、琉球列島、小笠原諸島；インド・太平洋,岩礁域、サンゴ礁域、砂底やガレ場,全長約18cm,10m,ベラの仲間で、幼魚と成魚、オスとメスで体色が異なります。特にオスの成魚は緑色の体にピンク色の網目模様が入り、非常に派手な姿をしています。サンゴ礁や岩礁域の砂地が混じる場所を好み、海底を泳ぎ回りながら甲殻類などを探します。好奇心が旺盛な個体もおり、ダイバーの周りを泳ぐこともあります。
3799,トガリエビス,Sargocentron spiniferum,八丈島、紀伊半島以南の南日本の太平洋岸、琉球列島、小笠原諸島；インド・太平洋,岩礁域、サンゴ礁域,全長約28cm,20m,イットウダイの仲間の中で最大級の種類です。全身が鮮やかな赤色で、目の下にある長く鋭いトゲが名前の由来です。このトゲには毒があるため注意が必要です。夜行性で、昼間は洞窟や岩の深い亀裂の奥に潜んでいます。大型で迫力がありますが、臆病な性格で、ライトを当てるとすぐに奥へ隠れてしまいます。
10936,トグロコウイカ,Spirula spirula,全世界の熱・亜熱帯の外洋,中深層,体長約5cm,100-1000m,イカやタコと同じ頭足類の仲間で、体内にアンモナイトのような螺旋状の殻を持つのが最大の特徴です。通常は水深100m以深の深海に生息するため、ダイビング中に生きた姿を観察できる機会は極めて稀です。死後に浮上した体内の殻が海岸に打ち上げられることがあり、ビーチコーミングで見つけることができます。
2839,トゲカナガシラ,Lepidotrigla japonica,隠岐島、南日本の太平洋岸、北九州；南シナ海、インドネシア,砂泥底、貝殻まじりの砂底,全長約25cm,18m,ホウボウの仲間で、翼のように美しい青緑色の大きな胸びれが特徴です。胸びれの一部が脚のように変形しており、これを使って海底を歩くように移動します。普段は砂泥底に生息し、胸びれをたたんでいますが、驚くと翼を広げて滑空するように泳ぎます。その美しい胸びれを広げた瞬間は、ダイバーにとって見どころの一つです。
3837,トゲダルマガレイ,Bothus pantherinus,南日本の太平洋岸、伊豆・小笠原諸島、琉球列島；インド・太平洋,サンゴ礁域、礁池内など浅所の砂底,全長約20cm,20m,カレイの仲間で、両目が体の左側に集まっているのが特徴です。砂地やガレ場に生息し、周囲の色に合わせて体色を変化させる擬態の名人です。体表にあるヒョウ柄のような斑紋が名前の由来ですが、これも環境によって濃淡が変わります。じっとしていると見つけるのは困難ですが、目の動きや体の輪郭に注目すると発見できます。
9,トゲチョウチョウウオ,Chaetodon auriga,山陰地方、南日本の太平洋岸、琉球列島、朝鮮半島、インド・太平洋岩礁域、サンゴ礁域,サンゴ礁域、岩礁域,全長約13cm,10m,チョウチョウウオの仲間で、背びれの後方が糸状に長く伸びるのが大きな特徴です。サンゴ礁から岩礁、砂地まで幅広い環境に適応しており、単独またはペアで行動します。雑食性で、藻類やサンゴのポリプ、小型の甲殻類などを食べます。ダイバーにも比較的人懐っこく、観察しやすいチョウチョウウオの一つです。
14366,トゲヨウジ,Syngnathoides biaculeatus,南日本の太平洋岸、八丈島、兵庫県浜坂、琉球列島；インド・太平洋,湾内の海藻、浮遊海藻,全長約20cm,水面下,ヨウジウオの仲間で、細長い体とトゲトゲした体表が特徴です。主に海藻や流れ藻に擬態して生活しており、体を縦にして漂うように泳ぎます。尾びれがなく、代わりに尾で海藻などに巻きついて体を固定します。水面直下の流れ藻を探すと見つかることが多く、ダイビングの安全停止中に観察できることもあります。
