id,name,scientific_name,distribution,habitat,size,depth_range,description
1255,セジロモウミウシ,Costasiella sp.1,南西諸島、パプアニューギニア,藻場域、転石帯,体長約3〜5mm,1-10m,緑色の葉のような背中の突起が特徴的な、ウミウシの中でも特に小型の仲間です。この突起には、食べた海藻の葉緑体を取り込んで光合成をさせる「盗葉緑体現象」という特殊な能力があります。浅い砂地の緑藻（ミルなど）の上で見つかることが多く、その小ささから見つけるにはマクロな視点での観察が不可欠です。
1070,セスジイバラウミウシ,Okenia pellucida,インド-太平洋,岩礁域の転石帯や藻場域、サンゴ礁の岩穴,体長約4〜20mm,10-30m,イバラウミウシの仲間で、半透明の白い体に、背中の縁に沿って黄色い指状の突起が並んでいるのが特徴です。岩礁域に生息し、フサコケムシなどのコケムシ類を捕食します。ダイバーは、餌となるレース状のコケムシ群体の上を探すと見つけやすいです。体の周りの突起は防御の役割も果たしていると考えられています。
1777,セスジウミウシ,Mexichromis lemniscata,インド-太平洋,サンゴ礁域、岩礁の岩穴,体長約5〜23mm,5-25m,イロウミウシの仲間で、紫色の体に3本の白い縦線が入り、外套膜の縁が黄色く縁取られる美しい種です。岩礁の壁面や転石の下などで見られ、特定のカイメン類を食べていると考えられています。ダイバーが近づくと、外套膜の縁をリズミカルに上下に波打たせる行動を見せることがあります。これは威嚇や警告の行動と推測されています。
930,セスジスミゾメミノウミウシ,Pleurolidia juliae,インド-西太平洋,サンゴ礁域、岩礁の岩穴,体長約20〜30mm,10-30m,ミノウミウシの仲間で、半透明の体に黒い斑点と背中に一本の白い線（セスジ）が走るのが特徴です。背中の突起（ミノ）は青みがかっており、先端が黄色くなります。岩礁域に生息し、ヒドロ虫類を捕食します。ミノには食べたヒドロ虫の刺胞を蓄え、防御に用います。美しい配色のためダイバーに人気がありますが、擬態しているため見つけるには注意が必要です。
857,セスジミノウミウシ,Flabellina sp.1,日本,岩礁の岩穴、転石帯,体長約12mm,10-25m,ミノウミウシの仲間で、半透明の体に白い細かな斑点が密に入り、背中の中央に一本の白い線が走ります。背中の突起（ミノ）はオレンジ色で、先端が白くなるのが特徴です。岩礁域でヒドロ虫の仲間を食べて生活しています。ダイバーは、岩壁に生えている羽毛のようなヒドロ虫の群体を探すと、本種が食事している場面に出会えるかもしれません。
1245,セスジミノモドキ,Flabellina sp.2,西太平洋,岩礁の岩穴、転石帯,体長約10〜20mm,10-30m,ミノウミウシの仲間で、セスジミノウミウシに似ていますが、より体が細長く、背中のミノの付き方が異なります。半透明の体に白い線が背中を走り、ミノは赤みがかったオレンジ色をしています。岩礁域の壁面などで、餌となるヒドロ虫を捕食しています。似た種が多いため、ミノの色や体の斑点、触角の形状などが識別のポイントになります。
731,セトイロウミウシ,Goniobranchus setoensis,インド-太平洋,サンゴ礁域、岩礁の岩穴,体長約20〜35mm,5-30m,イロウミウシの仲間で、乳白色から淡い黄色の地に、紫色の斑点が散らばり、外套膜の縁が紫色で縁取られます。二次鰓と触角は鮮やかなオレンジ色です。岩礁の壁面や転石の下で観察され、特定の種類のカイメンを食べていると考えられています。他のイロウミウシの仲間と同様に、外套膜の縁を波打たせて移動することがあります。
928,セトミノウミウシ,Setoeolis inconspicua,北海道以南、九州,岩礁の岩穴、転石帯,体長約35mm,10-40m,ミノウミウシの仲間で、体が非常に細長く、半透明の白色をしています。背中の突起（ミノ）は数が少なく、内部に褐色の内臓が透けて見えます。岩礁域や砂礫底に生息し、スナギンチャクの仲間を捕食するという特異な食性を持ちます。ダイバーは、スナギンチャクの群体を探し、その中に紛れ込んでいる本種を見つけられることがあります。
709,セトリュウグウウミウシ,Nembrotha sp.1,日本、フィリピン、インドネシア,サンゴ礁域、岩礁の岩穴,体長約40〜50mm,5-25m,大型になるリュウグウウミウシの仲間で、黒い体に緑色の隆起線や斑点が入り、触角と鰓がオレンジ色という派手な色彩をしています。この体色は捕食者に対する強い警告色となっています。岩礁域で活発に動き回り、ホヤの仲間を捕食します。ダイバーは、餌となるホヤの群体周辺を探すと、食事中の個体を見つけやすいでしょう。
1072,セナキイバラウミウシ,Okenia sp.2,西太平洋,サンゴ礁域、転石帯,体長約10〜15mm,10-30m,イバラウミウシの仲間で、乳白色の体に、背中の中央に黄色い隆起線があり、その両脇に指状の突起が並びます。岩礁域に生息し、餌となるコケムシ類を食べています。ダイバーは、岩壁にシート状に広がるコケムシの上を探すと見つけやすいです。小型で目立たないため、マクロな観察眼が発見の鍵となります。
2177,セナヒダビロウドウミウシ,Thordisa oliva,南アフリカ、慶良間諸島,岩礁の岩穴、転石帯,体長約5〜20mm,5-20m,ビロウドウミウシの仲間で、体は柔らかく、表面は細かい顆粒状の突起で覆われています。体色は黄褐色で、背中の中央に一対のヒダ状の隆起があるのが特徴です。岩礁域の岩の裏側や転石の下で、特定のカイメンを食べて生活しています。目立たない色合いと質感のため、カイメンや岩肌によく紛れています。
1658,セリスイロウミウシ,Hypselodoris cerisae,日本、台湾、マレーシア,サンゴ礁域、岩礁の岩穴,体長約45mm,10-40m,イロウミウシの仲間で、鮮やかな紫色の体に、白い一本の縁取りがあるのが特徴です。触角と二次鰓はオレンジ色で、紫の体色とのコントラストが美しいです。岩礁の壁面や斜面で見られ、特定のカイメンを食べていると考えられます。よく似たゾウゲイロウミウシとは、体の縁取りが白い単線であることで区別できます。
1959,センジュミノウミウシ,Phyllodesmium briareum,西太平洋,サンゴ礁域、転石帯,体長約15〜30mm,5-20m,ミノウミウシの仲間で、好物の軟質サンゴ（ソフトコーラル）であるウミキノコ類に擬態しています。体色は白や褐色で、背中の突起（ミノ）はウミキノコのポリプにそっくりです。ミノの内部に褐虫藻を取り込み、光合成をさせて栄養を得ることもできます。ダイバーはウミキノコを注意深く観察し、動いているポリプのようなものを探すと見つけられます。
741,センテンイロウミウシ,Hypselodoris decorata,西太平洋,サンゴ礁域、岩礁の岩穴,体長約30〜35mm,10-30m,イロウミウシの仲間で、白い体に紫色の斑点が散りばめられ、外套膜の縁が黄色と紫の二重線で縁取られる美しい種です。岩礁の壁面などで見られ、餌は特定のカイメン類と考えられています。ダイバーは岩の隙間やカイメンの近くを探すと良いでしょう。体色のパターンには個体差があり、観察する楽しみの一つです。
678,センニンウミウシ,Aegires exechus,西太平洋、中部太平洋,サンゴ礁域、岩礁の岩穴、転石帯,体長約7〜8mm,5-20m,フジタウミウシ科に属するウミウシの仲間で、体は硬く、表面はイボ状の突起で覆われています。体色は白色から黄色で、岩礁に付着する青色のカイメンを食べて生活しています。餌のカイメンと同じ場所にいることが多く、その色合いからカイメンの上では目立ちます。ダイバーは青色のカイメンを探すことが発見の近道です。
680,センヒメウミウシ,Aegires villosus,インド-西太平洋,サンゴ礁域、転石帯,体長約15〜17mm,10-30m,フジタウミウシ科に属するウミウシの仲間で、体表が毛深い突起で密に覆われているのが特徴です。体色は白、黄色、オレンジなど変異があります。岩礁域でカイメン類を食べて生活しています。全身が突起で覆われているため、ウミウシだと気づきにくいかもしれません。触角や体の動きに注目することで識別できます。
774,センリョウウミウシ,Carminodoris bifurcata,西太平洋、中部太平洋,岩礁の岩穴、転石帯,体長約40〜60mm,10-30m,ドーリス類のウミウシの仲間で、体は硬く、表面は細かな突起で覆われています。体色はオレンジ色から赤色で、黒い斑点が散在します。二次鰓が二股に分かれる（bifurcata）ことが学名の由来ですが、外見上は分かりにくいです。岩礁の岩陰や転石の下で、赤いカイメンを食べています。保護色になっているため見つけにくいことがあります。
652,ゼニガタフシエラガイ,Pleurobranchus forskalii,インド-西太平洋熱帯域,砂泥底、転石帯,体長約50〜200mm,3-25m,大型になるフシエラガイの仲間で、外套膜の下に大きな貝殻を持ちます。体色は赤褐色で、白い輪紋や斑点が散在し、和名のゼニガタ（銭形）の由来となっています。夜行性で、日中は岩陰や砂の中に隠れています。ナイトダイビングでは、海底を活発に這い回る姿が見られます。危険を感じると酸性の液体を分泌します。
1721,ゼブラユリヤガイ,Julia zebra,インド-太平洋,サンゴ礁域、藻場域,体長約4〜5mm,1-10m,二枚貝のような緑色の貝殻を持つ、非常に珍しい生態の巻貝の仲間です。貝殻には黒い縞模様があり、ゼブラ（シマウマ）の名の由来となっています。浅い海の緑藻（ミルなど）に付着して生活し、その葉緑体を体内に取り込む「盗葉緑体現象」を行います。非常に小さく、見つけるにはミルを一枚一枚めくるような丹念な探索が必要です。
1746,ゼンチュウウミウシ,Lomanotus vermiformis,インド-西太平洋、大西洋,サンゴ礁域、岩礁の岩穴、転石帯,体長約10〜30mm,10-35m,細長い体を持つウミウシの仲間で、体の両側に波打つヒダ状の突起が並びます。体色は半透明の白色からオレンジ色です。岩礁域で、餌となるヒドロ虫の群体に絡みつくようにして生活しています。ヒドロ虫に擬態しているため見つけにくいですが、ダイバーは羽毛状のヒドロ虫を注意深く観察することで発見できます。体をくねらせて泳ぐこともあります。
2107,ソウゲンウミウシ,Sohgenia palauensis,インド-西太平洋,サンゴ礁域、岩礁の岩穴,体長約10〜15mm,15-30m,ドーリス類のウミウシの仲間で、パラオで発見されたことからこの名が付きました。体は乳白色で、表面には多数の微細な突起があり、背中には数個の褐色斑があります。岩礁の壁面や岩陰に生息しますが、生態についてはまだ不明な点が多いです。ダイバーにとっては、見つけることができれば非常に幸運な珍しい種の一つです。
17895,ソウシュンブドウガイ,Haminoeidae sp.3,南西諸島,藻場域、砂泥底,体長約3.5〜7mm,1-15m,ブドウガイの仲間で、薄く壊れやすい貝殻を持っています。体は鮮やかな緑色で、青や黄色の小点が散らばり非常に美しいです。浅いサンゴ礁域の砂地や藻場に生息しています。日中は砂に潜っていることが多く、夜間に活動します。非常に小さいため、ナイトダイビングで砂地をライトで照らしながらゆっくり探すのが発見のコツです。
2097,ソコドウミコチョウ,Siphopteron sp.1,インド-西太平洋,砂泥底,体長約5mm,10-25m,ウミコチョウの仲間で、頭部に翼のような側足（そくそく）を持ち、これをはためかせて泳ぐことができます。体色は黄色やオレンジ色で、後方に伸びる突起が特徴です。サンゴ礁域の砂礫底に生息し、扁形動物（ヒラムシなど）を捕食します。非常に小さく、普段は海底を這っているため、ダイバーは砂地を注意深く観察する必要があります。
785,ソバカスウミウシ,Driopsilla sp.1,日本,岩礁の岩穴、転石帯,体長約10〜20mm,10-30m,ミノウミウシの仲間で、半透明の体に茶色や黒の斑点がソバカスのように散らばることが和名の由来です。背中の突起（ミノ）は棍棒状で、先端が白くなっています。岩礁域でコケムシの仲間を食べて生活しています。ダイバーは、岩壁に生えるレース状やフサフサしたコケムシの群体の上を探すと見つけやすいでしょう。
2005,ソバカスフシエラガイ,Pleurobranchus glandis,西太平洋、中部太平洋,砂泥底、藻場域,体長約150〜300mm,5-30m,非常に大型になるフシエラガイの仲間です。体は柔らかく、赤褐色から紫褐色の地に、白い斑点がソバカスのように散在します。夜行性で、日中は岩陰や砂に浅く潜っています。ナイトダイビングでは、海底を堂々と這い回る姿を観察できます。危険を感じると、強い酸性の液体を分泌して身を守ります。
1696,ソヨカゼイロウミウシ,Hypselodoris zephyra,インド-西太平洋,サンゴ礁域、岩礁の岩穴,体長約20〜35mm,10-40m,イロウミウシの仲間で、淡い青紫色の体に、黄色い斑点が散りばめられ、外套膜の縁が白く縁取られます。触角と二次鰓は鮮やかなオレンジ色です。岩礁の壁面や転石の下に生息し、特定のカイメン類を食べています。爽やかな配色から「そよ風」を意味する学名が付けられました。ダイバーにはその美しさから人気があります。
1924,ソライロイボウミウシ,Phyllidia coelestis,インド-西太平洋,サンゴ礁域、岩礁の斜面,体長約35〜60mm,5-30m,イボウミウシの仲間で、鮮やかな青色（空色）の体に黒い縦線と黄色いイボ状の突起が並ぶ、非常に目立つ姿をしています。この仲間は二次鰓を持たず、外套膜の裏側にあるヒダで呼吸します。硬い体を持ち、皮膚から毒を含む粘液を出すため捕食されにくいです。岩礁の壁面や転石の下を這っている姿がよく観察されます。
631,ゾウアメフラシ,Aplysia gigantea,日本、オーストラリア,藻場域、砂泥底,体長約350〜700mm,潮間帯-10m,アメフラシの仲間で、その名の通り既知の種では世界最大級の大きさになります。体色は褐色から黒褐色で、他のアメフラシと比べて突起が少なく滑らかな印象です。主に海藻を食べ、危険を感じると紫色の液体を噴出して敵の目をくらませます。浅い岩礁域や藻場で見られますが、出現は季節的で、繁殖期にまとまって現れることがあります。
1657,ゾウゲイロウミウシ,Hypselodoris bullockii,西太平洋、中部太平洋,サンゴ礁域、岩礁の壁面,体長約31〜45mm,10-40m,イロウミウシの仲間で、象牙のような美しい紫色からピンク色の体色が特徴です。外套膜の縁は白や黄色で縁取られます。触角と二次鰓はオレンジ色から赤色。岩礁の壁面や斜面で見られ、特定のカイメンを食べていると考えられます。セリスイロウミウシと似ていますが、本種は縁取りがより太いことなどで区別できます。
1503,タイヘイヨウアオミノウミウシ,Glaucus marginatus,インド-太平洋,表層,体長約6〜20mm,0-1m,ミノウミウシの仲間ですが、海底ではなく海面を漂って生活する特異な生態を持ちます。腹側を上にして水面に浮かび、カツオノエボシやギンカクラゲといった猛毒の刺胞動物を食べ、その毒（刺胞）を体内に蓄えて自身の武器として利用します。ダイビング中に水面近くを漂っているのを見かけることがありますが、素手で触るのは非常に危険です。
1215,タイヘイヨウイロウミウシ,Chromodoris sp.1,西太平洋,サンゴ礁域、岩礁の岩穴,体長約20〜40mm,10-30m,イロウミウシの仲間で、白い体に太いオレンジ色の縁取りと、背面に赤紫色の網目模様が入るのが特徴です。岩礁の壁面や転石の下で、特定のカイメン類を食べて生活しています。色彩変異があり、網目模様が途切れて斑点状になる個体もいます。ダイバーは岩の隙間やカイメンの近くを探すと見つけやすいでしょう。
1460,タイヨウミノウミウシ,Sakuraeolis sp.,南西諸島、フィリピン、ハワイ,サンゴ礁域、岩礁の岩穴,体長約15〜20mm,10-25m,ミノウミウシの仲間で、半透明の体に、背中の突起（ミノ）が鮮やかなオレンジ色から赤色で、先端が白くなっているのが特徴です。そのミノが密集している様子が太陽のコロナのように見えることがあります。岩礁域でヒドロ虫を捕食しています。ダイバーは岩壁に生えた羽毛状のヒドロ虫の群体をじっくり探すと見つけられるかもしれません。
9159,タイワンカヤノミガイ,Pupa solidula,インド-西太平洋,サンゴ礁域、岩礁の岩穴,体長約10〜25mm,1-15m,カヤノミガイ科に属する貝殻を持つ後鰓類です。体は貝殻に完全に収まり、生時は砂の中に潜っています。貝殻は硬く、表面には細かい螺肋（らろく）と褐色の斑模様があります。夜行性のため、ダイバーが生きている姿を見ることは稀ですが、ナイトダイビングで砂地を這っている姿が観察されることがあります。死んだ後の貝殻は砂浜に打ち上げられます。
1980,タオヤメミノウミウシ,Phyllodesmium undulatum,西太平洋,サンゴ礁域、転石帯,体長約25〜40mm,5-20m,ミノウミウシの仲間で、ソフトコーラルの一種であるウミヅタを専門に食べます。体色は半透明で、食べたウミヅタの色素によって緑色に見えます。背中の突起（ミノ）は平たく、波打っているのが特徴で、ウミヅタのポリプに擬態しています。ミノに褐虫藻を共生させ光合成も行います。ダイバーはウミヅタの群体を探すことが発見の鍵です。
2234,タケノフシミノウミウシ,Tenellia sp.24,南西諸島、パプアニューギニア,サンゴ礁域、転石帯,体長約7〜8mm,5-20m,ミノウミウシの仲間で、半透明の白い体に、竹の節のような模様が入った褐色のミノを持つことが和名の由来です。岩礁域に生息し、ヒドロ虫の仲間を捕食します。非常に小型であるため、見つけるにはマクロな視点が不可欠です。ダイバーは、餌となるヒドロ虫が付着している岩の表面や海藻の上などを注意深く探す必要があります。
1576,タスジキヌハダウミウシ,Gymnodoris sp.20,西太平洋,サンゴ礁域、岩礁の岩穴,体長約23〜25mm,5-20m,他のウミウシを食べる肉食性のウミウシの仲間。半透明の体に数本のオレンジ色の縦線が入るのが特徴。他の小型ウミウシ類が生息する岩礁域で探すと見つかることがある。獲物を探して活発に這い回っている姿が観察される。動きが素早いので観察には注意が必要。
2193,タスジミドリガイ,Thuridilla gracilis,インド-西太平洋,サンゴ礁域、岩礁の岩穴、転石帯,体長約15〜25mm,1-15m,海藻を食べるミドリガイの仲間。黒い体に鮮やかな青色とオレンジ色の縦線が入り、非常に美しい。危険を感じると側足膜を広げて泳ぐように移動することがある。食草となる緑藻類が生えている、光の当たる浅い岩礁やサンゴ礁のガレ場などで見つけやすい。
1766,タソガレキセワタ,Melanochlamys kohi,日本、韓国,砂泥底、転石帯,体長約7〜14mm,3-20m,砂地の堆積物中の有機物などを食べるキセワタの仲間。黒褐色の体に金色の細点が散らばる。頭部がシャベルのようになっており、これを使って巧みに砂に潜る。内湾の穏やかな砂泥地を好み、砂の上を這った跡を辿ると見つかることがある。
974,タチアオイウミウシ,Aegires serenae,西太平洋,サンゴ礁域、転石帯,体長約50〜100mm,10-40m,カイメンを食べるウミウシの仲間。体は硬く、表面は多数の骨片を含んだ突起で覆われている。体色は白や黄色で、突起の先端が異なる色になる個体もいる。食料となる特定のカイメン上で見つかることが多く、カイメンの色や形に擬態している。
638,タツナミガイ,Dolabella auricularia,インド-太平洋熱帯域,砂泥底、藻場域,体長約250mm以上,1-20m,大型になるアメフラシの仲間。ゴツゴツした岩のような見た目で、海藻などを食べる。夜行性で、日中は岩陰や砂の中に浅く潜って隠れていることが多い。夜間のダイビングでは活発に活動する姿が見られる。刺激すると紫色の液体を出すことがある。
2106,タテジワミドリガイ,Smaragdinella sieboldi,インド-西太平洋,潮間帯の岩礁域、転石帯,体長約5〜6mm,0-5m,海藻を食べるミドリガイの仲間。緑色の貝殻を持つが、軟体部が大きく貝殻を覆っているためウミウシのように見える。体表には細かい縦じわが多数ある。食草であるカサノリ類などの海藻が生える、浅い岩礁やタイドプールで観察される。
1955,タテスジイボウミウシ,Phyllidiopsis sphingis,西太平洋、中部太平洋,サンゴ礁域、岩礁の岩穴,体長約12〜23mm,5-30m,硬い体を持つイボウミウシの仲間。白い地色に3本の黒い縦線が走り、その間に黄色い小突起が散らばる。カイメンを食べるため、岩礁の壁面やサンゴ礁の斜面にある特定のカイメンの上や周辺を探すと見つかる。動きは非常に遅い。
800,タテヒダイボウミウシ,Phyllidia varicosa,インド-西太平洋,サンゴ礁域、岩礁の斜面,体長約80〜115mm,5-35m,大型になるイボウミウシの仲間。体は硬く、青みがかった地色に黒い縦の隆起線と、その上にある黄色の大きなイボ状突起が特徴。カイメン食で、サンゴ礁の斜面や岩礁の壁面で見られる。有毒なため捕食されにくく、昼間でも堂々と活動している。
1511,タヌキイロウミウシ,Glossodoris hikuerensis,インド-太平洋,サンゴ礁域、岩礁の岩穴,体長約90〜140mm,10-40m,鮮やかな色彩のイロウミウシの仲間。クリーム色の体に茶褐色の斑紋が入り、外套膜の縁は紫色で縁取られる。カイメンを食べるため、岩礁の壁面や転石の下などを探すと見つかる。色彩には個体差があるが、縁の紫色は共通した特徴。
939,タマガワコヤナギウミウシ,Janolus indicus,本州、四国、九州,岩礁域、転石帯,体長約22〜30mm,10-30m,ミノウミウシに似た姿のウミウシの仲間。半透明の体にオレンジ色の斑点があり、背中の突起（ミノ）は青白く先端がオレンジ色になる。コケムシを食べるため、岩礁の壁面やオーバーハングに付着するコケムシ群落の上を探すと見つかる。
869,タマガワミノウミウシ,Eubranchus sp.6,日本,海藻やホヤが付着した岩礁域,体長約6〜15mm,5-25m,小型のミノウミウシの仲間。半透明の体に白い細点が散らばり、背中の突起（ミノ）は棍棒状で先端が黄色やオレンジ色になる。ヒドロ虫を食べるため、岩壁や海藻に付着した小さなヒドロ虫の群体を探すと、その上で食事している姿が見つかることがある。
