id,name,category,created_at,updated_at,scientific_name,distribution,habitat,size,depth_range,description
2635,ハダカコケギンポ,,2026-04-16T23:27:05.306685+00:00,2026-04-16T23:27:05.306685+00:00,Neoclinus nudus,八丈島、沖縄島；台湾,岩礁域,全長約4cm,2m,コケギンポの仲間。岩の穴やフジツボの空き殻、空き瓶などを住処にし、そこから顔だけを出している姿が観察される。鱗がなく皮膚が裸のように見えることが名前の由来。縄張り意識が強く、他の個体が近づくと口を大きく開けて威嚇する。その表情豊かな様子がダイバーに人気。
2637,ハタタテハゼ,,2026-04-16T23:27:05.306685+00:00,2026-04-16T23:27:05.306685+00:00,Nemateleotris magnifica,小笠原諸島、八丈島、相模湾、伊豆半島、和歌山県、愛媛県宇和海、高知県柏島、屋久島、琉球列島；インド・太平洋,サンゴ礁域、礁斜面の水深3～30mの礫混じりの砂底やガレ場,全長約4cm,10m,美しい遊泳性のハゼの仲間。体の前半が白く、後半にかけて鮮やかな赤色になるグラデーションが特徴。長く伸びた第1背鰭をアンテナのように立てて、ペアで巣穴の上をホバリングしている。危険を察知すると、一瞬で巣穴に飛び込んで隠れる。ダイバーに非常に人気が高い。
2638,アケボノハゼ,,2026-04-16T23:27:05.306685+00:00,2026-04-16T23:27:05.306685+00:00,Nemateleotris decora,八丈島、高知県柏島、奄美大島、沖縄諸島、西表島；インド・太平洋,サンゴ礁域、礁斜面の水深35～55mのサンゴ片混じりの砂底など,全長約7cm,50m,美しいハゼの仲間で、白から紫へのグラデーションと、鮮やかな赤橙色の背びれと尾びれが特徴。主にガレ場や砂礫底にペアで巣穴を掘って生息する。危険を感じると瞬時に巣穴に隠れる。背びれをリズミカルに動かす行動が観察される。やや深場を好むため、ダイビングでは注意深く探す必要がある。
2639,シコンハタタテハゼ,,2026-04-16T23:27:05.306685+00:00,2026-04-16T23:27:05.306685+00:00,Nemateleotris helfrichi,小笠原諸島、高知県、奄美大島、慶良間諸島；中・西部太平洋,サンゴ礁域、礁斜面の砂底、転石混じりの砂底上,全長約7cm,25m,ハタタテハゼの仲間で、その名の通り、高貴な紫色（紫紺）の体色が非常に美しい魚です。水深25mより深いサンゴ礁の砂礫底に生息します。警戒心が極めて強く、ダイバーの気配を感じると一瞬で巣穴に姿を消してしまいます。観察には相当な忍耐とスキルが必要です。
2640,クロユリハゼ,,2026-04-16T23:27:05.306685+00:00,2026-04-16T23:27:05.306685+00:00,Ptereleotris evides,小笠原諸島、伊豆諸島、千葉県～西表島；インド・太平洋,サンゴ礁域、礁池や礁斜面など水深3〜15mにあるサンゴの根の周辺の中層,全長約9cm,5m,ハゼの仲間で、サンゴ礁の砂礫底やガレ場に生息します。体の前半が白く、後半が黒というツートンカラーが非常に目立ちます。通常はペアで行動し、巣穴の近くでホバリングしながら動物プランクトンを食べています。警戒心が非常に強く、ダイバーが近づくと瞬時に巣穴に隠れてしまいます。観察するには、少し離れた場所から動かずに待つのがコツです。
2641,ハナハゼ,,2026-04-16T23:27:05.306685+00:00,2026-04-16T23:27:05.306685+00:00,Ptereleotris hanae,富山湾、南日本の太平洋岸、奄美大島以北の琉球列島；朝鮮半島、済州島,岩礁域やサンゴ礁域、岩礁に隣接する砂底の中層,全長約14cm,15m,ハゼの仲間で、白い体に青やオレンジのラインが入る美しい魚。サンゴ礁の砂地やガレ場にペアで巣穴を掘って生活している。危険を感じると、目にもとまらぬ速さで巣穴に隠れてしまう。観察するには、巣穴から少し離れた場所で動きを止め、彼らが安心するのを待つと、ホバリングする姿を見せてくれる。
2642,オグロクロユリハゼ,,2026-04-16T23:27:05.306685+00:00,2026-04-16T23:27:05.306685+00:00,Ptereleotris heteroptera,小笠原諸島、八丈島、相模湾、伊豆半島、紀伊半島、高知県柏島、琉球列島；インド・太平洋,サンゴ礁域、礁斜面など水深3〜35mにあるサンゴの根の周辺の中層,全長約9cm,15m,クロユリハゼの仲間で、淡い青色の美しい体と黒い尾ビレが特徴です。サンゴ礁の砂礫底にペアや小さな群れで生息しています。ホバリングしながらプランクトンを食べ、危険を感じると近くの巣穴や岩陰に素早く逃げ込みます。優雅に泳ぐ姿はダイバーに人気ですが、警戒心が強く近づくのは難しいです。
2643,イトマンクロユリハゼ,,2026-04-16T23:27:05.306685+00:00,2026-04-16T23:27:05.306685+00:00,Ptereleotris microlepis,相模湾、伊豆半島、紀伊半島、高知県柏島、奄美大島、沖縄諸島、宮古諸島、八重山諸島；インド・太平洋,サンゴ礁域、礁斜面など水深3〜10mにあるサンゴの根の周辺の中層,全長約10cm,5m,クロユリハゼの仲間で、サンゴ礁の砂地やガレ場に生息します。白い体に青みがかった光沢があり、非常に美しいハゼです。ペアでいることが多く、共通の巣穴を持っており、危険を感じると瞬時に巣穴に隠れます。ホバリングしながらプランクトンを食べる姿が特徴的。警戒心が強いため、観察には距離が必要です。
2645,スジクロユリハゼ,,2026-04-16T23:27:05.306685+00:00,2026-04-16T23:27:05.306685+00:00,Ptereleotris grammica,小笠原諸島、伊豆半島、高知県柏島、沖縄諸島、久米島、西表島；インド・西太平洋,サンゴ礁域、礁斜面の40m以深のガレ場、海底近くを遊泳,全長約8cm,50m,細長い体を持つハゼの仲間で、体側の青く輝く縦縞が美しい。やや深めの砂礫底にペアで生息し、ホバリングするように泳ぐ。危険を感じると驚くほどの速さで巣穴に隠れるため、観察にはゆっくりとした接近が必要。他のハゼ類と混泳することもある。
2646,ゼブラハゼ,,2026-04-16T23:27:05.306685+00:00,2026-04-16T23:27:05.306685+00:00,Ptereleotris zebra,小笠原諸島、八丈島、伊豆半島、高知県、沖縄諸島、石垣島、西表島；インド・太平洋,サンゴ礁域、礁斜面などのサンゴの根の周辺の中層,全長約10cm,10m,ハゼの仲間で、青みがかった白い体にオレンジ色の横縞模様が美しい。サンゴ礁の砂礫地やガレ場に生息し、数匹から数十匹の群れで中層をホバリングするように泳いでいる。危険を感じると一斉に近くの巣穴に逃げ込む。その素早い動きから「ダートゴビー」とも呼ばれる。群れ全体が同じ方向を向いて泳ぐ姿は見ていて飽きない。
2648,イタチウオ,,2026-04-16T23:27:05.306685+00:00,2026-04-16T23:27:05.306685+00:00,Brotula multibarbata,南日本、伊豆・小笠原諸島、琉球列島；インド・太平洋,浅海の岩礁域、岩礁の隙間,全長約30cm,10m,アシロの仲間で、ナマズに似た独特の姿をしています。夜行性で、昼間は岩の隙間や洞窟の奥深くに隠れています。下顎に複数のヒゲがあり、これを使って暗闇で餌となる甲殻類などを探します。ナイトダイビングで岩穴を覗くと、赤い体でゆっくりと泳ぐ姿を観察できることがあります。
2649,ギンユゴイ,,2026-04-16T23:27:05.306685+00:00,2026-04-16T23:27:05.306685+00:00,Kuhlia mugil,南日本の太平洋岸、琉球列島；インド・汎太平洋,沿岸岩礁域、波当たりの強い岩礁付近の水面下,全長約22cm,2m,ユゴイの仲間で、海水域だけでなく、川の河口などの汽水域にも生息する。銀色の体に黒い尾ビレの模様が特徴。浅い岩礁やサンゴ礁で群れを作っていることが多い。雑食性で、水面に落ちた昆虫なども食べる。ダイバーがエントリーしてすぐの浅場で見かけることが多い魚。
2650,カミソリウオ,,2026-04-16T23:27:05.306685+00:00,2026-04-16T23:27:05.306685+00:00,Solenostomus cyanopterus,南日本の太平洋岸、伊豆諸島、琉球列島、インド・西太平洋,沿岸浅所の岩礁域やサンゴ礁の付近の海藻床や砂底,全長約9cm,5m,ヨウジウオやタツノオトシゴに近縁な魚。海藻やゴミなどに擬態して、逆さまの状態で漂っています。メスが腹部にある育児嚢に卵を産み付け、オスがそれを孵化させるという珍しい繁殖形態をとります。擬態が巧みで動きも少ないため、漂っている海藻などを注意深く観察しないと見過ごしてしまいます。
2651,ニシキフウライウオ,,2026-04-16T23:27:05.306685+00:00,2026-04-16T23:27:05.306685+00:00,Solenostomus paradoxus,南日本の太平洋岸，琉球列島；インド・太平洋,沿岸浅所の岩礁域に生育するウミシダ類やトサカ類付近,全長約5cm,水面下,ヨウジウオに近い仲間で、全身の複雑な皮弁でウミシダや海藻に擬態する。体色は生息環境に合わせて赤、黄、黒など多彩に変化する。流れの当たる場所で、ウミシダなどに寄り添い頭を下にして漂っている姿が見られる。高度な擬態能力を持つため、自力での発見は非常に難しい。メスが腹部の育児嚢で卵を保護する。
2653,セミホウボウ,,2026-04-16T23:27:05.306685+00:00,2026-04-16T23:27:05.306685+00:00,Dactyloptena orientalis,青森県以南、南日本、伊豆・小笠原諸島、琉球列島；インド・太平洋,大陸棚の砂泥底,全長約10cm,25m,ホウボウの仲間で、砂地の海底を「歩く」ように移動する姿が特徴的。普段は畳んでいるが、驚くと翼のように大きな胸ビレを広げる。その内側は青い縁取りと斑点模様で非常に美しい。ダイバーが近づくと、この美しいヒレを広げて威嚇したり、一気に泳ぎ去ったりする。観察の際は、砂地で餌を探す個体を驚かせないよう、ゆっくりと距離を詰めるのが良い。
2656,クモウツボ,,2026-04-16T23:27:05.306685+00:00,2026-04-16T23:27:05.306685+00:00,Echidna nebulosa,伊豆・小笠原諸島、高知県以南の南日本の太平洋岸、琉球列島；インド・太平洋サンゴ礁域の浅所,サンゴ礁域の浅所,全長約80cm,15m,ウツボの仲間で、白い体に黒い斑点が散らばり、その周りが黄色く縁取られる雲のような模様が特徴です。サンゴ礁や岩礁の隙間に隠れており、顔だけ出している姿をよく見かけます。主に夜行性で、日中は巣穴で休み、夜になると獲物であるカニやタコを探しに出かけます。歯が丸く、甲殻類を砕いて食べるのに適しています。
2657,コケウツボ,,2026-04-16T23:27:05.306685+00:00,2026-04-16T23:27:05.306685+00:00,Enchelycore lichenosa,高知県までの南日本の太平洋岸、伊豆・小笠原諸島；台湾、ガラパゴス諸島,沿岸岩礁域,全長約70cm,15m,ウツボの仲間で、岩礁やサンゴ礁の亀裂に生息しています。体表が苔むしたような複雑な模様と色をしていることが名前の由来で、擬態に役立っています。口が完全に閉じないため、常に歯が剥き出しになっています。昼間は巣穴から顔だけ出していることが多いですが、夜になると獲物を探して活発に泳ぎ回ります。
2659,ワカウツボ,,2026-04-16T23:27:05.306685+00:00,2026-04-16T23:27:05.306685+00:00,Gymnothorax meleagris,南日本の太平洋岸、伊豆・小笠原諸島、琉球列島；インド・汎太平洋,温帯の沿岸岩礁域〜亜熱帯のサンゴ礁域,全長約80cm,10m,ウツボの仲間で、暗褐色の体にびっしりと並んだ白い斑点が特徴です。サンゴ礁や岩礁の隙間に隠れており、昼間は頭だけを出していることが多いです。夜になると巣穴から出てきて、魚類や甲殻類、タコなどを捕食します。口をパクパクさせるのは呼吸のためで、威嚇しているわけではありません。
2660,ヘリゴイシウツボ,,2026-04-16T23:27:05.306685+00:00,2026-04-16T23:27:05.306685+00:00,Gymnothorax fimbriatus,八丈島、高知県以南～琉球列島；インド・太平洋（ハワイを除く）,サンゴ礁域の浅所,全長約80cm,10m,ウツボの仲間で、サンゴ礁や岩礁の隙間に潜んでいる。白っぽい体に不規則な黒褐色の斑紋があり、ヒレの縁が白く縁取られているのが特徴。日中は穴から顔だけを出していることが多いが、夜になると獲物を探して活発に泳ぎ回る。口をパクパクさせているのは呼吸のためで、威嚇しているわけではない。
2661,ゴマウツボ,,2026-04-16T23:27:05.306685+00:00,2026-04-16T23:27:05.306685+00:00,Gymnothorax flavimarginatus,八丈島、高知県柏島、屋久島、琉球列島；インド・汎太平洋,サンゴ礁域の浅所,全長約1.2m,10m,ウツボの仲間で、黄色がかった体に無数の黒い斑点があり、鰓孔の周りが黒く縁取られているのが大きな特徴です。昼間はサンゴや岩の隙間に身を潜めていることが多く、顔だけを出している姿がよく見られます。夜行性で、夜になると獲物を探して活発に泳ぎ出します。
2662,ドクウツボ,,2026-04-16T23:27:05.306685+00:00,2026-04-16T23:27:05.306685+00:00,Gymnothorax javanicus,琉球列島；インド・太平洋,サンゴ礁域の浅所,全長約80cm,10m,ウツボの仲間で、世界中の熱帯域に生息する最大級の種です。黄褐色の体にヒョウ柄のような黒い斑点が密に分布します。岩礁やサンゴ礁の穴や亀裂を住処とし、昼間でも顔を出しています。口をパクパクさせているのは呼吸のためです。大型の個体は迫力がありますが、こちらから手を出さない限りは安全です。
2663,ウツボ,,2026-04-16T23:27:05.306685+00:00,2026-04-16T23:27:05.306685+00:00,Gymnothorax kidako,南日本、伊豆・小笠原諸島、琉球列島；台湾、フィリピン、ハワイ,沿岸岩礁域,全長約1m,10m,ヘビのように細長い体を持つ魚で、岩礁やサンゴ礁の隙間を住処にしています。日中は穴から顔だけを出していることが多いですが、夜になると獲物を探して活発に泳ぎ回ります。鋭い歯を持つ肉食魚です。口をパクパクさせているのは呼吸のためで、威嚇しているわけではありません。不用意に刺激しないよう注意が必要です。
2664,ヒメウツボ,,2026-04-16T23:27:05.306685+00:00,2026-04-16T23:27:05.306685+00:00,Gymnothorax melatremus,南日本の太平洋岸、琉球列島；インド・汎太平洋,サンゴ礁域や岩礁域のガレ場、隙間,全長約30cm,20m,ウツボの仲間で、鮮やかな黄色の体色が特徴です。サンゴ礁や岩礁の小さな隙間や穴に身を潜めています。ウツボ類の中では小型で臆病な性格のため、ダイバーが近づくとすぐに穴の奥へと引っ込んでしまいます。観察する際は、驚かせないようにゆっくりと近づくのがポイントです。
2665,ハナビラウツボ,,2026-04-16T23:27:05.306685+00:00,2026-04-16T23:27:05.306685+00:00,Gymnothorax chlorostigma,和歌山県、琉球列島、小笠原諸島；インド・太平洋,サンゴ礁域の浅所,全長約1m,10m,大型のウツボの仲間。黄色がかった体に、花びらのような形の黒い斑点が密に並ぶことが名前の由来。サンゴ礁や岩礁の隙間に潜んでおり、昼間は頭だけを出していることが多い。夜になると活発に泳ぎ出し、魚類などを捕食する。岩の隙間を覗き込むと、特徴的な模様の顔を見つけることができる。
2666,アミウツボ,,2026-04-16T23:27:05.306685+00:00,2026-04-16T23:27:05.306685+00:00,Gymnothorax reticularis,南日本の太平洋岸、琉球列島；インド・西太平洋,内湾の砂泥底にある岩礁、砂地の根,全長約60cm,15m,白や淡い黄色の地に、網目（アミ）のような規則正しい黒褐色の横帯が15〜20本ほど入るのが特徴的なウツボ。サンゴ礁よりも、やや砂泥が混じる内湾や岩礁の砂地にある根などを好みます。他のウツボに比べて比較的おとなしく、岩の隙間から大きな目でこちらをじっと見つめる姿は、マクロ撮影の被写体としても人気があります。
2667,サビウツボ,,2026-04-16T23:27:05.306685+00:00,2026-04-16T23:27:05.306685+00:00,Gymnothorax thyrsoideus,南日本の太平洋岸、伊豆・小笠原諸島、琉球列島；東部インド洋～中・西部太平洋の熱帯域,サンゴ礁域の浅所,全長約60cm,10m,全体的に赤みがかったサビ色をしており真っ白な目が非常に特徴的な小型のウツボ。サンゴ礁の浅い場所でよく見られ岩穴から顔だけを覗かせています。他のウツボとは顔つきが少し異なりどこか愛嬌があるため被写体として人気があります。
2674,トラウツボ,,2026-04-16T23:27:05.306685+00:00,2026-04-16T23:27:05.306685+00:00,Enchelycore pardalis,南日本の太平洋岸、伊豆・小笠原諸島；インド・太平洋,沿岸岩礁域,全長約80cm,20m,ウツボの仲間で、赤褐色や黄褐色の地に、トラ柄のような複雑な斑紋があるのが特徴です。鼻先が湾曲しており、口を完全に閉じることができません。そのため、常に鋭い歯が見えています。岩礁やサンゴ礁の亀裂に潜んでいますが、昼間でも比較的活発で、巣穴から体を出して泳ぎ回ることもあります。タコや甲殻類を好んで食べます。
2676,ハナヒゲウツボ,,2026-04-16T23:27:05.306685+00:00,2026-04-16T23:27:05.306685+00:00,Rhinomuraena quaesita,和歌山県以南の太平洋岸、伊豆・小笠原諸島、琉球列島；インド・太平洋,サンゴ礁域の浅所、砂礫底や岩の穴,全長約60cm,10m,ウツボの仲間で、成長段階で体色が劇的に変化する。幼魚は黒色、雄の成魚は鮮やかな青色、雌の成魚は黄色になる。名前の由来である花のような鼻先の皮弁が特徴。サンゴ礁の砂地やガレ場に巣穴を掘って住み、上半身だけを出してプランクトンなどを待つ。近づきすぎると穴に引っ込んでしまう。
2677,ヒゲニジギンポ,,2026-04-16T23:27:05.306685+00:00,2026-04-16T23:27:05.306685+00:00,Meiacanthus grammistes,南日本の太平洋岸、琉球列島；西部太平洋の熱帯域,岩礁域やサンゴ礁域、礁池内など浅所,全長約8cm,10m,ギンポの仲間。下顎に毒牙を持っており、捕食者から身を守る。このため、他の魚が本種に擬態する例が見られる。黒い体に数本の黄色い縦縞が走る模様が特徴。サンゴ礁や岩礁のガレ場に生息し、岩の隙間から顔を出したり、ホバリングしたりしている。自分から攻撃してくることはないが、むやみに触らないように注意。
2678,オウゴンニジギンポ,,2026-04-16T23:27:05.306685+00:00,2026-04-16T23:27:05.306685+00:00,Meiacanthus atrodorsalis,南日本の太平洋岸、八丈島、琉球列島；ハワイ諸島を除く中・西部太平洋の熱帯域,サンゴ礁域、礁池内など浅所,全長約7cm,15m,ギンポの仲間で、青い体と黄色い背ビレが美しい魚です。犬歯に毒腺を持っており、身を守るために使います。普段は大人しく、サンゴや岩の上でホバリングしながら動物プランクトンを食べています。人間に対して攻撃的ではありませんが、刺激しないようにしましょう。鮮やかな体色のため、水中でもよく目立ちます。
2679,カモハラギンポ,,2026-04-16T23:27:05.306685+00:00,2026-04-16T23:27:05.306685+00:00,Meiacanthus kamoharai,南日本の太平洋岸、伊豆諸島、琉球列島岩礁域やサンゴ礁域,岩礁域やサンゴ礁域、礁池内など浅所,全長約7cm,10m,ギンポの仲間で、青い体に黒いラインが入る美しい姿をしています。犬歯に毒腺を持っており、身を守るために使います。この毒を真似て、無毒な他の魚が本種に擬態することが知られています。岩穴やサンゴの隙間から顔を出したり、ホバリングしたりする姿が観察できます。
2680,ハタタテギンポ,,2026-04-16T23:27:05.306685+00:00,2026-04-16T23:27:05.306685+00:00,Petroscirtes mitratus,南日本の太平洋岸、琉球列島；インド・太平洋,サンゴ礁域、礁池内の海草につく,全長約5cm,1m,ギンポの仲間。岸壁やブイのロープなどに付着した、流れ藻やホヤの群体などに隠れて生活していることが多い。頭部に房状の皮弁があるのが特徴。通常のダイビングコースで見かけることは少ないが、漂流物などを注意深く探すと見つかることがある。体をくねらせて移動する。
2681,ニジギンポ,,2026-04-16T23:27:05.306685+00:00,2026-04-16T23:27:05.306685+00:00,Petroscirtes breviceps,南日本、伊豆・小笠原諸島、琉球列島；朝鮮半島、インド・西太平洋,岩礁域やサンゴ礁域、浅所の藻場,全長約6cm,20m,ギンポの仲間で、目の上にある皮弁が特徴。流れ藻や浮遊物に付いて生活することが多いが、岩礁域でも見られる。他の魚のヒレをかじる習性がある。ダイビング中に海面近くを漂う流れ藻などを見つけたら、何かが隠れていないかチェックしてみると、本種を発見できるかもしれない。
2686,ニセクロスジギンポ,,2026-04-16T23:27:05.306685+00:00,2026-04-16T23:27:05.306685+00:00,Aspidontus taeniatus taeniatus,南日本の太平洋岸、八丈島、琉球列島；東部インド洋～中・西部太平洋の熱帯域,岩礁域やサンゴ礁域、磯池など,全長約9cm,15m,ホンソメワケベラに姿や泳ぎ方を似せたギンポの仲間。掃除をしてもらおうと近づいてきた魚のヒレや皮膚をかじり取って食べる「攻撃擬態」で知られる。本物のホンソメワケベラと比べて口が下向きについている点で見分けられる。魚を騙すトリッキーな生態は観察の面白いポイント。
2687,ヤエヤマギンポ,,2026-04-16T23:27:05.306685+00:00,2026-04-16T23:27:05.306685+00:00,Salarias fasciatus,琉球列島；インド・太平洋,サンゴ礁域、礁池内のハマサンゴ類の上など5m以浅,全長約12cm,1m,カエルウオの仲間で、櫛状の歯で藻類を食べることから「コームトゥースブレニー」とも呼ばれます。サンゴ礁の浅瀬やタイドプールに生息し、岩の上で体をくねらせながら移動します。目の上にある房状の皮弁が特徴です。驚くと岩の隙間や穴に素早く隠れます。シュノーケリングでも簡単に見つけられます。
2691,インドカエルウオ,,2026-04-16T23:27:05.306685+00:00,2026-04-16T23:27:05.306685+00:00,Atrosalarias fuscus holomelas,琉球列島；中・西部太平洋の熱帯域,サンゴ礁域、10m以浅、サンゴの枝間,全長約7cm,5m,カエルウオの仲間で、サンゴ礁の浅瀬やタイドプールでよく見られます。全身が黒褐色で、目の上にある皮弁が特徴です。岩や死サンゴの上を飛び跳ねるように移動しながら、表面の藻類を食べています。警戒心が強く、危険を感じると素早く岩の隙間に隠れます。観察する際は、驚かせないようにゆっくり近づきましょう。
2692,エリグロギンポ,,2026-04-16T23:27:05.306685+00:00,2026-04-16T23:27:05.306685+00:00,Crossosalarias macrospilus,琉球列島；西部太平洋の熱帯域,サンゴ礁域、礁縁部の15m以浅,全長約7cm,10m,ギンポの仲間で、サンゴの枝の間に生息しています。黒い体に白い斑点が散らばり、鰓蓋の上部に黒い斑点があるのが名前の由来です。サンゴのポリプや表面の藻類を食べます。普段はサンゴの奥に隠れていますが、時々ひょっこりと顔を出す姿が観察できます。警戒心が強いので、ゆっくりと近づきましょう。
2694,タテガミカエルウオ,,2026-04-16T23:27:05.306685+00:00,2026-04-16T23:27:05.306685+00:00,Cirripectes castaneus,南日本の太平洋岸、伊豆・小笠原諸島、琉球列島；インド・太平洋,サンゴ礁域、波の荒い礁縁の浅所,全長約6cm,5m,カエルウオの仲間で、目の上にフサフサした皮弁がある。岩礁やサンゴ礁の浅い場所に生息し、岩の表面の藻類を食べる。縄張り意識が強く、同種や他の魚を追い払う行動が見られる。岩の穴や隙間から顔だけを出している姿が愛らしい。警戒心は強いが、巣穴の近くでは比較的観察しやすい。体色は個体差が大きい。
