id,name,category,created_at,updated_at,scientific_name,distribution,habitat,size,depth_range,description
5938,シラタキベラ,,2026-04-16T23:27:05.306685+00:00,2026-04-16T23:27:05.306685+00:00,Pseudocoris bleekeri,南日本の太平洋岸、琉球列島；インドネシア、フィリピン,岩礁域、サンゴ礁域、礁外縁の潮通しの良い所,全長約13cm,5m,ベラの仲間で、オスとメスで体色が大きく異なります。オスは青緑色の体に、頭部から白い帯が滝のように流れる美しい模様を持ちます。メスや幼魚は赤茶色で地味な姿です。岩礁やサンゴ礁の沖合の斜面で、中層を素早く泳ぎ回っている姿が観察されます。
5941,タスキヒナハゼ,,2026-04-16T23:27:05.306685+00:00,2026-04-16T23:27:05.306685+00:00,Redigobius balteatus,西表島；インド・西太平洋,河川の河口域、マングローブ林の砂泥底にある沈木のまわり、水深2m以浅,全長約3.5cm,1m,小さなハゼの仲間で、河口域やマングローブ帯などの汽水域で見られます。体色は褐色で地味ですが、肩の部分（胸ビレの付け根後方）に、たすきを掛けたような暗色の斜め帯が入るのが最大の特徴です。ごく浅い泥底や石の下に潜んでいるため、ダイビングで観察する機会はほとんどありません。
5948,ゴマフキンチャクフグ,,2026-04-16T23:27:05.306685+00:00,2026-04-16T23:27:05.306685+00:00,Canthigaster amboinensis,八丈島、琉球列島；インド・汎太平洋,サンゴ礁域、波当たりの強い礁外縁の15m以浅,全長約10cm,5m,キンチャクフグの仲間で、黒い体に白い斑点が散らばり、目を通る黒い帯模様が特徴です。サンゴ礁のガレ場や岩陰に隠れるように生息しており、ペアで寄り添っている姿もよく見られます。危険を感じると体を膨らませて威嚇しますが、フグ毒を持つため触れてはいけません。
5955,アゴハタ,,2026-04-16T23:27:05.306685+00:00,2026-04-16T23:27:05.306685+00:00,Pogonoperca punctata,高知県、八丈島、琉球列島、小笠原諸島、インド・太平洋,沿岸岩礁域とサンゴ礁域の浅所、物陰,全長約25cm,30m,ハタの仲間で、下顎の先端に小さな皮弁（ひげ）があるのが名前の由来。体には白い斑点が散らばる。サンゴ礁や岩礁のオーバーハングの下や洞窟の奥に潜んでいることが多い。警戒心が強く、すぐに隠れてしまう。皮膚に毒を持つため食用にはならない。単独で行動する。
5998,ハナナガスズメダイ,,2026-04-16T23:27:05.306685+00:00,2026-04-16T23:27:05.306685+00:00,Stegastes punctatus,琉球列島；インド・太平洋,サンゴ礁域の浅所,全長約14cm,3m,スズメダイの仲間。成魚は黒っぽい体色で縄張り意識が非常に強い。幼魚は鮮やかな青色で黒い斑点があり、成魚とは全く異なる姿をしている。浅いサンゴ礁や岩礁域で、自分の縄張り内の藻類を食べる。ダイバーが近づくと、小さい体で果敢に攻撃してくることがあるので、その行動にも注目。
6012,ズグロダテハゼ,,2026-04-16T23:27:05.306685+00:00,2026-04-16T23:27:05.306685+00:00,Amblyeleotris melanocephala,高知県、沖縄諸島；フィリピン、インドネシア,内湾の湾口、サンゴ礁域の礁斜面。砂泥底・崖下に続く砂底の緩斜面でテッポウエビ類と共生。生息水深25-45m,全長約12cm,25-45m,ハゼの仲間で、やや深めの砂泥底でテッポウエビ類と共生します。名前の通り、頭部が明瞭に黒いのが最大の特徴で、他の共生ハゼと容易に見分けることができます。水深25m以深で見られることが多く、警戒心が非常に強いため、観察や撮影には忍耐強いアプローチが求められます。
6014,アカオビシマハゼ,,2026-04-16T23:27:05.306685+00:00,2026-04-16T23:27:05.306685+00:00,Tridentiger trigonocephalus,北海道の太平洋・日本海側～鹿児島県、瀬戸内海、隠岐、対馬、朝鮮半島、河北、山東、福建、香港、台湾,主に内湾に生息。泥底の石やカキ殻の下や間に単独で見られる,全長約6cm,2m,シマハゼに似たハゼの仲間で、体側に数本の太い黒色縦帯が走るのが特徴です。主に内湾の砂泥底や河口の汽水域に生息しており、カキ殻や石の下、空き缶の中などを隠れ家にします。ダイビングよりも、潮だまりでの観察やシュノーケリングで見つけやすい生物です。環境の変化に比較的強く、港などでもその姿を見ることができます。
6020,ヒトミハゼ,,2026-04-16T23:27:05.306685+00:00,2026-04-16T23:27:05.306685+00:00,Pseuaopsis biocellata,高知県、宮崎県、鹿児島県、種子島、琉球列島；インド・太平洋,河川の河口から感潮域下部にかけての汽水域、河口域やマングローブ林の泥底,全長約8cm,水面下,泥底に生息するハゼの仲間で、背ビレに目玉のような大きな黒い斑点（眼状斑）があるのが特徴。テッポウエビと共生し、巣穴の近くで見られる。巣穴は泥でできているため非常に崩れやすく、ダイバーのフィンキックなどで簡単に壊れてしまう。観察の際は、巻き上げた泥が巣穴を埋めてしまわないよう、中性浮力を保ち、底から距離をとって静かに見守ることが重要。
6022,ブチハゼ,,2026-04-16T23:27:05.306685+00:00,2026-04-16T23:27:05.306685+00:00,Cryptocentrus inexplicatus,石垣島、西表島；西部太平洋,内湾の湾奥。砂泥底や礫混じりの砂泥底で、テッポウエビ類と単独で共生。生息水深3m以浅,全長約6.5cm,3m,内湾の泥底や砂泥底に生息する共生ハゼ。体中に細かい斑点が散らばっているのが特徴。テッポウエビと共生し、巣穴の近くで見られる。巣穴は泥でできているため非常に壊れやすい。観察の際は、フィンで泥を巻き上げないように細心の注意を払い、中性浮力を保って静かに見守ることが不可欠。食事の様子やエビとの連携が見どころ。
6031,サンゴサラサエビ,,2026-04-16T23:27:05.306685+00:00,2026-04-16T23:27:05.306685+00:00,Cinetorhynchus hendersoni,真鶴半島以南、東南アジア、ハワイ、オーストラリア、フランス領ポリネシア、インド洋、紅海,サンゴ礁域,体長約4cm,3m,腰を折ったような体型が特徴的なサラサエビの仲間です。体には赤い縞模様があり、尾が青いのが美しいです。岩礁やサンゴ礁のオーバーハングした場所や、洞窟の暗がりに生息しています。驚くと素早く後方にジャンプして逃げます。暗がりをライトで照らすと、群れている姿を観察することができます。
6033,ヒラツメガニ,,2026-04-16T23:27:05.306685+00:00,2026-04-16T23:27:05.306685+00:00,Ovalipes punctatus,北海道南部以南、韓国、中国北部,砂泥底,甲幅5～8cm,2-30m,泳ぎが得意なガザミの仲間で、一番後ろの脚がボートのパドルのような平たい形をしています。砂地に生息し、この脚で器用に砂を掘って体を隠します。危険を感じると驚くほどの速さで砂に潜るか、横方向に素早く泳いで逃げます。ナイトダイビングでは砂の上を歩いている姿をよく見かけます。
6055,シロスジベニオウギガニ,,2026-04-16T23:27:05.306685+00:00,2026-04-16T23:27:05.306685+00:00,Liomera tristicha,琉球列島、小笠原諸島、フィリピン、ハワイ、南太平洋、インド洋、紅海,サンゴ礁域、岩礁,甲幅3〜5cm,2-15m,鮮やかな赤色の体に、白い筋模様が入った美しいオウギガニの仲間です。サンゴ礁や岩礁の浅い場所に生息し、サンゴの枝の間や岩の隙間に隠れています。夜行性のため、昼間は物陰に潜んでいることが多いです。ナイトダイビングで探すと、活動している姿を見つけやすいでしょう。有毒の可能性があるので触らないように注意が必要です。
6065,アオスジエビス,,2026-04-16T23:27:05.306685+00:00,2026-04-16T23:27:05.306685+00:00,Sargocentron tiere,琉球列島、 小笠原諸島； インド・太平洋,サンゴ礁域、 岩の陰,全長約25cm,15m,イットウダイの仲間で、赤い体に走る青い縦縞が美しい魚です。夜行性のため、日中は岩の隙間や洞窟の奥に隠れていることがほとんどです。ナイトダイビングでは、活発に泳ぎ回り、甲殻類などを探す姿を観察できます。大きな目が特徴で、暗い場所でも獲物を見つけるのに役立っています。
6068,トゲトゲツノヤドカリ,,2026-04-16T23:27:05.306685+00:00,2026-04-16T23:27:05.306685+00:00,Diogenes spinifrons,茨城県～九州（太平洋側）、山形県～九州（日本海側）、東シナ海,砂泥底、藻場域,甲長約1cm,5-30m,ヤドカリの仲間で、トゲツノヤドカリによく似ています。体表や脚に多くのトゲ状突起があることが名前の由来です。浅い砂泥底に生息し、小さな貝殻を背負って歩き回ります。ダイバーは砂地で小さな貝殻の動きに注目すると見つけやすく、危険を感じると貝殻に素早く隠れます。
6071,フタホシイシガニ,,2026-04-16T23:27:05.306685+00:00,2026-04-16T23:27:05.306685+00:00,Charybdis bimaculata,仙台湾～九州、東アジア、南太平洋、オーストラリア、インド洋、アフリカ東岸,岩礁域,甲幅約3cm,2-430m,泳ぎが得意なガザミの仲間で、甲羅の後方中央に一対の白い斑点があるのが最大の特徴です。この斑点が名前の由来になっています。砂泥底に生息し、かなり深い水深まで分布しています。底引き網などでよく漁獲されるカニですが、ダイビング中に砂地で出会うこともあります。
6072,クサイロモエビ,,2026-04-16T23:27:05.306685+00:00,2026-04-16T23:27:05.306685+00:00,Heptacarpus grebrachii,北海道～東北地方、日本海、サハリン,浅場の岩礁域,体長約2cm,1-3m,海藻や海草の茂みに生息する小型のエビの仲間。体色が緑色や褐色で、生息環境に溶け込む保護色となっている。アマモ場などで見られることが多いが、擬態しているため見つけるのはやや難しい。海藻の根元や葉の上を注意深く観察すると、ちょこまかと動く姿を見つけられる。夜行性で、夜間に活動が活発になる。
6078,エンヤサラサエビ,,2026-04-16T23:27:05.306685+00:00,2026-04-16T23:27:05.306685+00:00,Cinetorhynchus reticulatus,八丈島以南、東南アジア、ハワイ、フランス領ポリネシア、インド洋、紅海,サンゴ礁域,体長約4cm,15m,サラサエビの仲間で、赤い体に白い網目模様が特徴的な美しいエビです。夜行性で、日中は岩の亀裂やオーバーハングの下などの暗がりに集団で潜んでいます。ライトを当てると赤い眼が光りますが、すぐに奥へ逃げ込んでしまいます。ナイトダイビングでは、隠れ家から出てきて活動する姿を観察できるチャンスがあります。
6090,アサヒガニ,,2026-04-16T23:27:05.306685+00:00,2026-04-16T23:27:05.306685+00:00,Ranina ranina,相模湾以南、伊豆諸島、ハワイ、オーストラリア、インド洋,岩礁域、サンゴ礁域,甲長約20cm,10-50m,砂地に生息する大型のカニの仲間。カニ類には珍しい前後（縦）に長い甲羅と、鮮やかなオレンジ色の体が特徴。後ずさりするようにして器用に砂の中に潜る習性を持つ。日中は目だけを砂の上に出して隠れていることが多く、夜間に活発に活動する。そのユニークな姿と動きからダイバーに人気がある。
6098,オオタマオウギガニ,,2026-04-16T23:27:05.306685+00:00,2026-04-16T23:27:05.306685+00:00,Banareia obtusifrons,相模湾～紀伊半島、東シナ海,岩礁域、転石帯,甲幅3〜4cm,10-30m,オウギガニの仲間で、甲羅が丸みを帯びており、表面に凹凸が少なく滑らかなのが特徴です。サンゴ礁域の岩や死サンゴの塊の下に隠れて生活しています。夜行性のため、日中に見つけるのは困難です。ナイトダイビングの際に、岩の隙間やガレ場をライトで照らして探すと、餌を探して活動している姿を見ることができます。
6102,ヤマトモエビ,,2026-04-16T23:27:05.306685+00:00,2026-04-16T23:27:05.306685+00:00,Eualus leptognathus,北海道～九州、サハリン、中国,藻場域、浅場,体長約2cm,2-10m,浅い岩礁域や藻場に生息するモエビの仲間。腰が折れ曲がったような独特の体型をしています。体色や模様は非常に変異に富み、生息環境に合わせて緑、赤、褐色など様々です。海藻の間に隠れていることが多く、保護色のため見つけにくいです。じっくりと海藻の根元などを探すと、ひょっこり姿を現すことがあります。
6109,アカモンサラサエビ,,2026-04-16T23:27:05.306685+00:00,2026-04-16T23:27:05.306685+00:00,Cinetorhynchus erythrostictus,八丈島以南、琉球列島、ニューカレドニア,サンゴ礁域,全長約5cm,3m,岩礁やサンゴ礁の洞窟や亀裂に生息するサラサエビの仲間。夜行性が強く、日中は暗がりに潜んでいる。ライトを当てると目が赤く光る。体には大きな赤い斑紋が並び、アカネサラサエビの細かい斑点とは区別できる。腰が曲がった独特の体型をしている。ナイトダイビングで観察しやすい生物の一つ。
6113,サメハダヘイケガニ,,2026-04-16T23:27:05.306685+00:00,2026-04-16T23:27:05.306685+00:00,Paradorippe granulata,北海道南部以南、韓国、台湾、中国北部,砂泥底、岩礁域,甲長約4cm,3-150m,ヘイケガニの仲間で、甲羅の表面が顆粒で覆われザラザラしています。後ろの2対の脚が背中側にあり、これでカイメンや二枚貝の殻などを背負って擬態する習性があります。砂泥底に生息し、昼間は砂に浅く潜っていることもあります。何かを背負って歩く姿が観察のポイントで、背負っているものと一体化して見つけにくいです。
6130,スジエビモドキ,,2026-04-16T23:27:05.306685+00:00,2026-04-16T23:27:05.306685+00:00,Palaemon serrifer,北海道以南、香港、東南アジア、インド洋東部,潮間帯の藻場、岩礁,体長約3cm,水面下-3m,テナガエビの仲間で、体が透明で、黒い縞模様が入っているのが特徴です。河口近くの汽水域から内湾の浅い岩場やアマモ場に生息しています。驚くと素早く後方へジャンプします。他の生物の体を掃除するクリーナーシュリンプとしても知られており、魚にまとわりつかれている姿を観察できることもあります。
6138,カンザシヤドカリ,,2026-04-16T23:27:05.306685+00:00,2026-04-16T23:27:05.306685+00:00,Pagurina,紀伊半島以南、東南アジア,サンゴ礁域、岩礁の岩穴,甲長約0.5cm,3-15m,ゴカイの仲間であるカンザシゴカイが作った石灰質の棲管を宿にする、非常に小さなヤドカリ。サンゴの骨格や岩に固着した棲管に住んでいます。小さすぎて肉眼での識別は困難ですが、棲管から小さな脚やハサミが出入りする様子をマクロレンズで観察できます。ダイバーの吐く泡の刺激で引っ込んでしまいます。
6153,ツブワタリイシガニ,,2026-04-16T23:27:05.306685+00:00,2026-04-16T23:27:05.306685+00:00,Charybdis granulata,相模湾～紀伊半島沿岸,岩礁域,甲幅約7cm,10-35m,ワタリガニの仲間で、甲羅の表面に多数の顆粒が並び、ザラザラしているのが特徴。砂泥底や砂礫底に生息し、昼間は砂に潜っていることもある。最後の一対の脚は泳ぐための遊泳脚になっている。危険を感じるとハサミを広げて威嚇するが、素早く泳いだり砂に潜ったりして逃げる。
6171,オオサンゴサラサエビ,,2026-04-16T23:27:05.306685+00:00,2026-04-16T23:27:05.306685+00:00,Cinetorhynchus striatus,奄美大島以南、フィリピン、ニューカレドニア,サンゴ礁域,体長約8cm,10m,サラサエビの仲間では大型になる種で、赤い体に白い線や斑点が入る美しいエビです。夜行性が強く、日中は岩穴やサンゴの隙間の奥深くに隠れています。ナイトダイビングでは岩棚の下などから出てきて活発に活動する姿が見られます。他の魚の寄生虫などを食べるクリーナーシュリンプとしても知られています。
6179,トガリヒヅメガニ,,2026-04-16T23:27:05.306685+00:00,2026-04-16T23:27:05.306685+00:00,Etisus anaglyptus,東京湾以南、中国、ハワイ、南太平洋、オーストラリア、インド洋、紅海,サンゴ礁域、岩礁,甲幅3〜5cm,1-10m,岩礁やサンゴ礁に生息するオウギガニの仲間。脚の先端が尖っており、蹄（ひづめ）のようになっていることからこの名がついた。甲羅はゴツゴツしており、凹凸に富む。昼間は岩の隙間や下に隠れていることが多い。体色は赤褐色で、地味な見た目をしている。
6184,ベニオウギガニ,,2026-04-16T23:27:05.306685+00:00,2026-04-16T23:27:05.306685+00:00,Liomera tristis,東京湾以南、東南アジア、南太平洋、インド洋東部,サンゴ礁域、岩礁,甲幅3〜5cm,2-30m,サンゴ礁や岩礁域に普通に見られるオウギガニの仲間。体色は赤褐色から紫がかった色まで個体差があります。昼間は岩の隙間や転石の下に隠れており、夜になると活動的になります。ハサミの先端が黒いのが特徴です。似た種が多いですが、比較的よく見かける種類です。
6188,ヤセエビス,,2026-04-16T23:27:05.306685+00:00,2026-04-16T23:27:05.306685+00:00,Pristilepis oligolepis,南日本の太平洋岸、伊豆・小笠原諸島、琉球列島；インド・太平洋,岩礁、岩の亀裂,全長約25cm,35m,イットウダイの仲間で、岩礁やサンゴ礁の洞窟や岩の裂け目など、暗い場所に潜んでいます。夜行性のため、日中は物陰でじっとしており、ダイバーがライトで照らすと赤い体と大きな目が光って見えます。他のイットウダイの仲間より体高が高いのが特徴です。ナイトダイビングではより活発な姿を観察できます。
6189,ケセンガニ,,2026-04-16T23:27:05.306685+00:00,2026-04-16T23:27:05.306685+00:00,Oregonia gracilis,千葉県～北海道、日本海、アラスカ、カリフォルニア沿岸,岩礁域、砂泥底,甲幅約3cm,5-530m,冷たい海に生息するクモガニの仲間。非常に長い脚を持ち、甲羅は三角形で小さい。全身が細かな毛で覆われている。水深5mほどの浅い場所から500m以上の深海まで、非常に幅広い水深に生息するのが特徴。岩場や砂泥底で、カイメンやヤギ類に付着していることがある。動きはゆっくりで、周囲に溶け込んでいることが多い。
6195,テッポウエビモドキ,,2026-04-16T23:27:05.306685+00:00,2026-04-16T23:27:05.306685+00:00,Betaeus grandifroms,房総半島以南、韓国、台湾、香港,岩礁域、岩穴,全長約5cm,1m,テッポウエビの仲間だが、大きなハサミで「パチン」という音を出すことはない。岩礁地帯の転石下や岩の隙間に、雌雄のペアで暮らしていることが多い。体色は暗褐色で目立たない。石をそっとめくると、驚いて逃げるペアの姿を観察できることがある。観察後は必ず石を元に戻すのがマナー。
6197,クロテナガオウギガニ,,2026-04-16T23:27:05.306685+00:00,2026-04-16T23:27:05.306685+00:00,Chlorodiella nigra,相模湾以南、東南アジア、ハワイ、インド洋、紅海、アフリカ東岸,潮間帯、岩礁域,甲幅約1.5cm,水面下-5m,サンゴ礁のサンゴの枝の間や、岩の隙間に生息する小型のオウギガニの仲間。体は黒褐色で、ハサミの先端が黒いのが特徴。枝状サンゴの根元の死サンゴ礫の間などに隠れていることが多い。非常に小さく、保護色のため見つけにくい。サンゴの根元付近をライトで照らし、動くものを探すと見つけられる可能性がある。
6204,シサンゴカクレエビ,,2026-04-16T23:27:05.306685+00:00,2026-04-16T23:27:05.306685+00:00,Palaemonella rostrum,相模湾以南、東南アジア、ハワイ、フランス領ポリネシア、インド洋、紅海、地中海東部,サンゴの枝間,体長約3.5cm,1-5m,透明な体に黄色や白の線が入った、美しいカクレエビの仲間です。岩礁やサンゴ礁の浅い場所に生息し、岩の隙間やサンゴの陰に潜んでいます。他の生物の体を掃除するクリーニング行動をとることもあります。体が透けているため見つけにくいですが、特徴的な模様を頼りに探すと見つかります。
6211,コイチョウガニ,,2026-04-16T23:27:05.306685+00:00,2026-04-16T23:27:05.306685+00:00,Cancer amphioetus,北海道～九州、韓国、中国北部、カリフォルニア～メキシコ,砂泥底、藻場域,甲幅約5〜8cm,2-70m,イチョウガニの仲間で、甲羅が銀杏の葉に似た形をしている。砂礫底や岩礁域に生息する。甲羅の縁には鋭いトゲが並ぶ。体色は赤褐色や紫褐色で、個体変異がある。動きは比較的素早い。ダイバーが近づくと、岩陰や砂の中に隠れようとする。食用にされることもある。
6212,メンコガニ,,2026-04-16T23:27:05.306685+00:00,2026-04-16T23:27:05.306685+00:00,Daldorfia horrida,富山湾～函館湾（日本海側）、紀伊半島～函館湾（太平洋側）,岩礁の岩穴、藻場域,甲幅10〜15cm,3-60m,岩に擬態したゴツゴツとした姿が特徴の大型のカニ。甲羅は凹凸が激しく、カイメンやコケムシなどが付着しており、一見すると岩と見分けがつきません。夜行性で、日中は岩棚の下などでじっとしています。ナイトダイビングで岩壁を歩いている姿を見つけることができます。動きはゆっくりで、観察しやすいですが、強力なハサミには注意が必要です。
6216,ムラサキオカヤドカリ,,2026-04-16T23:27:05.306685+00:00,2026-04-16T23:27:05.306685+00:00,Coenobita purpureus,鹿児島県以南、東南アジア、インド洋,海岸線、陸上,甲長約4cm,陸生,美しい紫色が特徴的な、陸上で生活するヤドカリの仲間。天然記念物に指定されている地域もあります。海岸の林や草地に生息し、夜になると餌を探して活発に動き回ります。ダイビングポイントの周辺で見かけることがあります。貝殻が不足しており、プラスチックごみを宿にしている個体も見られ、環境問題を象徴する存在でもあります。
6240,アカヒヅメガニ,,2026-04-16T23:27:05.306685+00:00,2026-04-16T23:27:05.306685+00:00,Etisus dentatus,鹿児島以南、伊豆諸島、ハワイ、南太平洋、オーストラリア、インド洋、紅海、アフリカ東岸,サンゴ礁域、転石帯,甲幅約4〜7cm,1-30m,サンゴ礁や岩礁の転石の下や隙間に生息する大型のカニ。夜行性で、日中は物陰に隠れていることが多い。甲羅は凹凸が多くゴツゴツしており、ハサミの先端がスプーンのように丸く窪んでいるのが特徴。爪先が赤いことが和名の由来。強力なハサミを持つため、不用意に手を出さないよう注意が必要。
6247,ケアシガニ,,2026-04-16T23:27:05.306685+00:00,2026-04-16T23:27:05.306685+00:00,Maja spinigera,東京湾～九州、台湾、インド洋中部,砂泥底、藻場域,甲幅約6cm,20-150m,クモガニの仲間で、甲羅や脚に短い毛や突起物が多く生えている。岩礁や砂泥底に生息し、体中にカイメンやコケムシ、海藻などを付着させて擬態する。その擬態は非常に巧妙で、じっとしていると岩の一部にしか見えない。ゆっくりと移動するため、動いているところを見つけられれば識別は容易。大きな個体は迫力がある。
6254,チゴガニ,,2026-04-16T23:27:05.306685+00:00,2026-04-16T23:27:05.306685+00:00,Ilyoplax pusilla,東京湾～九州、韓国,干潟、河口,甲幅約1cm,高潮線付近,潮が引いた干潟や河口の砂泥地で見られる小さなカニ。ダイビング中に観察する機会はない。雄が片方の大きなハサミをリズミカルに上下に振る「ウェービング」と呼ばれる求愛・威嚇行動が非常に有名。干潮時には、無数の雄が一斉にハサミを振る壮観な光景が見られることがある。
