id,name,category,created_at,updated_at,scientific_name,distribution,habitat,size,depth_range,description
1062,チャカミノモドキ,,2026-04-16T23:27:05.306685+00:00,2026-04-16T23:27:05.306685+00:00,Baeolidia variabilis,西太平洋、中部太平洋,サンゴ礁域、岩礁の岩穴,体長約7〜10mm,5-20m,ミノウミウシに似た姿のウミウシの仲間。イソギンチャクの仲間を食べる。半透明の体に褐色の斑紋があり、背中の突起（ミノ）は扁平で数が多い。岩礁やサンゴ礁に生息する食料のイソギンチャクの近くを探すと見つかることがある。
1067,コハナイバラウミウシ,,2026-04-16T23:27:05.306685+00:00,2026-04-16T23:27:05.306685+00:00,Okenia babai,伊豆半島以南、九州,岩礁の岩穴、転石帯,体長約5〜10mm,10-30m,背中や体の側面に多数の細長い突起を持つウミウシの仲間。その姿が小さな花やイバラのように見えます。体色は半透明の白色。群体で生活するコケムシを食べるため、その群体上で見つかります。餌にしているコケムシも白っぽいため、見つけるには根気強い観察が必要です。複数の個体が集まっていることもあります。
1070,セスジイバラウミウシ,,2026-04-16T23:27:05.306685+00:00,2026-04-16T23:27:05.306685+00:00,Okenia pellucida,インド-太平洋,岩礁域の転石帯や藻場域、サンゴ礁の岩穴,体長約4〜20mm,10-30m,イバラウミウシの仲間で、半透明の白い体に、背中の縁に沿って黄色い指状の突起が並んでいるのが特徴です。岩礁域に生息し、フサコケムシなどのコケムシ類を捕食します。ダイバーは、餌となるレース状のコケムシ群体の上を探すと見つけやすいです。体の周りの突起は防御の役割も果たしていると考えられています。
1071,シオンイバラウミウシ,,2026-04-16T23:27:05.306685+00:00,2026-04-16T23:27:05.306685+00:00,Okenia purpureolineata,沖縄島、フィリピン,サンゴ礁域、岩礁の岩穴,体長12〜15mm,10-30m,イバラウミウシの仲間。体の縁に沿って並ぶ、紫色の線が入った指状の突起が特徴。コケムシ類を餌とし、岩礁の壁面や転石の裏に付着した餌の上で見つかる。体の地色は半透明の白色。突起を揺らしながら移動する。小型で目立たないが、一度見つけるとその独特の形状と色彩の虜になるダイバーも多い。
1072,セナキイバラウミウシ,,2026-04-16T23:27:05.306685+00:00,2026-04-16T23:27:05.306685+00:00,Okenia sp.2,西太平洋,サンゴ礁域、転石帯,体長約10〜15mm,10-30m,イバラウミウシの仲間で、乳白色の体に、背中の中央に黄色い隆起線があり、その両脇に指状の突起が並びます。岩礁域に生息し、餌となるコケムシ類を食べています。ダイバーは、岩壁にシート状に広がるコケムシの上を探すと見つけやすいです。小型で目立たないため、マクロな観察眼が発見の鍵となります。
1073,タマノミドリガイ,,2026-04-16T23:27:05.306685+00:00,2026-04-16T23:27:05.306685+00:00,Berthelinia limax,本州,藻場域、転石帯,体長約5.5〜8mm,5-20m,二枚貝のような殻を持つミドリガイの仲間。緑色の体に白い斑点があり、緑藻のサボテングサ属の海藻を食べる。食草の上で見つかることが多く、完全に擬態しているため見つけるのは非常に困難。食草の葉を一枚一枚丁寧に探す必要がある。
1074,スズヤカフシエラガイ,,2026-04-16T23:27:05.306685+00:00,2026-04-16T23:27:05.306685+00:00,Berthella californica,西太平洋北部、北太平洋、東太平洋,岩礁の岩穴、転石帯,体長約20〜50mm,10-40m,フシエラガイの仲間で、外套膜の下に退化した小さな貝殻を持ちます。半透明のオレンジ色から黄色の体をしており、白い斑点が散在することがあります。岩礁域でカイメン類を食べて生活しています。外套膜の右側にある鰓（えら）が羽状になっているのがこの仲間の特徴です。ダイバーは岩の裏やカイメンの近くを探すと見つけやすいでしょう。
1076,アカボシツバメガイ,,2026-04-16T23:27:05.306685+00:00,2026-04-16T23:27:05.306685+00:00,Biuve fulvipunctata,インド-太平洋,サンゴ礁域、岩礁の岩穴,体長20〜30mm,3-15m,貝殻を持たない巻貝の仲間で、平たい体と左右に広がった外套膜が特徴です。体色は褐色からオレンジ色で、金色の斑点が散らばります。岩礁域の表面や海藻の上を這い、付着生物などを食べると考えられています。刺激を受けると紫色の液体を出すことがあります。夜行性の傾向があるため、ナイトダイビングで活動的な姿を観察できる可能性が高いです。
1078,ヒオドシユビウミウシ,,2026-04-16T23:27:05.306685+00:00,2026-04-16T23:27:05.306685+00:00,Bornella anguilla,インド-西太平洋,サンゴ礁域、岩礁の岩穴,体長約50〜70mm,5-20m,体をくねらせて泳ぐことができるユビウミウシの仲間。赤褐色の体に白い斑点が散在し、ウツボのような模様をしています。背中の指状突起は大きく、ヒドロ虫などを捕食します。夜行性が強く、ナイトダイビングで岩礁を活発に泳ぎ回る姿が見られます。その動きは力強く、ダイナミックです。
1079,ヤマトユビウミウシ,,2026-04-16T23:27:05.306685+00:00,2026-04-16T23:27:05.306685+00:00,Bornella hermanni,インド-西太平洋,サンゴ礁域、岩礁の岩穴、転石帯,体長約8〜50mm,5-30m,体の両側に並ぶ、指のような突起が特徴的なウミウシ。ヒドロ虫を餌としており、その群体の上で見られます。危険を感じると、体をS字にくねらせて水中を泳いで逃げることができます。その泳ぐ姿はダイナミックで、観察の醍醐味の一つです。色彩のバリエーションも豊富です。
1080,ボニンユビウミウシ,,2026-04-16T23:27:05.306685+00:00,2026-04-16T23:27:05.306685+00:00,Bornella johnsonorum,小笠原諸島、マーシャル諸島,サンゴ礁域、岩礁の岩穴,体長10-25mm,5-25m,体側面の突起が特徴的なユビウミウシの仲間。ヒドロ虫を食べる。岩礁域やサンゴ礁に生息し、餌の近くで見つかる。半透明の体に白い斑点が散らばり、指状の突起や触角の先端はオレンジ色。危険を感じると体をくねらせて泳いで逃げる。小笠原諸島（ボニン諸島）で発見されたことに因んで命名された。
1081,ホムラユビウミウシ,,2026-04-16T23:27:05.306685+00:00,2026-04-16T23:27:05.306685+00:00,Bornella pele,西太平洋、中部太平洋,サンゴ礁域、岩礁の岩穴,体長15-30mm,3-20m,体側面に指のような突起が並ぶユビウミウシの仲間。ヒドロ虫を食べる。岩礁域やサンゴ礁に生息。半透明の体に、赤い斑点や網目模様が入る。危険を感じると、体をS字にくねらせて泳いで逃げる。この突起と泳ぐ姿が特徴的。ハワイの火山の女神「ペレ」にちなんで命名された。
1083,ハチジョウユビウミウシ,,2026-04-16T23:27:05.306685+00:00,2026-04-16T23:27:05.306685+00:00,Bornella sp.1,八丈島,岩礁の岩穴,体長約10〜25mm,5-20m,体をくねらせて泳ぐことができるユビウミウシの仲間。半透明の体にオレンジ色や赤色の斑紋が入り、背中には指のような突起が対になって並びます。ヒドロ虫を捕食し、岩礁の壁面や転石の上を活発に動き回ります。危険を感じると体をS字に曲げて泳いで逃げることがあるため、その特徴的な動きにも注目です。
1084,ヒラタイミドリガイ,,2026-04-16T23:27:05.306685+00:00,2026-04-16T23:27:05.306685+00:00,Bosellia sp.,八丈島、南西諸島,サンゴ礁域、海藻が密生した岩礁域,体長8〜10mm程度,3-15m,嚢舌類（のうぜつるい）と呼ばれるウミウシの仲間。平たい葉のような体型で、緑色の海藻「ハネモ」の仲間を食べる。体内に葉緑体を取り込んで光合成を行う（盗葉緑体現象）。ハネモの群落に完璧に擬態しているため、ダイバーが発見するのは極めて難しい。海藻を揺らして動く個体を探すのがコツ。
1085,ヤマトミノウミウシ,,2026-04-16T23:27:05.306685+00:00,2026-04-16T23:27:05.306685+00:00,Bulbaeolidia japonica,日本,岩礁の岩穴、転石帯,体長約20〜40mm,5-25m,ずんぐりとした体に、棍棒状のミノを持つミノウミウシの仲間。主にヒドロ虫を捕食します。体色は半透明の白色で、ミノの先端が黄色やオレンジ色になる個体が多いです。岩礁の壁面や転石の下などに生えるヒドロ虫の群体を探すと見つかることがあります。
1087,コナツメガイ,,2026-04-16T23:27:05.306685+00:00,2026-04-16T23:27:05.306685+00:00,Bulla orientalis,インド-西太平洋,砂泥底、藻場域,体長約20〜30mm,1-15m,ナツメのような形の薄い殻を持つ貝の仲間で、ウミウシと同じ後鰓類に分類されます。夜行性で、日中は砂泥底や藻場に潜んでいます。ナイトダイビングでは活発に這い回り、緑藻などを食べている姿が観察できます。体（軟体部）は淡い褐色で、殻から大きくはみ出しています。危険を感じると素早く砂に潜ります。
1090,オオベニシボリ,,2026-04-16T23:27:05.306685+00:00,2026-04-16T23:27:05.306685+00:00,Bullina nobilis,日本、フィリピン,サンゴ礁域、岩礁の岩穴,殻長10〜20mm,3-20m,鮮やかな赤色に白い斑点が並ぶ、美しい貝殻を持つ貝の仲間です。ミスガイ科に属し、ウミウシに近いグループです。夜行性で、昼間は砂の中に潜っており、ナイトダイビングで砂地を這う姿が見られます。肉食性で、ゴカイなどを捕食します。貝殻は薄くてもろいので、取り扱いには注意が必要です。
1091,クロスジシボリ,,2026-04-16T23:27:05.306685+00:00,2026-04-16T23:27:05.306685+00:00,Bullina vitrea,西太平洋,岩礁の岩穴、転石帯,体長約10〜25mm,5-20m,美しい貝殻を持つウミウシの仲間です。丸い貝殻には、赤い螺旋状の線が数本入ります。体は半透明の白色で、赤い斑点があります。夜行性が強く、日中は砂の中に潜っています。ナイトダイビングで砂地を這っている姿が見つかることがあります。
1104,リンカミノウミウシ,,2026-04-16T23:27:05.306685+00:00,2026-04-16T23:27:05.306685+00:00,Caloria sp.,インド-太平洋,サンゴ礁域、藻場域,体長約10〜15mm,10-30m,ミノウミウシの仲間で、体は半透明の白色、背中のミノの先端が鮮やかなピンクやオレンジ色になる美しい種です。ヒドロ虫を主食とし、その群体の上で見られます。ミノの色は食べたものによって多少変化します。岩壁やロープなどに付着したヒドロ虫を丹念に探してみましょう。
1107,メダマヤキウミウシ,,2026-04-16T23:27:05.306685+00:00,2026-04-16T23:27:05.306685+00:00,Carminodoris estrelyado,インド-太平洋,サンゴ礁域、岩礁の岩穴,体長約15〜40mm,10-30m,白い体に黄色い斑紋が散らばる姿が目玉焼きのように見える、ドーリス系のウミウシ。岩礁に生息し、カイメン類を捕食します。夜行性の傾向があり、日中は岩陰に隠れていることが多いです。体の表面は硬く、刺激を受けると体を丸める防御行動をとります。ユニークな名前と見た目で人気があります。
1108,ニヨリセンリョウウミウシ,,2026-04-16T23:27:05.306685+00:00,2026-04-16T23:27:05.306685+00:00,Carminodoris flammea,西太平洋,岩礁の岩穴、転石帯,体長30〜80mm,10-40m,大型で、背中に多数の赤い突起を持つウミウシの仲間。岩礁域に生息し、餌となる赤い海綿（カイメン）を食べます。体色は白から薄いピンク色で、背中の突起は鮮やかな赤色。この特徴的な姿からダイバーに人気があります。餌の海綿の上にいることが多く、その色に紛れて見つけにくい場合もあります。動きは非常に遅いです。
1109,ツブツブウミウシ,,2026-04-16T23:27:05.306685+00:00,2026-04-16T23:27:05.306685+00:00,Carminodoris grandiflora,インド-太平洋,サンゴ礁域、転石帯,体長約5cm,10-40m,ずんぐりとした体型で、背面が多数の顆粒状突起で覆われているウミウシの仲間。体色は白色から黄色で、突起の先端が赤やオレンジ色になる。夜行性で、日中は岩の隙間や下に隠れていることが多い。餌となるカイメンの近くを探すと、夜間のダイビングで見つけやすい。
1124,アカイバラウミウシ,,2026-04-16T23:27:05.306685+00:00,2026-04-16T23:27:05.306685+00:00,Okenia kondoi,西太平洋,岩礁の岩穴、転石帯,体長5～15mm,10-40m,イバラウミウシの仲間で、体中に赤いイバラのような突起を持つのが特徴です。体色は白からピンク色。岩礁域で、餌となる外肛動物（コケムシ類）の上で見つかることが多いです。刺激を受けると体を丸める防御行動をとります。小さいながらも印象的な姿をしています。
1127,ミナミヒロウミウシ,,2026-04-16T23:27:05.306685+00:00,2026-04-16T23:27:05.306685+00:00,Okenia nakamotoensis,インド-西太平洋,砂泥底、藻場域,体長約20〜30mm,10-30m,平たい体と背中の突起が特徴的なウミウシの仲間。フジマツモなどのフサコケムシ類を好んで食べるため、餌場となるコケムシの群体周辺で見つかります。白い体にくっきりとしたオレンジ色の斑紋が入り、識別は比較的容易です。岩礁の壁面や転石の下などをゆっくりと這って移動します。
1128,アミメイバラウミウシ,,2026-04-16T23:27:05.306685+00:00,2026-04-16T23:27:05.306685+00:00,Okenia sp.3,西太平洋,岩礁の岩穴、転石帯,体長7〜10mm,10-30m,イバラウミウシと呼ばれる、背中に指状の突起が並ぶウミウシの仲間。半透明の白い体に、背中の突起と触角の先端が黄色になるのが特徴です。岩礁に生息するフサコケムシというコケムシの仲間を専門に食べます。餌となるコケムシの群体上でしか見られないため、フサコケムシの群落を探すことが発見の唯一の方法です。
1133,クロダンゴイボウミウシ,,2026-04-16T23:27:05.306685+00:00,2026-04-16T23:27:05.306685+00:00,Ceratophyllidia sp.1,西太平洋、中部太平洋,サンゴ礁域、岩礁の岩穴,体長約20〜35mm,15-40m,硬いイボに覆われたイボウミウシの仲間です。体色は黒色で、団子のような丸い体型をしています。背中のイボ状突起は大きく、先端が尖っています。岩礁域に生息し、特定の海綿を食べると考えられています。そのユニークな形状からダイバーの注目を集めます。
1134,シロダンゴイボウミウシ,,2026-04-16T23:27:05.306685+00:00,2026-04-16T23:27:05.306685+00:00,Ceratophyllidia sp.2,西太平洋、中部太平洋,サンゴ礁域、岩礁の岩穴,体長約12〜15mm,15-40m,硬いイボ状の突起を持つイボウミウシの仲間。体地色は白色で、背中の突起は大きく丸い。岩礁の壁面や洞窟内など、やや暗い環境で見られることが多い。餌はカイメン類とされるが、詳しい生態は不明な点も多い。突起の形状が団子のように見えることからこの名がついた。
1135,ダンゴイボウミウシ,,2026-04-16T23:27:05.306685+00:00,2026-04-16T23:27:05.306685+00:00,Ceratophyllidia africana,インド-西太平洋,サンゴ礁域、岩礁の岩穴,体長約35〜40mm,15-40m,イボウミウシに似た姿のウミウシの仲間。体は硬く、黒い地色に黄色やオレンジ色の大きな突起が並ぶ。突起の形状が団子のように丸いことが和名の由来。カイメン食で、岩礁の壁面やオーバーハングの下で観察されることが多い。
1140,ミナミニシキウミウシ,,2026-04-16T23:27:05.306685+00:00,2026-04-16T23:27:05.306685+00:00,Ceratosoma gracillimum,西太平洋,サンゴ礁域、岩礁の岩穴,体長約100〜120mm,10-30m,ニシキウミウシの仲間で、体色は紫、赤、黄色など非常に変異に富みます。背中の後方に、餌となるカイメンを付着させて運ぶためのポケット状の構造を持つことがあります。岩礁域でカイメンを食べており、その鮮やかな色彩は水中でもよく目立ちます。
1141,スソヒダウミウシ,,2026-04-16T23:27:05.306685+00:00,2026-04-16T23:27:05.306685+00:00,Miamira miamirana,インド-太平洋,サンゴ礁域、岩礁の割れ目,体長約70〜75mm,3-20m,ゴツゴツした硬い体を持つウミウシの仲間で、外套膜の縁がフリルのように大きく波打つ独特の姿をしています。体色は緑色や褐色など変異に富みます。岩礁域で特定のカイメン類を食べており、そのカイメンに擬態していると考えられています。ダイバーはカイメンの上や周辺をゆっくり移動する姿を探してみましょう。動きは比較的緩慢です。
1142,モロックニシキウミウシ,,2026-04-16T23:27:05.306685+00:00,2026-04-16T23:27:05.306685+00:00,Miamira moloch,西太平洋,サンゴ礁域、岩礁の岩穴,全長約150mm,15-50m,ゴツゴツとした突起に覆われた、大型で迫力のあるニシキウミウシの仲間。主にカイメン類を食べており、餌のカイメンの近くで見つかります。非常に色彩変異に富み、黄色、オレンジ、ピンクなど様々な個体が存在します。その厳つい見た目から、旧約聖書に登場する神の名が付けられています。
1143,コハクニシキウミウシ,,2026-04-16T23:27:05.306685+00:00,2026-04-16T23:27:05.306685+00:00,Ceratosoma palliolatum,西太平洋,サンゴ礁域、岩礁の転石帯,体長約30〜75mm,10-40m,背中の後方に目立つ突起を持つウミウシの仲間。体色は淡いピンク色からオレンジ色で、白い斑点が散らばります。この背中の突起は、敵に襲われた際に自切（自分で切り離す）することができます。岩礁域で餌となるカイメンを食べている姿が見られます。突起の形状がニシキウミウシの仲間を見分ける重要なポイントです。
1144,ウスフジイロウミウシ,,2026-04-16T23:27:05.306685+00:00,2026-04-16T23:27:05.306685+00:00,Ceratosoma sp.2,インド-太平洋,サンゴ礁域、岩礁の岩穴,体長約4〜12mm,10-30m,フジイロウミウシに似た姿の小型のウミウシ。体は細長く、背面には正中線に沿って数個の突起が並びます。体色は淡い藤色から紫色で、黄色い斑点が入ることがあります。岩礁地帯でカイメン類を食べていると考えられています。特徴的な背中の突起と体色で見分けますが、サイズが小さいため注意深い観察が必要です。
1145,ヒサコイロウミウシ,,2026-04-16T23:27:05.306685+00:00,2026-04-16T23:27:05.306685+00:00,Hypselodoris sp.1,伊豆半島,岩礁の岩穴,体長約15mm,10-30m,鮮やかな色彩が特徴のイロウミウシの仲間。体は紫色で、中央に1本の白い縦線が入ります。外套膜の縁は黄色く縁取られ、触角と二次鰓はオレンジ色です。岩礁域で餌となるカイメン類を探して移動します。色彩がはっきりしているため、同定は比較的容易。水中での写真映えも良い人気の種です。
1146,ハナエニシキウミウシ,,2026-04-16T23:27:05.306685+00:00,2026-04-16T23:27:05.306685+00:00,Ceratosoma sp.1,小笠原諸島,サンゴ礁域、岩礁の岩穴,体長約100〜140mm,10-30m,背中の大きな突起が特徴的なニシキウミウシの仲間。体色はオレンジ色から赤色で、白い斑点が散在します。背中の中央後方にある突起は、敵を誘うための擬態と考えられています。岩礁域で餌となるカイメン類を探してゆっくりと移動します。大型で色彩も目立つため、比較的見つけやすいウミウシです。
1147,テヌウニシキウミウシ,,2026-04-16T23:27:05.306685+00:00,2026-04-16T23:27:05.306685+00:00,Ceratosoma tenue,インド-太平洋,サンゴ礁域、岩礁の岩穴、転石帯,体長約12〜15cm,5-35m,大型で非常に目立つウミウシの仲間。体色は赤、ピンク、紫など変異に富み、黄色い斑点を持つ。背中の中央後方にある突起が特徴で、これは防御のための誘引突起と考えられている。岩礁域でよく見られ、カイメンを食べる。その大きさからダイバーの目に留まりやすい。
1148,リュウキュウカスミミノウミウシ,,2026-04-16T23:27:05.306685+00:00,2026-04-16T23:27:05.306685+00:00,Cerberilla affinis,インド-太平洋,砂泥底,体長約45〜90mm,5-20m,砂地に生息するミノウミウシの仲間です。夜行性で、日中は砂の中に潜っています。夜になると砂から出てきて、ヤツデヒトデなどを捕食します。ミノを広げて威嚇したり、体をくねらせて砂に潜ったりする行動が観察できます。ナイトダイビングが観察のチャンスです。
1150,アンボンカスミミノウミウシ,,2026-04-16T23:27:05.306685+00:00,2026-04-16T23:27:05.306685+00:00,Cerberilla ambonensis,西太平洋,砂泥底,体長約12〜50mm,3-30m,砂地に生息するミノウミウシの仲間。夜行性で日中は砂の中に潜っているため、観察にはナイトダイビングが適しています。砂から顔や背中の突起だけを出している姿が見られることも。イソギンチャク類を捕食します。半透明の体に、先端が青やオレンジに色づく多数のミノが特徴で、危険を感じるとミノを自切することがあります。
1151,マエダカスミミノウミウシ,,2026-04-16T23:27:05.306685+00:00,2026-04-16T23:27:05.306685+00:00,Cerberilla annulata,インド-太平洋,砂泥底,体長約40〜70mm,5-25m,ミノウミウシの仲間で、砂地に生息しています。夜行性で、日中は砂の中に潜っていることが多いため、ナイトダイビングで観察される機会が多いです。危険を感じると背中のミノ（背側突起）を自切して逃げます。砂の上を這った跡が、発見の手がかりになることもあります。
1153,ニッポンカスミミノウミウシ,,2026-04-16T23:27:05.306685+00:00,2026-04-16T23:27:05.306685+00:00,Cerberilla longibranchus,本州、四国,砂泥底,体長約20mm,5-30m,砂地に生息するカスミミノウミウシの仲間。夜行性で、日中は砂に潜っていますが、夜になると餌を求めて這い出します。他のカスミミノウミウシ類に比べて背側突起（ミノ）が長く、密生しているのが特徴です。ナイトダイビングで砂地をライトで照らすと、砂の上を移動する姿や、上半身だけを砂から出している姿を観察できることがあります。
1155,キホシミノウミウシ,,2026-04-16T23:27:05.306685+00:00,2026-04-16T23:27:05.306685+00:00,Cerberilla sp.1,本州から南西諸島,砂泥底,体長約13〜15mm,5-20m,砂地に生息するミノウミウシの仲間。半透明の体に、黄色い斑点と白い細点が散らばります。背中のミノは長く、先端が黄色くなっています。日中は砂に潜り、夜間に這い出して餌を探します。ナイトダイビングで砂地を這う姿や、砂から出入りする様子が観察できます。
1156,ケイウミノウミウシ,,2026-04-16T23:27:05.306685+00:00,2026-04-16T23:27:05.306685+00:00,Cerberilla sp.2,日本、フィリピン,砂泥底,体長約35〜70mm,5-20m,砂地に生息する大型のミノウミウシの仲間です。半透明の体に、背中の多数の突起（背側突起）の内部が褐色やオレンジ色に透けて見えます。夜行性で、日中は砂の中に潜っています。ナイトダイビングで砂地を活発に這い回る姿が観察されることがあります。
1158,クロカスミミノウミウシ,,2026-04-16T23:27:05.306685+00:00,2026-04-16T23:27:05.306685+00:00,Cerberilla sp.5,南西諸島,砂泥底,体長約5〜10mm,5-20m,砂地に生息するミノウミウシの仲間です。半透明の白色の体に、背中の突起（背側突起）の内部が黒く透けて見えます。夜行性で、日中は砂の中に潜っています。ナイトダイビングで砂地を這い回る姿が観察されます。危険を感じると、素早く砂の中に潜って隠れます。
