id,name,category,created_at,updated_at,scientific_name,distribution,habitat,size,depth_range,description
1,ハコフグ,,2026-04-16T23:27:05.306685+00:00,2026-04-16T23:27:05.306685+00:00,Ostracion immaculatum,岩手県以南、南日本、伊豆・小笠原諸島、朝鮮半島、香港,岩礁域を含む沿岸の浅所,全長約20cm,15m,ハコフグの仲間。体が硬い骨板でできた箱のような鎧で覆われている。皮膚からパフトキシンという粘液毒を出すため、取り扱いには注意が必要。オスは鮮やかな青い体に白い斑点、メスや若魚は茶色い体色をしている。サンゴ礁や岩礁域をゆっくりとホバリングするように泳ぐ姿が愛らしい。
2,ミナミハコフグ,,2026-04-16T23:27:05.306685+00:00,2026-04-16T23:27:05.306685+00:00,Ostracion cubicum,南日本の太平洋岸、伊豆・小笠原諸島、琉球列島；インド・太平洋、大西洋南東部,サンゴ礁域、礁池や礁斜面,体長約3cm（幼魚）,15m,ハコフグの仲間で、特に幼魚は鮮やかな黄色のサイコロのような体型でダイバーに人気です。成長すると体色は褐色がかった黄色に変化し、体型も丸みを帯びます。サンゴの枝の間や岩陰に隠れていることが多い幼魚を探すのも楽しみの一つです。皮膚から毒を出すことがあるため、脅かさずにそっと観察しましょう。
3,クロハコフグ,,2026-04-16T23:27:05.306685+00:00,2026-04-16T23:27:05.306685+00:00,Ostracion meleagris,南日本の太平洋岸、伊豆・小笠原諸島、琉球列島；ハワイ諸島と紅海を除くインド・太平洋,礁池や礁斜面など15m以浅にあるサンゴの根の周辺に砂地のある場所,全長約18cm,10m,ハコフグの仲間で、硬い骨板の「箱」で体が覆われています。オスとメスで体色が異なり、オスは青地に鮮やかなオレンジ色の斑点を持つ美しい姿をしていますが、メスは黒地に白い斑点で「ミナミハコフグ」という別名で呼ばれることもあります。ゆっくりと泳ぎますが、皮膚から毒を出すことがあるため、触れないようにしましょう。
5,ウミスズメ,,2026-04-16T23:27:05.306685+00:00,2026-04-16T23:27:05.306685+00:00,Lactoria diaphana,南日本の太平洋岸、伊豆・小笠原諸島、琉球列島；インド・汎太平洋、大西洋南東部,岩礁と砂地の境界付近,全長約15cm,25m,フグの仲間で、体が硬い骨板で覆われた箱のような形をしています。体は半透明で、内臓が透けて見えることがあります。体の断面は三角形です。泳ぎはあまり得意ではなく、胸ビレなどを細かく動かしてホバリングするようにゆっくりと泳ぎます。危険を感じると皮膚から毒を出すため、素手で触るのは危険です。
6,シマウミスズメ,,2026-04-16T23:27:05.306685+00:00,2026-04-16T23:27:05.306685+00:00,Lactoria fornasini,南日本の太平洋岸、伊豆・小笠原諸島、琉球列島；インド・太平洋、大西洋南東部,岩礁域,全長約2.5cm,20m,ハコフグの仲間で、硬い骨板に覆われた箱型の体をしています。頭部に2本の長い角があり、牛のようにも見えます。岩陰やガレ場に潜み、ゆっくりと泳ぎます。幼魚は非常に小さく、流れ藻についていることもあります。危険を感じると皮膚から毒を出すため、触れないように注意しましょう。
7,クラカケチョウチョウウオ,,2026-04-16T23:27:05.306685+00:00,2026-04-16T23:27:05.306685+00:00,Chaetodon adiergastos,和歌山県以南～琉球列島；東部インド洋～西部太平洋の熱帯域,岩礁域、サンゴ礁域,全長約12cm,10m,チョウチョウウオの仲間で、白い体に目の周りから背ビレにかけて黒い帯模様が入るのが特徴です。サンゴ礁の斜面やドロップオフで、ペアや小さな群れで行動します。主にサンゴのポリプを食べます。警戒心はやや強いですが、ダイバーの周りを遠巻きに泳ぐこともあり、優雅な姿を観察することができます。
8,カガミチョウチョウウオ,,2026-04-16T23:27:05.306685+00:00,2026-04-16T23:27:05.306685+00:00,Chaetodon argentatus,南日本の太平洋岸、琉球列島、小笠原諸島；西部太平洋の熱帯域,岩礁域、サンゴ礁域,全長約10cm,5m,チョウチョウウオの仲間で、銀白色の体に黒い斑点が並ぶシックな色合いが特徴です。サンゴ礁域や岩礁域に生息し、ペアまたは小さな群れで行動します。主にサンゴのポリプを食べます。日本の固有種で、特に琉球列島でよく見られます。他のチョウチョウウオに比べて、ややシャイな性質を持っています。
9,トゲチョウチョウウオ,,2026-04-16T23:27:05.306685+00:00,2026-04-16T23:27:05.306685+00:00,Chaetodon auriga,山陰地方、南日本の太平洋岸、琉球列島、朝鮮半島、インド・太平洋岩礁域、サンゴ礁域,サンゴ礁域、岩礁域,全長約13cm,10m,チョウチョウウオの仲間で、背びれの後方が糸状に長く伸びるのが大きな特徴です。サンゴ礁から岩礁、砂地まで幅広い環境に適応しており、単独またはペアで行動します。雑食性で、藻類やサンゴのポリプ、小型の甲殻類などを食べます。ダイバーにも比較的人懐っこく、観察しやすいチョウチョウウオの一つです。
10,ミカドチョウチョウウオ,,2026-04-16T23:27:05.306685+00:00,2026-04-16T23:27:05.306685+00:00,Chaetodon baronessa,南日本の太平洋岸、琉球列島；東部インド洋～西部太平洋の熱帯域,岩礁域、サンゴ礁域,全長約12cm,1-20m,チョウチョウウオの仲間で、ミドリイシ類など特定のサンゴを主食とします。黄色い体に黒い山型の模様が並ぶのが特徴で、サンゴのポリプを食べるために進化した口をしています。食性から、健全なサンゴ礁の指標となる生物の一つです。ペアで行動していることが多いです。
11,チョウチョウウオ,,2026-04-16T23:27:05.306685+00:00,2026-04-16T23:27:05.306685+00:00,Chaetodon auripes,南日本の太平洋岸、琉球列島、小笠原諸島、台湾、西沙諸島,岩礁域、サンゴ礁域,全長約12cm,10m,チョウチョウウオの仲間で、黄色い体に黒い目隠し模様が特徴です。日本の温帯域を代表する種で、岩礁域で普通に見られます。ペアで行動していることが多く、岩肌についた付着生物やゴカイなどをついばんで食べます。他のチョウチョウウオに比べて、ダイバーに対する警戒心はやや強い傾向があります。
12,ウミヅキチョウチョウウオ,,2026-04-16T23:27:05.306685+00:00,2026-04-16T23:27:05.306685+00:00,Chaetodon bennetti,南日本の太平洋岸、琉球列島；インド・太平洋,岩礁域、サンゴ礁域,全長約12cm,10m,チョウチョウウオの仲間で、黄色い体に青みがかった白い斑点があり、目を通る黒い帯と背ビレ後方の大きな黒い斑点が特徴です。この黒い斑点が「月の輪」に見えることが名前の由来です。サンゴのポリプを主食としており、サンゴ礁域で単独またはペアで行動しています。サンゴをつつく姿が観察できます。
13,ゴマチョウチョウウオ,,2026-04-16T23:27:05.306685+00:00,2026-04-16T23:27:05.306685+00:00,Chaetodon citrinellus,南日本の太平洋岸、琉球列島；インド・太平洋,岩礁域、サンゴ礁域,全長約10cm,5m,チョウチョウウオの仲間で、鮮やかなレモンイエローの体に細かい黒い点が散らばるのが特徴です。主にサンゴのポリプを食べるため、サンゴが豊かな浅いサンゴ礁や岩礁域でよく見られます。単独かペアで行動していることが多く、ダイバーにも比較的近寄りやすい魚です。
14,ユウゼン,,2026-04-16T23:27:05.306685+00:00,2026-04-16T23:27:05.306685+00:00,Chaetodon daedalma,南日本の太平洋岸、伊豆・小笠原諸島および南・北大東島,岩礁域、サンゴ礁域,全長約11cm,15m,チョウチョウウオの仲間で、小笠原諸島や伊豆諸島などで見られる日本の固有種です。黒褐色の体に細かい網目模様が広がり、尾ビレの白さが際立つシックな見た目が特徴です。岩礁域に生息し、ペアや数匹の群れで行動します。岩の表面についた藻類や小型の無脊椎動物などをついばむようにして食べます。
15,セグロチョウチョウウオ,,2026-04-16T23:27:05.306685+00:00,2026-04-16T23:27:05.306685+00:00,Chaetodon ephippium,南日本の太平洋岸、琉球列島；東部インド洋～中・西部太平洋の熱帯域,サンゴ礁域、岩礁域、15m以浅の穏やかな所,全長約15cm,15m,チョウチョウウオの仲間で、体の中央から背中にかけてある大きな黒い斑が、馬の鞍（くら）のように見えることが特徴。サンゴ礁でペアで行動していることが多い。雑食性で、サンゴのポリプや小動物などを食べる。比較的大きく、見応えがある。
16,コクテンカタギ,,2026-04-16T23:27:05.306685+00:00,2026-04-16T23:27:05.306685+00:00,Chaetodon guentheri,南日本の太平洋岸、琉球列島、小笠原諸島；西部太平洋の温・熱帯域,岩礁域、サンゴ礁域,全長約10cm,25m,チョウチョウウオの仲間で、サンゴ礁や岩礁域のやや深い場所で見られます。体は白く、後方に向かって黄色みが強くなり、体中に小さな黒い点々が並んでいるのが特徴です。大きな群れを作ることが多く、潮通しの良い場所で中層を漂いながらプランクトンを食べている姿は壮観です。他のチョウチョウウオ類と混泳していることもあります。
17,ミゾレチョウチョウウオ,,2026-04-16T23:27:05.306685+00:00,2026-04-16T23:27:05.306685+00:00,Chaetodon kleinii,南日本の太平洋岸、琉球列島；インド・汎太平洋,岩礁域、サンゴ礁域,全長約10cm,10m,チョウチョウウオの仲間ですが、サンゴのポリプだけでなく藻類やプランクトンも食べる雑食性です。そのため、様々な環境で見られます。黄色みがかった体に細かい点が散らばり、これが「みぞれ」のように見えることが名前の由来です。目の周りを通る黒い帯が特徴です。
18,ニセフウライチョウチョウウオ,,2026-04-16T23:27:05.306685+00:00,2026-04-16T23:27:05.306685+00:00,Chaetodon lineolatus,南日本の太平洋岸、琉球列島；インド・太平洋,岩礁域、サンゴ礁域,全長約30cm,2-50m,チョウチョウウオの仲間では最大級の種。白い体に走る黒い縦縞と、頭部を横切る太い黒帯が特徴的。サンゴ礁域で単独かペアで行動し、サンゴのポリプや小さな無脊椎動物を捕食する。比較的広い範囲を泳ぎ回るため、リーフエッジなどで見かけることが多い。堂々とした泳ぎ方が印象的。
19,チョウハン,,2026-04-16T23:27:05.306685+00:00,2026-04-16T23:27:05.306685+00:00,Chaetodon lunula,南日本の太平洋岸、琉球列島；インド・太平洋、大西洋南東部,岩礁域、サンゴ礁域,全長約11cm,10m,チョウチョウウオの仲間で、体の後半にある大きな黒い斑紋（鞍状斑）が特徴です。サンゴ礁や岩礁域に生息し、昼間はペアで行動しますが、夜になると単独で岩陰などで休みます。雑食性で、サンゴのポリプや甲殻類、藻類など様々なものを食べます。夜行性の一面もあり、ナイトダイビングでは活発に餌を探す姿が見られます。
20,アケボノチョウチョウウオ,,2026-04-16T23:27:05.306685+00:00,2026-04-16T23:27:05.306685+00:00,Chaetodon melannotus,南日本の太平洋岸、琉球列島；インド・太平洋,岩礁域、サンゴ礁域,全長約11cm,10m,チョウチョウウオの仲間で、白い体に黒い斜めの帯模様が入るのが特徴。サンゴのポリプを主食とする。ミドリイシなど、特定のサンゴ群落の周辺でペアまたは小さな群れで見られる。夜間はサンゴの枝の間などで休み、体色を変化させる。驚くとサンゴの隙間に素早く隠れる。
22,ベニオチョウチョウウオ,,2026-04-16T23:27:05.306685+00:00,2026-04-16T23:27:05.306685+00:00,Chaetodon mertensii,琉球列島、小笠原諸島；インド・太平洋,サンゴ礁域,全長約10cm,25m,チョウチョウウオの仲間で、やや深めのサンゴ礁の斜面やドロップオフで見られる。白い体に「へ」の字型のオレンジ色の縞模様が並び、尾ビレの付け根に黒い斑点があるのが特徴。単独かペアで行動する。近縁種のウミヅキチョウチョウウオとは、尾ビレの黒い帯の有無で見分けることができる。
23,シラコダイ,,2026-04-16T23:27:05.306685+00:00,2026-04-16T23:27:05.306685+00:00,Chaetodon nippon,南日本の太平洋岸、朝鮮半島南部、台湾、フィリピン北部,岩礁域,全長約10cm,10m,チョウチョウウオの仲間ですが、主に温帯域の岩礁に生息する日本固有種です。白い体に体の後方が黒く、尾ビレが黄色いという特徴的な配色をしています。サンゴのポリプではなく、岩に付着したゴカイや甲殻類などを食べます。ペアで行動していることが多く、ダイバーにも比較的近寄りやすい魚です。
24,ヤスジチョウチョウウオ,,2026-04-16T23:27:05.306685+00:00,2026-04-16T23:27:05.306685+00:00,Chaetodon octofasciatus,高知県以南〜琉球列島；インド・西太平洋,サンゴ礁域,全長約10cm,10m,チョウチョウウオの仲間で、黄色い体に8本の黒い縦縞が入るのが特徴です。内湾のサンゴ礁域や、港の中など、比較的穏やかな環境を好みます。サンゴのポリプを主食としており、ペアや小さな群れでサンゴの周りを泳ぎながらついばむ姿が見られます。サンゴの状態が良い場所で観察しやすい魚です。
25,ハナグロチョウチョウウオ,,2026-04-16T23:27:05.306685+00:00,2026-04-16T23:27:05.306685+00:00,Chaetodon ornatissimus,八丈島、和歌山県以南〜琉球列島、小笠原諸島；インド・太平洋,岩礁域、サンゴ礁域,全長約13cm,15m,チョウチョウウオの仲間で、白い体にオレンジ色の斜め帯が何本も走る美しい模様を持つ。サンゴ礁域に生息し、特にミドリイシなどの枝状サンゴやテーブルサンゴのポリプを主食とする。このため、健全なサンゴ群落がある場所で見られることが多い。通常はペアで行動し、サンゴをつつく姿が観察できる。
26,スミツキトノサマダイ,,2026-04-16T23:27:05.306685+00:00,2026-04-16T23:27:05.306685+00:00,Chaetodon plebeius,南日本の太平洋岸、琉球列島；東部インド洋～西部太平洋の熱帯域,岩礁域、サンゴ礁域,全長約10cm,10m,チョウチョウウオの仲間で、サンゴのポリプを主食とする。体後方の大きな黒い斑点が特徴。サンゴの豊富な場所でペアで行動していることが多い。サンゴの状態の指標となる生物（指標生物）としても知られている。警戒心はやや強い。
27,シテンチョウチョウウオ,,2026-04-16T23:27:05.306685+00:00,2026-04-16T23:27:05.306685+00:00,Chaetodon quadrimaculatus,南日本の太平洋岸、琉球列島、小笠原諸島；中・西部太平洋の熱帯域,サンゴ礁域、水のきれいな潮通しのよい礁斜面,全長約12cm,20m,チョウチョウウオの仲間で、黄色い体と背中にある４つの白い斑点が目印です。主にミドリイシなどサンゴのポリプを好んで食べます。サンゴが豊かな礁斜面で、単独かつがいで行動している姿がよく観察されます。サンゴの枝の間を縫うように泳ぎながら食事をする様子は、観察のしがいがあります。
28,アミチョウチョウウオ,,2026-04-16T23:27:05.306685+00:00,2026-04-16T23:27:05.306685+00:00,Chaetodon rafflesii,南日本の太平洋岸、琉球列島；東部インド洋～中・西部太平洋の熱帯域,サンゴ礁域、サンゴ礁の浅所,全長約12cm,5m,チョウチョウウオの仲間。黄色い体に大きな網目模様が広がり、後頭部に黒い斑点があるのが特徴。サンゴが豊富な浅い海域を好み、単独またはペアで行動している。雑食性で、サンゴのポリプのほか、ゴカイや甲殻類なども食べる。比較的広範囲を泳ぎ回るため、観察しやすい。
29,シチセンチョウチョウウオ,,2026-04-16T23:27:05.306685+00:00,2026-04-16T23:27:05.306685+00:00,Chaetodon punctatofasciatus,八丈島、琉球列島、小笠原諸島；東部インド洋～中・西部太平洋の熱帯域,岩礁域、サンゴ礁域,全長約11cm,5m,チョウチョウウオの仲間で、黄色い体に「く」の字形の黒い縦縞が7本並び、尾鰭の付け根に目玉のような黒い斑点があるのが特徴です。サンゴ礁に生息し、主にサンゴのポリプを食べます。単独またはペアで行動し、サンゴの周りを優雅に泳いでいます。
30,ハクテンカタギ,,2026-04-16T23:27:05.306685+00:00,2026-04-16T23:27:05.306685+00:00,Chaetodon reticulatus,八丈島、高知県、琉球列島、小笠原諸島；中・西部太平洋の熱帯域,サンゴ礁域,全長約12cm,10m,チョウチョウウオの仲間。黒っぽい体色に網目模様が特徴で、後方にある大きな白い斑点がよく目立つ。サンゴのポリプを主食とするため、健全なサンゴ礁域で見られる。主にペアで行動し、寄り添って泳ぐ姿が観察される。他のチョウチョウウオに比べて、やや警戒心が強い。
31,テングチョウチョウウオ,,2026-04-16T23:27:05.306685+00:00,2026-04-16T23:27:05.306685+00:00,Chaetodon selene,南日本の太平洋岸、琉球列島；西部太平洋の熱帯域,岩礁域、サンゴ礁域,全長約14cm,25m,チョウチョウウオの仲間で、黄色い体に三日月型の黒い斑紋が複数入るのが特徴です。比較的深いサンゴ礁の斜面やドロップオフで見られ、単独またはペアで行動します。他のチョウチョウウオと比べてやや深い場所を好む傾向があります。海底近くを泳ぎながら、岩やサンゴの表面についた小動物などを探して食べています。
32,トノサマダイ,,2026-04-16T23:27:05.306685+00:00,2026-04-16T23:27:05.306685+00:00,Chaetodon speculum,南日本の太平洋岸、琉球列島；インド・西太平洋,岩礁域、サンゴ礁域、礁池内の穏やかな所,全長約13cm,10m,チョウチョウウオの仲間で、黄色い体に大きな黒い斑紋が一つだけあるのが特徴です。この斑紋が殿様の家紋のように見えることから名付けられました。サンゴ礁域に生息し、主にサンゴのポリプを食べます。縄張り意識が強く、単独またはペアで行動します。他のチョウチョウウオを追い払う姿が見られることもあります。
33,ヤリカタギ,,2026-04-16T23:27:05.306685+00:00,2026-04-16T23:27:05.306685+00:00,Chaetodon trifascialis,南日本太平洋岸、琉球列島；インド・太平洋,岩礁域、サンゴ礁域,全長約14cm,10m,チョウチョウウオの仲間で、ミドリイシなどのテーブル状サンゴを縄張りにして生活します。白地に「く」の字形の黒い縞模様が特徴です。縄張り意識が非常に強く、他の魚が近づくと激しく追い払います。サンゴのポリプを主食とするため、サンゴの状態が良い場所でしか見ることができません。
34,ミスジチョウチョウウオ,,2026-04-16T23:27:05.306685+00:00,2026-04-16T23:27:05.306685+00:00,Chaetodon lunulatus,南日本の太平洋岸、琉球列島；東部,岩礁域、サンゴ礁域,全長約12cm,5m,チョウチョウウオの仲間で、サンゴのポリプを主食とします。体に沿って走る複数の斜めの縞模様が特徴です。よく似たアミメチョウチョウウオとは、尾ビレの付け根の黒い模様の有無で見分けられます。常にペアで行動し、サンゴの周りを熱心に餌を探して泳ぎ回っています。
35,スダレチョウチョウウオ,,2026-04-16T23:27:05.306685+00:00,2026-04-16T23:27:05.306685+00:00,Chaetodon ulietensis,南日本の太平洋岸、琉球列島；東部インド洋～中・西部太平洋の熱帯域,サンゴ礁域、サンゴ礁外縁,全長約12cm,15m,チョウチョウウオの仲間で、白い体に「すだれ」のような斜めの黒い縞模様が入るのが特徴。サンゴ礁や岩礁域でペアまたは小さな群れで行動する。雑食性で、サンゴのポリプや付着生物などを食べる。比較的ダイバーを恐れないため観察しやすい。
36,イッテンチョウチョウウオ,,2026-04-16T23:27:05.306685+00:00,2026-04-16T23:27:05.306685+00:00,Chaetodon unimaculatus,南日本の太平洋岸、琉球列島、小笠原諸島；東部インド洋〜中・西部太平洋の熱帯域,岩礁域、サンゴ礁域,全長約12cm,15m,チョウチョウウオの仲間で、サンゴ礁や岩礁域でペアで行動していることが多いです。白い体に、背中の中央にある大きな黒い斑点が名前の由来です。この斑点は、捕食者の目を欺くための眼状紋と考えられています。サンゴのポリプや小型の甲殻類などを食べます。ダイバーにも比較的慣れやすい魚です。
37,フウライチョウチョウウオ,,2026-04-16T23:27:05.306685+00:00,2026-04-16T23:27:05.306685+00:00,Chaetodon vagabundus,南日本の太平洋岸、琉球列島；インド・太平洋,岩礁域、サンゴ礁域,全長約23cm,3-30m,チョウチョウウオの仲間で、サンゴ礁や岩礁域で広く見られる。白い体に「く」の字形の黒い線が並び、体の後方に太い黒帯、目を通る黒帯があるのが特徴。雑食性で、サンゴのポリプや藻類、小型の甲殻類などを食べる。ペアで行動していることが多く、ダイビング中に1匹見つけたら、近くにもう1匹いないか探してみるとよい。
38,ツキチョウチョウウオ,,2026-04-16T23:27:05.306685+00:00,2026-04-16T23:27:05.306685+00:00,Chaetodon wiebeli,南日本の太平洋岸、琉球列島、朝鮮半島、台湾～タイランド湾までの南シナ海,岩礁域、サンゴ礁域,全長約20cm,5m,チョウチョウウオの仲間で、黄色い体に目の後ろから背ビレにかけて黒い帯が走るのが特徴です。岩礁域やサンゴ礁に生息し、ペアで行動していることが多いです。主に岩に付着した藻類や小さな無脊椎動物を食べます。他のチョウチョウウオの群れに混じっていることもあります。日本の温帯域でも見られるポピュラーな種です。
39,アミメチョウチョウウオ,,2026-04-16T23:27:05.306685+00:00,2026-04-16T23:27:05.306685+00:00,Chaetodon xanthurus,南日本の太平洋岸、琉球列島；西部太平洋の熱帯域,岩礁域、サンゴ礁域,全長約10cm,20m,チョウチョウウオの仲間。白い体に斜めに走る網目模様と、黄色い尾びれが特徴。サンゴ礁の斜面やガレ場で見られ、単独またはペアで行動する。サンゴのポリプや底生の小動物を食べる。他のチョウチョウウオ類と混泳していることもあり、その美しい模様は水中でもよく目立つ。
40,オウギチョウチョウウオ,,2026-04-16T23:27:05.306685+00:00,2026-04-16T23:27:05.306685+00:00,Chaetodon meyeri,琉球列島；インド・汎太平洋,サンゴ礁域,全長約12cm,10m,チョウチョウウオの仲間で、白地に黒い斜めの帯模様が扇のように入るのが特徴です。サンゴ礁域に生息しますが、個体数はあまり多くありません。主にサンゴのポリプを食べて生活しており、単独かペアで行動します。サンゴの群落を探すと、ついばむように食事をしている姿を見つけられることがあります。
41,レモンチョウチョウウオ,,2026-04-16T23:27:05.306685+00:00,2026-04-16T23:27:05.306685+00:00,Chaetodon semeion,和歌山県以南～琉球列島；インド・太平洋,岩礁域、サンゴ礁域,全長約13cm,10m,チョウチョウウオの仲間で、黄色い体に大きな黒い斑点が一つあるのが特徴です。サンゴが豊かな場所に単独またはペアで生息しています。サンゴのポリプを主食とします。他のチョウチョウウオに比べてやや深い水深で見られることが多く、優雅に泳ぐ姿はダイバーに人気があります。
